"No.","Time","Source","Destination","Protocol","Length","Info"
"1","0.000000","1.1.33.158","1.2.156.163","SSLv3","1475","Application Data"
"2","0.000002","1.1.23.218","1.2.31.193","SSLv3","163","Application Data"
"3","0.000004","1.2.84.77","1.1.252.248","TCP","70","443  >  22794 [ACK] Seq=1 Ack=1 Win=49232 Len=0 TSval=591811613 TSecr=301244023"
"4","0.000004","1.1.71.180","1.2.79.35","SSLv3","1475","Application Data"
"5","0.000005","1.1.41.222","1.2.129.94","SSLv3","136","Application Data"
"6","0.000006","1.1.229.71","1.2.90.5","SSLv3","136","Application Data"
"7","0.000010","1.1.66.83","1.2.254.104","TCP","70","1827  >  443 [ACK] Seq=1 Ack=1 Win=41992 Len=0 TSval=301244421 TSecr=591811348"
"8","0.000011","1.2.233.222","1.1.226.59","SSLv3","906","Application Data"
"9","0.000012","1.1.136.18","1.2.243.46","SSLv3","136","Application Data"
"10","0.000015","1.2.69.190","1.1.61.224","TCP","70","443  >  19066 [ACK] Seq=1 Ack=1 Win=46336 Len=0 TSval=591811699 TSecr=301243327"
"11","0.000016","1.1.227.247","1.2.96.49","SSLv3","1475","Application Data"
"12","0.000017","1.1.221.225","1.2.113.188","SSLv3","135","Application Data"
"13","0.000019","1.2.156.163","1.1.33.158","TCP","70","443  >  41319 [ACK] Seq=1 Ack=1406 Win=49232 Len=0 TSval=591811733 TSecr=301244337"
"14","0.000020","1.1.51.184","1.2.59.249","SSLv3","1475","Application Data"
"15","0.000025","1.2.79.227","1.1.72.11","SSLv3","1418","Application Data"
"16","0.000028","1.2.60.230","1.1.53.44","SSLv3","1418","Application Data"
"17","0.000029","1.2.71.224","1.1.63.165","SSLv3","483","Application Data"
"18","0.000032","1.1.213.5","1.2.220.174","SSLv3","1475","Application Data"
"19","0.000033","1.1.1.95","1.2.189.119","TCP","70","3634  >  443 [ACK] Seq=1 Ack=1 Win=40544 Len=0 TSval=301244595 TSecr=591811456"
"20","0.000033","1.1.166.216","1.2.26.232","SSLv3","1475","Application Data"
"21","0.000033","1.2.194.247","1.1.223.136","SSLv3","1418","Application Data"
"22","0.000036","1.1.247.245","1.2.80.31","SSLv3","1475","Application Data"
"23","0.000038","1.1.197.143","1.2.206.53","SSLv3","1475","Application Data"
"24","0.000039","1.1.172.83","1.2.171.237","TCP","70","9382  >  443 [ACK] Seq=1 Ack=1 Win=40544 Len=0 TSval=301244648 TSecr=591811547"
"25","0.000040","1.1.226.59","1.2.233.222","TCP","70","25241  >  443 [ACK] Seq=1 Ack=837 Win=41992 Len=0 TSval=301244661 TSecr=591811668"
"26","0.000043","1.2.243.46","1.1.136.18","TCP","70","443  >  19437 [ACK] Seq=1 Ack=67 Win=47784 Len=0 TSval=591811922 TSecr=301244436"
"27","0.000044","1.1.115.3","1.2.123.127","SSLv3","1475","Application Data"
"28","0.000046","1.1.179.37","1.2.167.23","SSLv3","1475","Application Data"
"29","0.000047","1.1.112.221","1.2.204.68","SSLv3","135","Application Data"
"30","0.000049","1.2.167.245","1.1.184.58","SSLv3","483","Application Data"
"31","0.000049","1.2.71.67","1.1.139.64","TCP","70","443  >  1026 [ACK] Seq=1 Ack=1 Win=49232 Len=0 TSval=591811975 TSecr=301244212"
"32","0.000050","1.1.187.230","1.2.24.211","SSLv3","1475","Application Data"
"33","0.000051","1.1.138.32","1.2.72.176","TCP","70","19803  >  443 [ACK] Seq=1 Ack=1 Win=39096 Len=0 TSval=301244740 TSecr=591811378"
"34","0.000051","1.1.8.77","1.2.164.237","SSLv3","1475","Application Data"
"35","0.000052","1.2.211.103","1.1.212.15","SSLv3","1418","Application Data"
"36","0.000053","1.2.113.173","1.1.210.110","SSLv3","483","Application Data"
"37","0.000054","1.2.59.249","1.1.51.184","TCP","70","443  >  36027 [ACK] Seq=1 Ack=1406 Win=49232 Len=0 TSval=591812009 TSecr=301244492"
"38","0.000056","1.1.53.44","1.2.60.230","TCP","70","36268  >  443 [ACK] Seq=1 Ack=1349 Win=40544 Len=0 TSval=301244791 TSecr=591811803"
"39","0.000061","1.1.63.165","1.2.71.224","TCP","70","19613  >  443 [ACK] Seq=1 Ack=414 Win=39096 Len=0 TSval=301244831 TSecr=591811812"
"40","0.000062","1.2.216.103","1.1.212.235","SSLv3","483","Application Data"
"41","0.000063","1.2.180.230","1.1.205.83","TCP","70","443  >  47521 [ACK] Seq=1 Ack=1 Win=50680 Len=0 TSval=591812085 TSecr=301244319"
"42","0.000064","1.1.223.136","1.2.194.247","TCP","70","31670  >  443 [ACK] Seq=1 Ack=1349 Win=40544 Len=0 TSval=301244854 TSecr=591811847"
"43","0.000065","1.2.208.195","1.1.233.37","TCP","70","443  >  54654 [ACK] Seq=1 Ack=1 Win=47784 Len=0 TSval=591812100 TSecr=301244313"
"44","0.000068","1.2.19.12","1.1.11.195","SSLv3","1418","Application Data"
"45","0.000070","1.2.171.122","1.1.23.76","SSLv3","906","Application Data"
"46","0.000070","1.2.229.227","1.1.73.219","TCP","70","443  >  22176 [ACK] Seq=1 Ack=1 Win=43440 Len=0 TSval=591812142 TSecr=301244107"
"47","0.000070","1.2.26.232","1.1.166.216","TCP","70","443  >  45999 [ACK] Seq=1 Ack=1406 Win=52128 Len=0 TSval=591812142 TSecr=301244597"
"48","0.000072","1.2.79.35","1.1.71.180","TCP","70","443  >  65486 [ACK] Seq=1 Ack=1406 Win=43440 Len=0 TSval=591812158 TSecr=301244367"
"49","0.000073","1.2.39.118","1.1.31.166","TCP","70","443  >  11313 [ACK] Seq=1 Ack=1 Win=49232 Len=0 TSval=591812165 TSecr=301243817"
"50","0.000074","1.2.123.127","1.1.115.3","TCP","70","443  >  52286 [ACK] Seq=1 Ack=1406 Win=49232 Len=0 TSval=591812174 TSecr=301244686"
"51","0.000074","1.1.159.90","1.2.54.222","SSLv3","1475","Application Data"
"52","0.000075","1.1.184.58","1.2.167.245","TCP","70","6329  >  443 [ACK] Seq=1 Ack=414 Win=39096 Len=0 TSval=301244934 TSecr=591811971"
"53","0.000078","1.2.14.81","1.1.6.206","SSLv3","906","Application Data"
"54","0.000078","1.2.126.209","1.1.118.220","TCP","70","443  >  33684 [ACK] Seq=1 Ack=1 Win=52128 Len=0 TSval=591812206 TSecr=301244155"
"55","0.000078","1.2.80.31","1.1.247.245","TCP","70","443  >  21726 [ACK] Seq=1 Ack=1406 Win=49232 Len=0 TSval=591812207 TSecr=301244617"
"56","0.000079","1.1.240.49","1.2.255.184","SSLv3","1475","Application Data"
"57","0.000080","1.1.36.205","1.2.47.250","SSLv3","1475","Application Data"
"58","0.000082","1.1.210.110","1.2.113.173","TCP","70","30296  >  443 [ACK] Seq=1 Ack=414 Win=39096 Len=0 TSval=301244998 TSecr=591812006"
"59","0.000083","1.2.24.211","1.1.187.230","TCP","70","443  >  45455 [ACK] Seq=1 Ack=1406 Win=49232 Len=0 TSval=591812240 TSecr=301244730"
"60","0.000084","1.2.250.56","1.1.70.176","TCP","70","443  >  21241 [ACK] Seq=1 Ack=1 Win=50680 Len=0 TSval=591812250 TSecr=301244187"
"61","0.000084","1.1.47.72","1.2.54.235","TCP","70","15271  >  443 [ACK] Seq=1 Ack=1 Win=41992 Len=0 TSval=301245015 TSecr=591811055"
"62","0.000086","1.2.129.94","1.1.41.222","TCP","70","443  >  14880 [ACK] Seq=1 Ack=67 Win=47784 Len=0 TSval=591812268 TSecr=301244377"
"63","0.000087","1.1.212.235","1.2.216.103","TCP","70","56599  >  443 [ACK] Seq=1 Ack=414 Win=39096 Len=0 TSval=301245037 TSecr=591812077"
"64","0.000092","1.2.35.66","1.1.27.145","TCP","70","443  >  10238 [ACK] Seq=1 Ack=1 Win=49232 Len=0 TSval=591812317 TSecr=301244088"
"65","0.000092","1.1.213.246","1.2.105.170","SSLv3","1475","Application Data"
"66","0.000093","1.2.54.222","1.1.159.90","TCP","70","443  >  15259 [ACK] Seq=1 Ack=1406 Win=49232 Len=0 TSval=591812326 TSecr=301244924"
"67","0.000093","1.1.212.15","1.2.211.103","TCP","70","57380  >  443 [ACK] Seq=1 Ack=1349 Win=40544 Len=0 TSval=301245083 TSecr=591811997"
"68","0.000095","1.1.72.11","1.2.79.227","TCP","70","59551  >  443 [ACK] Seq=1 Ack=1349 Win=40544 Len=0 TSval=301245105 TSecr=591811776"
"69","0.000096","1.2.96.49","1.1.227.247","TCP","70","443  >  55533 [ACK] Seq=1 Ack=1406 Win=49232 Len=0 TSval=591812345 TSecr=301244457"
"70","0.000096","1.1.245.8","1.2.72.3","SSLv3","163","Application Data"
"71","0.000101","1.1.6.206","1.2.14.81","TCP","70","48913  >  443 [ACK] Seq=1 Ack=837 Win=41992 Len=0 TSval=301245152 TSecr=591812200"
"72","0.000102","1.1.11.195","1.2.19.12","TCP","70","43976  >  443 [ACK] Seq=1 Ack=1349 Win=40544 Len=0 TSval=301245160 TSecr=591812127"
"73","0.000104","1.2.104.182","1.1.213.65","SSLv3","906","Application Data"
"74","0.000104","1.2.31.193","1.1.23.218","TCP","70","443  >  9341 [ACK] Seq=1 Ack=94 Win=50680 Len=0 TSval=591812414 TSecr=301244347"
"75","0.000104","1.2.90.5","1.1.229.71","TCP","70","443  >  62146 [ACK] Seq=1 Ack=67 Win=47784 Len=0 TSval=591812415 TSecr=301244379"
"76","0.000104","1.2.220.174","1.1.213.5","TCP","70","443  >  57708 [ACK] Seq=1 Ack=1406 Win=46336 Len=0 TSval=591812415 TSecr=301244586"
"77","0.000109","1.2.113.188","1.1.221.225","TCP","70","443  >  51830 [ACK] Seq=1 Ack=66 Win=44888 Len=0 TSval=591812454 TSecr=301244467"
"78","0.000111","1.1.250.175","1.2.87.134","SSLv3","1475","Application Data"
"79","0.000112","1.1.23.76","1.2.171.122","TCP","70","38963  >  443 [ACK] Seq=1 Ack=837 Win=41992 Len=0 TSval=301245227 TSecr=591812136"
"80","0.000112","1.1.61.174","1.2.252.191","SSLv3","135","Application Data"
"81","0.000112","1.2.164.237","1.1.8.77","TCP","70","443  >  43434 [ACK] Seq=1 Ack=1406 Win=46336 Len=0 TSval=591812475 TSecr=301244744"
"82","0.000112","1.2.167.23","1.1.179.37","TCP","70","443  >  6111 [ACK] Seq=1 Ack=1406 Win=49232 Len=0 TSval=591812477 TSecr=301244701"
"83","0.000118","1.2.206.53","1.1.197.143","TCP","70","443  >  32508 [ACK] Seq=1 Ack=1406 Win=52128 Len=0 TSval=591812520 TSecr=301244638"
"84","0.000119","1.2.204.68","1.1.112.221","TCP","70","443  >  53503 [ACK] Seq=1 Ack=66 Win=44888 Len=0 TSval=591812534 TSecr=301244713"
"85","0.000120","1.1.86.90","1.2.234.64","SSLv3","163","Application Data"
"86","0.000120","1.1.162.128","1.2.170.1","SSLv3","163","Application Data"
"87","0.000125","1.1.131.80","1.2.63.94","SSLv3","1475","Application Data"
"88","0.000126","1.1.136.41","1.2.67.202","SSLv3","163","Application Data"
"89","0.000128","1.1.230.92","1.2.93.174","SSLv3","1475","Application Data"
"90","0.000129","1.2.75.231","1.1.68.113","SSLv3","1418","Application Data"
"91","0.000130","1.2.87.134","1.1.250.175","TCP","70","443  >  23617 [ACK] Seq=1 Ack=1406 Win=43440 Len=0 TSval=591812618 TSecr=301245218"
"92","0.000133","1.2.166.226","1.1.190.207","SSLv3","1418","Application Data"
"93","0.000138","1.2.147.225","1.1.148.78","SSLv3","483","Application Data"
"94","0.000137","1.1.15.159","1.2.163.177","SSLv3","1475","Application Data"
"95","0.000138","1.1.221.9","1.2.196.195","SSLv3","1475","Application Data"
"96","0.000139","1.1.104.108","1.2.196.255","SSLv3","163","Application Data"
"97","0.000140","1.1.56.147","1.2.244.125","SSLv3","1475","Application Data"
"98","0.000141","1.1.242.117","1.2.77.133","SSLv3","136","Application Data"
"99","0.000140","1.2.29.208","1.1.162.35","SSLv3","1418","Application Data"
"100","0.000146","1.2.206.222","1.1.218.137","SSLv3","483","Application Data"
"101","0.000150","1.1.169.13","1.2.36.184","SSLv3","163","Application Data"
"102","0.000157","1.1.61.2","1.2.69.239","SSLv3","1475","Application Data"
"103","0.000158","1.2.201.223","1.1.117.209","SSLv3","483","Application Data"
"104","0.000158","1.2.47.250","1.1.36.205","TCP","70","443  >  34999 [ACK] Seq=1 Ack=1406 Win=46336 Len=0 TSval=591812846 TSecr=301244977"
"105","0.000161","1.1.70.187","1.2.78.105","SSLv3","1475","Application Data"
"106","0.000163","1.1.221.237","1.2.113.228","SSLv3","1475","Application Data"
"107","0.000164","1.1.44.113","1.2.135.254","SSLv3","1475","Application Data"
"108","0.000165","1.1.161.232","1.2.169.167","SSLv3","1475","Application Data"
"109","0.000166","1.1.143.189","1.2.67.99","SSLv3","136","Application Data"
"110","0.000168","1.1.26.91","1.2.34.73","SSLv3","1475","Application Data"
"111","0.000169","1.2.110.2","1.1.102.68","SSLv3","1418","Application Data"
"112","0.000169","1.1.202.5","1.2.6.64","SSLv3","1475","Application Data"
"113","0.000170","1.2.63.94","1.1.131.80","TCP","70","443  >  17442 [ACK] Seq=1 Ack=1406 Win=49232 Len=0 TSval=591812938 TSecr=301245336"
"114","0.000170","1.2.16.160","1.1.189.4","SSLv3","483","Application Data"
"115","0.000170","1.1.184.7","1.2.23.143","SSLv3","1475","Application Data"
"116","0.000171","1.1.74.84","1.2.230.103","SSLv3","1475","Application Data"
"117","0.000172","1.1.24.18","1.2.32.38","SSLv3","1475","Application Data"
"118","0.000174","1.2.196.255","1.1.104.108","TCP","70","443  >  30139 [ACK] Seq=1 Ack=94 Win=50680 Len=0 TSval=591812971 TSecr=301245449"
"119","0.000174","1.2.72.3","1.1.245.8","TCP","70","443  >  1217 [ACK] Seq=1 Ack=94 Win=50680 Len=0 TSval=591812972 TSecr=301245111"
"120","0.000174","1.1.102.93","1.2.217.196","SSLv3","135","Application Data"
"121","0.000181","1.2.97.46","1.1.237.113","SSLv3","906","Application Data"
"122","0.000182","1.2.170.1","1.1.162.128","TCP","70","443  >  8892 [ACK] Seq=1 Ack=94 Win=50680 Len=0 TSval=591813032 TSecr=301245305"
"123","0.000184","1.2.135.254","1.1.44.113","TCP","70","443  >  33977 [ACK] Seq=1 Ack=1406 Win=49232 Len=0 TSval=591813049 TSecr=301245643"
"124","0.000184","1.1.19.154","1.2.27.77","SSLv3","163","Application Data"
"125","0.000184","1.2.234.64","1.1.86.90","TCP","70","443  >  25340 [ACK] Seq=1 Ack=94 Win=50680 Len=0 TSval=591813055 TSecr=301245303"
"126","0.000185","1.1.51.85","1.2.143.168","SSLv3","136","Application Data"
"127","0.000188","1.2.217.196","1.1.102.93","TCP","70","443  >  29325 [ACK] Seq=1 Ack=66 Win=44888 Len=0 TSval=591813087 TSecr=301245736"
"128","0.000191","1.2.163.177","1.1.15.159","TCP","70","443  >  45170 [ACK] Seq=1 Ack=1406 Win=52128 Len=0 TSval=591813107 TSecr=301245430"
"129","0.000194","1.2.34.73","1.1.26.91","TCP","70","443  >  39687 [ACK] Seq=1 Ack=1406 Win=46336 Len=0 TSval=591813129 TSecr=301245674"
"130","0.000193","1.1.76.228","1.2.224.173","SSLv3","1475","Application Data"
"131","0.000195","1.1.107.185","1.2.115.241","SSLv3","1475","Application Data"
"132","0.000198","1.1.66.13","1.2.254.24","SSLv3","1475","Application Data"
"133","0.000199","1.1.218.215","1.2.194.234","SSLv3","1475","Application Data"
"134","0.000200","1.1.234.253","1.2.210.229","SSLv3","1475","Application Data"
"135","0.000201","1.2.105.170","1.1.213.246","TCP","70","443  >  57954 [ACK] Seq=1 Ack=1406 Win=49232 Len=0 TSval=591813191 TSecr=301245072"
"136","0.000202","1.2.32.38","1.1.24.18","TCP","70","443  >  9443 [ACK] Seq=1 Ack=1406 Win=49232 Len=0 TSval=591813196 TSecr=301245712"
"137","0.000202","1.1.252.115","1.2.228.15","SSLv3","1475","Application Data"
"138","0.000203","1.1.155.180","1.2.140.53","SSLv3","163","Application Data"
"139","0.000205","1.1.79.160","1.2.86.248","SSLv3","1475","Application Data"
"140","0.000207","1.1.148.78","1.2.147.225","TCP","70","11420  >  443 [ACK] Seq=1 Ack=414 Win=39096 Len=0 TSval=301245986 TSecr=591812681"
"141","0.000209","1.2.255.184","1.1.240.49","TCP","70","443  >  20597 [ACK] Seq=1 Ack=1406 Win=52128 Len=0 TSval=591813253 TSecr=301244964"
"142","0.000211","1.2.67.202","1.1.136.41","TCP","70","443  >  62605 [ACK] Seq=1 Ack=94 Win=50680 Len=0 TSval=591813264 TSecr=301245345"
"143","0.000211","1.1.143.78","1.2.247.6","SSLv3","136","Application Data"
"144","0.000212","1.2.78.105","1.1.70.187","TCP","70","443  >  21284 [ACK] Seq=1 Ack=1406 Win=49232 Len=0 TSval=591813278 TSecr=301245624"
"145","0.000215","1.1.213.65","1.2.104.182","TCP","70","57710  >  443 [ACK] Seq=1 Ack=837 Win=41992 Len=0 TSval=301246060 TSecr=591812408"
"146","0.000215","1.1.162.35","1.2.29.208","TCP","70","8856  >  443 [ACK] Seq=1 Ack=1349 Win=40544 Len=0 TSval=301246066 TSecr=591812702"
"147","0.000216","1.1.21.236","1.2.33.59","SSLv3","136","Application Data"
"148","0.000220","1.2.93.174","1.1.230.92","TCP","70","443  >  61040 [ACK] Seq=1 Ack=1406 Win=46336 Len=0 TSval=591813337 TSecr=301245357"
"149","0.000221","1.2.244.125","1.1.56.147","TCP","70","443  >  17722 [ACK] Seq=1 Ack=1406 Win=49232 Len=0 TSval=591813350 TSecr=301245450"
"150","0.000221","1.1.90.113","1.2.97.209","SSLv3","1475","Application Data"
"151","0.000222","1.1.151.104","1.2.158.211","SSLv3","135","Application Data"
"152","0.000222","1.1.190.207","1.2.166.226","TCP","70","6047  >  443 [ACK] Seq=1 Ack=1349 Win=40544 Len=0 TSval=301246110 TSecr=591812647"
"153","0.000222","1.2.36.184","1.1.169.13","TCP","70","443  >  10610 [ACK] Seq=1 Ack=94 Win=50680 Len=0 TSval=591813356 TSecr=301245541"
"154","0.000223","1.1.68.113","1.2.75.231","TCP","70","64678  >  443 [ACK] Seq=1 Ack=1349 Win=40544 Len=0 TSval=301246124 TSecr=591812609"
"155","0.000224","1.2.77.30","1.1.241.141","SSLv3","1418","Application Data"
"156","0.000230","1.2.203.201","1.1.119.42","SSLv3","1418","Application Data"
"157","0.000231","1.2.67.99","1.1.143.189","TCP","70","443  >  62499 [ACK] Seq=1 Ack=67 Win=47784 Len=0 TSval=591813427 TSecr=301245662"
"158","0.000231","1.2.169.167","1.1.161.232","TCP","70","443  >  8806 [ACK] Seq=1 Ack=1406 Win=49232 Len=0 TSval=591813428 TSecr=301245653"
"159","0.000232","1.2.210.229","1.1.234.253","TCP","70","443  >  27554 [ACK] Seq=1 Ack=1406 Win=46336 Len=0 TSval=591813434 TSecr=301245936"
"160","0.000232","1.1.37.207","1.2.46.60","SSLv3","1475","Application Data"
"161","0.000233","1.1.218.137","1.2.206.222","TCP","70","32670  >  443 [ACK] Seq=1 Ack=414 Win=39096 Len=0 TSval=301246195 TSecr=591812747"
"162","0.000233","1.1.186.133","1.2.161.233","SSLv3","163","Application Data"
"163","0.000233","1.1.56.38","1.2.64.171","SSLv3","136","Application Data"
"164","0.000233","1.1.224.249","1.2.92.249","SSLv3","136","Application Data"
"165","0.000235","1.2.69.239","1.1.61.2","TCP","70","443  >  19124 [ACK] Seq=1 Ack=1406 Win=46336 Len=0 TSval=591813462 TSecr=301245587"
"166","0.000236","1.2.245.29","1.1.141.81","SSLv3","483","Application Data"
"167","0.000238","1.1.189.4","1.2.16.160","TCP","70","43352  >  443 [ACK] Seq=1 Ack=414 Win=39096 Len=0 TSval=301246243 TSecr=591812939"
"168","0.000239","1.2.230.103","1.1.74.84","TCP","70","443  >  60195 [ACK] Seq=1 Ack=1406 Win=49232 Len=0 TSval=591813490 TSecr=301245703"
"169","0.000241","1.2.77.133","1.1.242.117","TCP","70","443  >  65088 [ACK] Seq=1 Ack=67 Win=47784 Len=0 TSval=591813507 TSecr=301245460"
"170","0.000243","1.1.175.94","1.2.151.2","SSLv3","163","Application Data"
"171","0.000243","1.1.252.116","1.2.228.68","SSLv3","136","Application Data"
"172","0.000244","1.1.117.209","1.2.201.223","TCP","70","33437  >  443 [ACK] Seq=1 Ack=414 Win=39096 Len=0 TSval=301246297 TSecr=591812843"
"173","0.000245","1.2.252.191","1.1.61.174","TCP","70","443  >  1400 [ACK] Seq=1 Ack=66 Win=44888 Len=0 TSval=591813539 TSecr=301245237"
"174","0.000246","1.2.247.6","1.1.143.78","TCP","70","443  >  18368 [ACK] Seq=1 Ack=67 Win=47784 Len=0 TSval=591813545 TSecr=301246032"
"175","0.000246","1.1.102.19","1.2.109.249","SSLv3","136","Application Data"
"176","0.000247","1.1.3.90","1.2.12.59","SSLv3","136","Application Data"
"177","0.000249","1.2.27.77","1.1.19.154","TCP","70","443  >  44043 [ACK] Seq=1 Ack=94 Win=50680 Len=0 TSval=591813570 TSecr=301245811"
"178","0.000250","1.2.23.143","1.1.184.7","TCP","70","443  >  45128 [ACK] Seq=1 Ack=1406 Win=46336 Len=0 TSval=591813583 TSecr=301245693"
"179","0.000253","1.2.244.70","1.1.56.101","SSLv3","483","Application Data"
"180","0.000254","1.2.196.195","1.1.221.9","TCP","70","443  >  30086 [ACK] Seq=1 Ack=1406 Win=49232 Len=0 TSval=591813611 TSecr=301245439"
"181","0.000256","1.2.161.233","1.1.186.133","TCP","70","443  >  42657 [ACK] Seq=1 Ack=94 Win=50680 Len=0 TSval=591813626 TSecr=301246196"
"182","0.000255","1.1.158.169","1.2.134.128","SSLv3","1475","Application Data"
"183","0.000259","1.2.151.2","1.1.175.94","TCP","70","443  >  10177 [ACK] Seq=1 Ack=94 Win=50680 Len=0 TSval=591813648 TSecr=301246287"
"184","0.000259","1.2.224.173","1.1.76.228","TCP","70","443  >  22886 [ACK] Seq=1 Ack=1406 Win=46336 Len=0 TSval=591813650 TSecr=301245880"
"185","0.000259","1.1.237.20","1.2.213.138","SSLv3","1475","Application Data"
"186","0.000260","1.1.125.177","1.2.8.177","SSLv3","135","Application Data"
"187","0.000260","1.1.102.68","1.2.110.2","TCP","70","57019  >  443 [ACK] Seq=1 Ack=1349 Win=40544 Len=0 TSval=301246426 TSecr=591812929"
"188","0.000265","1.2.143.168","1.1.51.85","TCP","70","443  >  35951 [ACK] Seq=1 Ack=67 Win=47784 Len=0 TSval=591813701 TSecr=301245821"
"189","0.000266","1.2.113.228","1.1.221.237","TCP","70","443  >  51869 [ACK] Seq=1 Ack=1406 Win=49232 Len=0 TSval=591813706 TSecr=301245633"
"190","0.000273","1.2.115.241","1.1.107.185","TCP","70","443  >  30900 [ACK] Seq=1 Ack=1406 Win=52128 Len=0 TSval=591813765 TSecr=301245891"
"191","0.000276","1.2.6.64","1.1.202.5","TCP","70","443  >  46848 [ACK] Seq=1 Ack=1406 Win=49232 Len=0 TSval=591813784 TSecr=301245683"
"192","0.000283","1.2.228.68","1.1.252.116","TCP","70","443  >  59652 [ACK] Seq=1 Ack=67 Win=47784 Len=0 TSval=591813840 TSecr=301246288"
"193","0.000285","1.2.64.171","1.1.56.38","TCP","70","443  >  17769 [ACK] Seq=1 Ack=67 Win=47784 Len=0 TSval=591813863 TSecr=301246204"
"194","0.000291","1.1.56.101","1.2.244.70","TCP","70","63743  >  443 [ACK] Seq=1 Ack=414 Win=39096 Len=0 TSval=301246674 TSecr=591813606"
"195","0.000295","1.2.33.59","1.1.21.236","TCP","70","443  >  9720 [ACK] Seq=1 Ack=67 Win=47784 Len=0 TSval=591813943 TSecr=301246070"
"196","0.000299","1.2.194.234","1.1.218.215","TCP","70","443  >  51111 [ACK] Seq=1 Ack=1406 Win=49232 Len=0 TSval=591813970 TSecr=301245926"
"197","0.000301","1.1.101.191","1.2.109.169","SSLv3","1475","Application Data"
"198","0.000306","1.2.254.24","1.1.66.13","TCP","70","443  >  1747 [ACK] Seq=1 Ack=1406 Win=49232 Len=0 TSval=591814024 TSecr=301245917"
"199","0.000313","1.1.143.99","1.2.247.107","SSLv3","163","Application Data"
"200","0.000313","1.2.140.53","1.1.155.180","TCP","70","443  >  37118 [ACK] Seq=1 Ack=94 Win=50680 Len=0 TSval=591814084 TSecr=301245955"
"201","0.000316","1.2.83.45","1.1.75.144","SSLv3","1418","Application Data"
"202","0.000318","1.2.97.209","1.1.90.113","TCP","70","443  >  26255 [ACK] Seq=1 Ack=1406 Win=46336 Len=0 TSval=591814120 TSecr=301246097"
"203","0.000318","1.2.228.15","1.1.252.115","TCP","70","443  >  21711 [ACK] Seq=1 Ack=1406 Win=46336 Len=0 TSval=591814120 TSecr=301245946"
"204","0.000319","1.2.46.60","1.1.37.207","TCP","70","443  >  13047 [ACK] Seq=1 Ack=1406 Win=46336 Len=0 TSval=591814135 TSecr=301246186"
"205","0.000322","1.1.119.155","1.2.203.51","SSLv3","1475","Application Data"
"206","0.000323","1.1.237.113","1.2.97.46","TCP","70","26104  >  443 [ACK] Seq=1 Ack=837 Win=41992 Len=0 TSval=301246915 TSecr=591813025"
"207","0.000322","1.2.190.40","1.1.181.178","SSLv3","483","Application Data"
"208","0.000323","1.2.109.249","1.1.102.19","TCP","70","443  >  29375 [ACK] Seq=1 Ack=67 Win=47784 Len=0 TSval=591814167 TSecr=301246311"
"209","0.000325","1.2.92.249","1.1.224.249","TCP","70","443  >  25005 [ACK] Seq=1 Ack=67 Win=47784 Len=0 TSval=591814180 TSecr=301246209"
"210","0.000331","1.2.86.248","1.1.79.160","TCP","70","443  >  23481 [ACK] Seq=1 Ack=1406 Win=46336 Len=0 TSval=591814228 TSecr=301245977"
"211","0.000330","1.1.189.152","1.2.17.119","SSLv3","1475","Application Data"
"212","0.000331","1.1.241.141","1.2.77.30","TCP","70","20961  >  443 [ACK] Seq=1 Ack=1349 Win=40544 Len=0 TSval=301246984 TSecr=591813374"
"213","0.000334","1.1.92.30","1.2.215.193","SSLv3","1475","Application Data"
"214","0.000337","1.1.40.207","1.2.132.149","SSLv3","1475","Application Data"
"215","0.000337","1.2.211.182","1.1.232.104","SSLv3","1418","Application Data"
"216","0.000339","1.2.8.177","1.1.125.177","TCP","70","443  >  49513 [ACK] Seq=1 Ack=66 Win=44888 Len=0 TSval=591814288 TSecr=301246415"
"217","0.000338","1.1.199.106","1.2.206.186","SSLv3","1475","Application Data"
"218","0.000339","1.2.24.38","1.1.16.59","SSLv3","1418","Application Data"
"219","0.000340","1.2.12.59","1.1.3.90","TCP","70","443  >  4342 [ACK] Seq=1 Ack=67 Win=47784 Len=0 TSval=591814298 TSecr=301246318"
"220","0.000346","1.1.124.91","1.2.179.137","SSLv3","163","Application Data"
"221","0.000347","1.2.213.138","1.1.237.20","TCP","70","443  >  26189 [ACK] Seq=1 Ack=1406 Win=46336 Len=0 TSval=591814354 TSecr=301246406"
"222","0.000349","1.1.119.80","1.2.183.52","SSLv3","163","Application Data"
"223","0.000351","1.1.141.225","1.2.240.209","SSLv3","163","Application Data"
"224","0.000352","1.1.202.157","1.2.6.153","SSLv3","163","Application Data"
"225","0.000353","1.1.75.177","1.2.83.113","SSLv3","136","Application Data"
"226","0.000354","1.2.68.116","1.1.142.213","SSLv3","1418","Application Data"
"227","0.000355","1.2.201.55","1.1.193.11","SSLv3","483","Application Data"
"228","0.000356","1.1.55.245","1.2.63.221","SSLv3","1475","Application Data"
"229","0.000358","1.1.159.166","1.2.135.79","SSLv3","136","Application Data"
"230","0.000358","1.2.147.82","1.1.171.118","SSLv3","906","Application Data"
"231","0.000361","1.1.64.166","1.2.72.163","SSLv3","1475","Application Data"
"232","0.000366","1.1.49.34","1.2.57.57","SSLv3","136","Application Data"
"233","0.000368","1.2.85.246","1.1.250.142","SSLv3","1418","Application Data"
"234","0.000371","1.1.142.167","1.2.66.76","SSLv3","136","Application Data"
"235","0.000372","1.1.28.164","1.2.36.73","SSLv3","135","Application Data"
"236","0.000371","1.2.186.226","1.1.178.209","SSLv3","1418","Application Data"
"237","0.000374","1.1.141.81","1.2.245.29","TCP","70","63946  >  443 [ACK] Seq=1 Ack=414 Win=39096 Len=0 TSval=301247335 TSecr=591813471"
"238","0.000377","1.2.130.250","1.1.159.83","SSLv3","1418","Application Data"
"239","0.000378","1.2.192.20","1.1.221.86","SSLv3","906","Application Data"
"240","0.000379","1.2.132.149","1.1.40.207","TCP","70","443  >  35153 [ACK] Seq=1 Ack=1406 Win=46336 Len=0 TSval=591814613 TSecr=301247026"
"241","0.000380","1.1.119.42","1.2.203.201","TCP","70","47237  >  443 [ACK] Seq=1 Ack=1349 Win=40544 Len=0 TSval=301247383 TSecr=591813418"
"242","0.000382","1.2.203.51","1.1.119.155","TCP","70","443  >  33776 [ACK] Seq=1 Ack=1406 Win=49232 Len=0 TSval=591814632 TSecr=301246906"
"243","0.000383","1.2.62.198","1.1.135.194","SSLv3","483","Application Data"
"244","0.000384","1.1.107.72","1.2.199.72","SSLv3","1475","Application Data"
"245","0.000386","1.1.52.25","1.2.59.211","SSLv3","1475","Application Data"
"246","0.000387","1.1.158.118","1.2.134.80","SSLv3","136","Application Data"
"247","0.000388","1.2.206.186","1.1.199.106","TCP","70","443  >  54147 [ACK] Seq=1 Ack=1406 Win=49232 Len=0 TSval=591814682 TSecr=301247035"
"248","0.000392","1.2.41.56","1.1.169.169","SSLv3","483","Application Data"
"249","0.000393","1.1.192.7","1.2.123.159","SSLv3","1475","Application Data"
"250","0.000394","1.1.247.107","1.2.250.21","SSLv3","1475","Application Data"
"251","0.000395","1.1.181.178","1.2.190.40","TCP","70","49909  >  443 [ACK] Seq=1 Ack=414 Win=39096 Len=0 TSval=301247495 TSecr=591814159"
"252","0.000395","1.1.171.118","1.2.147.82","TCP","70","11275  >  443 [ACK] Seq=1 Ack=837 Win=41992 Len=0 TSval=301247505 TSecr=591814447"
"253","0.000395","1.2.171.57","1.1.163.148","SSLv3","1418","Application Data"
"254","0.000396","1.2.240.209","1.1.141.225","TCP","70","443  >  18838 [ACK] Seq=1 Ack=94 Win=50680 Len=0 TSval=591814749 TSecr=301247147"
"255","0.000397","1.2.17.119","1.1.189.152","TCP","70","443  >  5683 [ACK] Seq=1 Ack=1406 Win=46336 Len=0 TSval=591814755 TSecr=301246975"
"256","0.000399","1.1.75.144","1.2.83.45","TCP","70","22513  >  443 [ACK] Seq=1 Ack=1349 Win=40544 Len=0 TSval=301247531 TSecr=591814111"
"257","0.000399","1.2.158.211","1.1.151.104","TCP","70","443  >  12182 [ACK] Seq=1 Ack=66 Win=44888 Len=0 TSval=591814770 TSecr=301246107"
"258","0.000401","1.2.194.23","1.1.110.56","SSLv3","1418","Application Data"
"259","0.000402","1.2.66.76","1.1.142.167","TCP","70","443  >  64261 [ACK] Seq=1 Ack=67 Win=47784 Len=0 TSval=591814799 TSecr=301247312"
"260","0.000404","1.2.179.137","1.1.124.91","TCP","70","443  >  49224 [ACK] Seq=1 Ack=94 Win=50680 Len=0 TSval=591814812 TSecr=301247112"
"261","0.000405","1.1.232.104","1.2.211.182","TCP","70","27766  >  443 [ACK] Seq=1 Ack=1349 Win=40544 Len=0 TSval=301247585 TSecr=591814279"
"262","0.000406","1.1.142.213","1.2.68.116","TCP","70","18755  >  443 [ACK] Seq=1 Ack=1349 Win=40544 Len=0 TSval=301247587 TSecr=591814414"
"263","0.000407","1.1.16.59","1.2.24.38","TCP","70","7404  >  443 [ACK] Seq=1 Ack=1349 Win=40544 Len=0 TSval=301247599 TSecr=591814289"
"264","0.000408","1.1.159.83","1.2.130.250","TCP","70","34741  >  443 [ACK] Seq=1 Ack=1349 Win=40544 Len=0 TSval=301247604 TSecr=591814597"
"265","0.000408","1.1.193.11","1.2.201.55","TCP","70","52728  >  443 [ACK] Seq=1 Ack=414 Win=39096 Len=0 TSval=301247605 TSecr=591814423"
"266","0.000409","1.2.70.186","1.1.139.38","SSLv3","906","Application Data"
"267","0.000410","1.2.134.128","1.1.158.169","TCP","70","443  >  14140 [ACK] Seq=1 Ack=1406 Win=49232 Len=0 TSval=591814863 TSecr=301246372"
"268","0.000411","1.2.247.107","1.1.143.99","TCP","70","443  >  18482 [ACK] Seq=1 Ack=94 Win=50680 Len=0 TSval=591814866 TSecr=301246844"
"269","0.000411","1.2.183.52","1.1.119.80","TCP","70","443  >  48124 [ACK] Seq=1 Ack=94 Win=50680 Len=0 TSval=591814869 TSecr=301247131"
"270","0.000412","1.2.6.153","1.1.202.157","TCP","70","443  >  2906 [ACK] Seq=1 Ack=94 Win=50680 Len=0 TSval=591814879 TSecr=301247159"
"271","0.000411","1.1.98.87","1.2.106.31","SSLv3","1475","Application Data"
"272","0.000412","1.2.59.211","1.1.52.25","TCP","70","443  >  16528 [ACK] Seq=1 Ack=1406 Win=49232 Len=0 TSval=591814880 TSecr=301247419"
"273","0.000413","1.2.63.221","1.1.55.245","TCP","70","443  >  63641 [ACK] Seq=1 Ack=1406 Win=46336 Len=0 TSval=591814886 TSecr=301247184"
"274","0.000414","1.2.57.57","1.1.49.34","TCP","70","443  >  15860 [ACK] Seq=1 Ack=67 Win=47784 Len=0 TSval=591814893 TSecr=301247270"
"275","0.000416","1.1.169.169","1.2.41.56","TCP","70","41456  >  443 [ACK] Seq=1 Ack=414 Win=39096 Len=0 TSval=301247669 TSecr=591814718"
"276","0.000420","1.2.81.76","1.1.242.65","SSLv3","1418","Application Data"
"277","0.000421","1.2.109.169","1.1.101.191","TCP","70","443  >  29282 [ACK] Seq=1 Ack=1406 Win=46336 Len=0 TSval=591814949 TSecr=301246742"
"278","0.000421","1.2.135.79","1.1.159.166","TCP","70","443  >  33811 [ACK] Seq=1 Ack=67 Win=47784 Len=0 TSval=591814950 TSecr=301247194"
"279","0.000421","1.2.215.193","1.1.92.30","TCP","70","443  >  26757 [ACK] Seq=1 Ack=1406 Win=49232 Len=0 TSval=591814951 TSecr=301247003"
"280","0.000421","1.2.250.21","1.1.247.107","TCP","70","443  >  65238 [ACK] Seq=1 Ack=1406 Win=49232 Len=0 TSval=591814951 TSecr=301247485"
"281","0.000422","1.2.36.73","1.1.28.164","TCP","70","443  >  38146 [ACK] Seq=1 Ack=66 Win=44888 Len=0 TSval=591814952 TSecr=301247317"
"282","0.000423","1.1.205.242","1.2.181.95","SSLv3","163","Application Data"
"283","0.000424","1.1.200.232","1.2.177.13","SSLv3","136","Application Data"
"284","0.000428","1.2.209.121","1.1.233.201","SSLv3","1418","Application Data"
"285","0.000429","1.2.83.113","1.1.75.177","TCP","70","443  >  22570 [ACK] Seq=1 Ack=67 Win=47784 Len=0 TSval=591815012 TSecr=301247161"
"286","0.000429","1.2.72.163","1.1.64.166","TCP","70","443  >  1378 [ACK] Seq=1 Ack=1406 Win=52128 Len=0 TSval=591815012 TSecr=301247222"
"287","0.000430","1.1.178.209","1.2.186.226","TCP","70","5030  >  443 [ACK] Seq=1 Ack=1349 Win=40544 Len=0 TSval=301247780 TSecr=591814551"
"288","0.000430","1.1.163.148","1.2.171.57","TCP","70","9208  >  443 [ACK] Seq=1 Ack=1349 Win=40544 Len=0 TSval=301247786 TSecr=591814740"
"289","0.000432","1.1.110.56","1.2.194.23","TCP","70","31442  >  443 [ACK] Seq=1 Ack=1349 Win=40544 Len=0 TSval=301247800 TSecr=591814789"
"290","0.000433","1.1.191.32","1.2.21.168","SSLv3","136","Application Data"
"291","0.000437","1.1.156.123","1.2.51.117","SSLv3","136","Application Data"
"292","0.000438","1.1.139.38","1.2.70.186","TCP","70","19317  >  443 [ACK] Seq=1 Ack=837 Win=41992 Len=0 TSval=301247843 TSecr=591814853"
"293","0.000438","1.1.135.194","1.2.62.198","TCP","70","36734  >  443 [ACK] Seq=1 Ack=414 Win=39096 Len=0 TSval=301247845 TSecr=591814642"
"294","0.000438","1.1.221.86","1.2.192.20","TCP","70","50376  >  443 [ACK] Seq=1 Ack=837 Win=41992 Len=0 TSval=301247849 TSecr=591814607"
"295","0.000439","1.2.177.13","1.1.200.232","TCP","70","443  >  46531 [ACK] Seq=1 Ack=67 Win=47784 Len=0 TSval=591815088 TSecr=301247736"
"296","0.000443","1.1.82.25","1.2.237.176","SSLv3","163","Application Data"
"297","0.000444","1.2.199.72","1.1.107.72","TCP","70","443  >  50176 [ACK] Seq=1 Ack=1406 Win=49232 Len=0 TSval=591815132 TSecr=301247409"
"298","0.000446","1.2.106.31","1.1.98.87","TCP","70","443  >  28401 [ACK] Seq=1 Ack=1406 Win=46336 Len=0 TSval=591815147 TSecr=301247624"
"299","0.000452","1.2.96.118","1.1.237.4","SSLv3","1418","Application Data"
"300","0.000453","1.2.134.80","1.1.158.118","TCP","70","443  >  35593 [ACK] Seq=1 Ack=67 Win=47784 Len=0 TSval=591815205 TSecr=301247440"
"301","0.000453","1.1.85.231","1.2.234.9","SSLv3","1475","Application Data"
"302","0.000453","1.2.170.115","1.1.162.199","SSLv3","1418","Application Data"
"303","0.000454","1.1.11.239","1.2.163.137","SSLv3","1475","Application Data"
"304","0.000458","1.1.93.34","1.2.208.205","SSLv3","1475","Application Data"
"305","0.000459","1.1.98.123","1.2.222.70","SSLv3","163","Application Data"
"306","0.000459","1.1.242.65","1.2.81.76","TCP","70","22022  >  443 [ACK] Seq=1 Ack=1349 Win=40544 Len=0 TSval=301248010 TSecr=591814940"
"307","0.000461","1.2.129.156","1.1.42.18","SSLv3","1418","Application Data"
"308","0.000465","1.1.95.107","1.2.211.194","SSLv3","1475","Application Data"
"309","0.000466","1.1.148.109","1.2.156.110","SSLv3","1475","Application Data"
"310","0.000468","1.1.84.150","1.2.91.232","SSLv3","136","Application Data"
"311","0.000469","1.1.158.213","1.2.135.6","SSLv3","1475","Application Data"
"312","0.000471","1.1.133.194","1.2.57.159","SSLv3","136","Application Data"
"313","0.000471","1.1.14.219","1.2.23.115","SSLv3","163","Application Data"
"314","0.000474","1.2.166.72","1.1.10.207","SSLv3","1418","Application Data"
"315","0.000482","1.2.120.26","1.1.108.222","SSLv3","1418","Application Data"
"316","0.000484","1.2.30.113","1.1.162.31","SSLv3","483","Application Data"
"317","0.000486","1.2.123.159","1.1.192.7","TCP","70","443  >  32858 [ACK] Seq=1 Ack=1406 Win=49232 Len=0 TSval=591815469 TSecr=301247474"
"318","0.000486","1.1.220.98","1.2.111.253","SSLv3","1475","Application Data"
"319","0.000487","1.1.248.184","1.2.84.137","SSLv3","1475","Application Data"
"320","0.000488","1.1.250.142","1.2.85.246","TCP","70","59060  >  443 [ACK] Seq=1 Ack=1349 Win=40544 Len=0 TSval=301248241 TSecr=591814526"
"321","0.000489","1.1.47.18","1.2.130.183","SSLv3","1475","Application Data"
"322","0.000491","1.2.182.51","1.1.195.128","SSLv3","1418","Application Data"
"323","0.000494","1.2.237.176","1.1.82.25","TCP","70","443  >  24172 [ACK] Seq=1 Ack=94 Win=50680 Len=0 TSval=591815533 TSecr=301247888"
"324","0.000495","1.1.180.23","1.2.11.53","SSLv3","1475","Application Data"
"325","0.000498","1.2.185.16","1.1.5.240","SSLv3","1418","Application Data"
"326","0.000499","1.2.21.168","1.1.191.32","TCP","70","443  >  6760 [ACK] Seq=1 Ack=67 Win=47784 Len=0 TSval=591815573 TSecr=301247807"
"327","0.000498","1.1.194.117","1.2.202.64","SSLv3","1475","Application Data"
"328","0.000499","1.2.51.117","1.1.156.123","TCP","70","443  >  33839 [ACK] Seq=1 Ack=67 Win=47784 Len=0 TSval=591815573 TSecr=301247838"
"329","0.000499","1.1.12.244","1.2.20.115","SSLv3","1475","Application Data"
"330","0.000500","1.1.42.18","1.2.129.156","TCP","70","34402  >  443 [ACK] Seq=1 Ack=1349 Win=40544 Len=0 TSval=301248337 TSecr=591815266"
"331","0.000501","1.1.109.99","1.2.193.25","SSLv3","1475","Application Data"
"332","0.000504","1.2.163.137","1.1.11.239","TCP","70","443  >  45125 [ACK] Seq=1 Ack=1406 Win=49232 Len=0 TSval=591815608 TSecr=301247968"
"333","0.000504","1.2.234.9","1.1.85.231","TCP","70","443  >  61134 [ACK] Seq=1 Ack=1406 Win=46336 Len=0 TSval=591815614 TSecr=301247958"
"334","0.000504","1.1.123.200","1.2.183.187","SSLv3","1475","Application Data"
"335","0.000505","1.1.28.69","1.2.151.123","SSLv3","136","Application Data"
"336","0.000506","1.2.111.253","1.1.220.98","TCP","70","443  >  51381 [ACK] Seq=1 Ack=1406 Win=46336 Len=0 TSval=591815629 TSecr=301248222"
"337","0.000507","1.2.181.95","1.1.205.242","TCP","70","443  >  47646 [ACK] Seq=1 Ack=94 Win=50680 Len=0 TSval=591815634 TSecr=301247728"
"338","0.000507","1.2.211.194","1.1.95.107","TCP","70","443  >  57467 [ACK] Seq=1 Ack=1406 Win=46336 Len=0 TSval=591815637 TSecr=301248055"
"339","0.000511","1.1.162.199","1.2.170.115","TCP","70","44845  >  443 [ACK] Seq=1 Ack=1349 Win=40544 Len=0 TSval=301248427 TSecr=591815207"
"340","0.000512","1.2.222.70","1.1.98.123","TCP","70","443  >  28418 [ACK] Seq=1 Ack=94 Win=50680 Len=0 TSval=591815678 TSecr=301248009"
"341","0.000514","1.1.108.222","1.2.120.26","TCP","70","31966  >  443 [ACK] Seq=1 Ack=1349 Win=40544 Len=0 TSval=301248454 TSecr=591815439"
"342","0.000515","1.1.251.15","1.2.226.134","SSLv3","136","Application Data"
"343","0.000516","1.2.11.53","1.1.180.23","TCP","70","443  >  4084 [ACK] Seq=1 Ack=1406 Win=49232 Len=0 TSval=591815708 TSecr=301248294"
"344","0.000518","1.1.204.180","1.2.1.33","SSLv3","163","Application Data"
"345","0.000519","1.1.233.201","1.2.209.121","TCP","70","54839  >  443 [ACK] Seq=1 Ack=1349 Win=40544 Len=0 TSval=301248491 TSecr=591815002"
"346","0.000520","1.2.130.183","1.1.47.18","TCP","70","443  >  15221 [ACK] Seq=1 Ack=1406 Win=46336 Len=0 TSval=591815741 TSecr=301248247"
"347","0.000523","1.2.84.137","1.1.248.184","TCP","70","443  >  58689 [ACK] Seq=1 Ack=1406 Win=49232 Len=0 TSval=591815765 TSecr=301248232"
"348","0.000528","1.1.103.75","1.2.111.31","SSLv3","1475","Application Data"
"349","0.000530","1.2.20.115","1.1.12.244","TCP","70","443  >  42283 [ACK] Seq=1 Ack=1406 Win=49232 Len=0 TSval=591815819 TSecr=301248328"
"350","0.000529","1.1.15.250","1.2.172.245","SSLv3","1475","Application Data"
"351","0.000530","1.1.144.162","1.2.153.92","SSLv3","1475","Application Data"
"352","0.000531","1.1.149.99","1.2.41.202","SSLv3","137","Application Data"
"353","0.000532","1.1.237.4","1.2.96.118","TCP","70","55599  >  443 [ACK] Seq=1 Ack=1349 Win=40544 Len=0 TSval=301248585 TSecr=591815195"
"354","0.000532","1.1.5.240","1.2.185.16","TCP","70","48585  >  443 [ACK] Seq=1 Ack=1349 Win=40544 Len=0 TSval=301248586 TSecr=591815564"
"355","0.000532","1.1.146.64","1.2.153.241","SSLv3","136","Application Data"
"356","0.000532","1.1.247.140","1.2.255.14","SSLv3","136","Application Data"
"357","0.000532","1.2.202.64","1.1.194.117","TCP","70","443  >  33536 [ACK] Seq=1 Ack=1406 Win=49232 Len=0 TSval=591815837 TSecr=301248318"
"358","0.000534","1.2.156.110","1.1.148.109","TCP","70","443  >  41261 [ACK] Seq=1 Ack=1406 Win=52128 Len=0 TSval=591815851 TSecr=301248064"
"359","0.000535","1.2.208.205","1.1.93.34","TCP","70","443  >  27014 [ACK] Seq=1 Ack=1406 Win=49232 Len=0 TSval=591815863 TSecr=301247999"
"360","0.000538","1.1.90.220","1.2.98.63","SSLv3","163","Application Data"
"361","0.000539","1.2.151.123","1.1.28.69","TCP","70","443  >  37948 [ACK] Seq=1 Ack=67 Win=47784 Len=0 TSval=591815891 TSecr=301248380"
"362","0.000543","1.2.108.237","1.1.97.117","SSLv3","1418","Application Data"
"363","0.000544","1.2.118.141","1.1.110.113","SSLv3","906","Application Data"
"364","0.000545","1.2.91.232","1.1.84.150","TCP","70","443  >  24742 [ACK] Seq=1 Ack=67 Win=47784 Len=0 TSval=591815941 TSecr=301248074"
"365","0.000545","1.2.193.25","1.1.109.99","TCP","70","443  >  31186 [ACK] Seq=1 Ack=1406 Win=46336 Len=0 TSval=591815942 TSecr=301248341"
"366","0.000545","1.2.198.40","1.1.222.219","SSLv3","483","Application Data"
"367","0.000547","1.1.162.31","1.2.30.113","TCP","70","44845  >  443 [ACK] Seq=1 Ack=414 Win=39096 Len=0 TSval=301248719 TSecr=591815449"
"368","0.000550","1.2.23.115","1.1.14.219","TCP","70","443  >  7212 [ACK] Seq=1 Ack=94 Win=50680 Len=0 TSval=591815980 TSecr=301248098"
"369","0.000550","1.2.98.63","1.1.90.220","TCP","70","443  >  26362 [ACK] Seq=1 Ack=94 Win=50680 Len=0 TSval=591815983 TSecr=301248646"
"370","0.000551","1.2.183.187","1.1.123.200","TCP","70","443  >  2166 [ACK] Seq=1 Ack=1406 Win=46336 Len=0 TSval=591815991 TSecr=301248368"
"371","0.000552","1.2.135.6","1.1.158.213","TCP","70","443  >  35791 [ACK] Seq=1 Ack=1406 Win=46336 Len=0 TSval=591815995 TSecr=301248088"
"372","0.000553","1.1.246.61","1.2.74.82","SSLv3","1475","Application Data"
