"No.","Time","Source","Destination","Protocol","Length","Info"
"1","0.000000","1.2.179.110","1.1.223.220","TCP","1518","80  >  3112 [ACK] Seq=1 Ack=1 Win=7240 Len=1448 TSval=379176253 TSecr=87075148 [TCP segment of a reassembled PDU]"
"2","0.000001","1.2.209.203","1.1.93.219","TCP","70","443  >  27268 [FIN, ACK] Seq=1 Ack=1 Win=65535 Len=0 TSval=379176263 TSecr=88608051"
"3","0.000001","1.2.179.110","1.1.223.220","HTTP","167","HTTP/1.1 200 OK  (text/html)"
"4","0.000002","1.2.101.130","1.1.97.103","TCP","70","443  >  54842 [ACK] Seq=1 Ack=1 Win=23168 Len=0 TSval=379176271 TSecr=88608929"
"5","0.000004","1.2.220.86","1.1.93.135","SSLv3","470","Application Data"
"6","0.000008","1.1.128.110","1.2.229.21","TCP","70","59853  >  80 [ACK] Seq=1 Ack=1 Win=5792 Len=0 TSval=88609082 TSecr=379176192"
"7","0.000008","1.2.12.70","1.1.188.40","TCP","70","443  >  4358 [ACK] Seq=1 Ack=1 Win=23168 Len=0 TSval=379176319 TSecr=88606613"
"8","0.000011","1.1.2.13","1.2.183.35","TCP","70","46383  >  443 [ACK] Seq=1 Ack=1 Win=30408 Len=0 TSval=88609103 TSecr=379176150"
"9","0.000011","1.2.105.82","1.1.212.72","SSLv3","470","Application Data"
"10","0.000011","1.2.32.210","1.1.28.147","TCP","70","443  >  9615 [FIN, ACK] Seq=1 Ack=1 Win=23168 Len=0 TSval=379176342 TSecr=88608586"
"11","0.000015","1.2.170.53","1.1.173.245","SSLv3","1284","Application Data"
"12","0.000016","1.2.239.73","1.1.82.81","TCP","70","443  >  60419 [FIN, ACK] Seq=1 Ack=1 Win=65535 Len=0 TSval=379176379 TSecr=88608667"
"13","0.000016","1.2.187.105","1.1.192.23","TCP","70","80  >  5156 [FIN, ACK] Seq=1 Ack=1 Win=7240 Len=0 TSval=379176379 TSecr=88129379"
"14","0.000017","1.2.45.65","1.1.152.216","TCP","70","443  >  40443 [ACK] Seq=1 Ack=1 Win=31856 Len=0 TSval=379176385 TSecr=88606648"
"15","0.000016","1.1.55.39","1.2.131.143","SSLv3","1456","Application Data"
"16","0.000018","1.1.170.30","1.2.30.126","TCP","70","44854  >  443 [ACK] Seq=1 Ack=1 Win=31856 Len=0 TSval=88609146 TSecr=379175810"
"17","0.000018","1.2.163.46","1.1.186.113","TCP","70","443  >  7146 [FIN, ACK] Seq=1 Ack=1 Win=65535 Len=0 TSval=379176400 TSecr=87521160"
"18","0.000019","1.2.14.26","1.1.10.86","TCP","70","443  >  48851 [FIN, ACK] Seq=1 Ack=1 Win=23168 Len=0 TSval=379176405 TSecr=87079772"
"19","0.000023","1.1.82.156","1.2.231.4","TCP","70","60347  >  443 [FIN, ACK] Seq=1 Ack=1 Win=31856 Len=0 TSval=88609195 TSecr=379173981"
"20","0.000026","1.2.35.207","1.1.7.187","TCP","1518","80  >  10386 [ACK] Seq=1 Ack=1 Win=7240 Len=1448 TSval=379176458 TSecr=86811923 [TCP segment of a reassembled PDU]"
"21","0.000027","1.2.35.207","1.1.7.187","HTTP","167","HTTP/1.1 200 OK  (text/html)"
"22","0.000027","1.1.236.188","1.2.116.79","HTTP","1298","GET http://www.google.ro/accounts/KKjcLPR?hl=en&service=mail&ilo=1&ils=s.RO&ilc=1&continue=https%3A%2F%2Faccounts.google.com%2FServiceLogin%3Fservice%3Dmail%26passive%3Dtrue%26rm%3Dfalse%26continue%3Dhttps%3A%2F%2Fmail.google.com%2Fmail%2F%26ss%3D1%26scc%3D1%26ltmpl%3Ddefault%26ltmplcache%3D2%26hl%3Den&zx=-024573748 HTTP/1.1 "
"23","0.000028","1.1.179.191","1.2.188.40","SSLv3","693","Application Data"
"24","0.000028","1.1.130.143","1.2.62.238","TCP","70","36795  >  443 [ACK] Seq=1 Ack=1 Win=65535 Len=0 TSval=88609233 TSecr=379176126"
"25","0.000030","1.1.204.172","1.2.180.202","SSLv3","878","Application Data"
"26","0.000030","1.1.223.220","1.2.179.110","TCP","70","3112  >  80 [ACK] Seq=1 Ack=1546 Win=8688 Len=0 TSval=88609251 TSecr=379176263"
"27","0.000031","1.1.142.48","1.2.85.62","TCP","70","23036  >  80 [ACK] Seq=1 Ack=1 Win=8688 Len=0 TSval=88609261 TSecr=379174206"
"28","0.000030","1.2.61.254","1.1.57.212","SSLv3","1284","Application Data"
"29","0.000031","1.2.195.216","1.1.219.175","SSLv3","470","Application Data"
"30","0.000032","1.1.57.114","1.2.58.151","TCP","70","16561  >  443 [ACK] Seq=1 Ack=1 Win=31856 Len=0 TSval=88609267 TSecr=379176210"
"31","0.000033","1.2.180.20","1.1.204.68","TCP","70","443  >  1229 [FIN, ACK] Seq=1 Ack=1 Win=65535 Len=0 TSval=379176519 TSecr=88427608"
"32","0.000034","1.2.209.211","1.1.74.250","TCP","74","80  >  54930 [SYN, ACK] Seq=0 Ack=1 Win=5792 Len=0 MSS=1460 TSval=379176522 TSecr=88606900"
"33","0.000036","1.1.238.53","1.2.238.145","SSLv3","693","Application Data"
"34","0.000036","1.1.121.10","1.2.180.72","TCP","70","1328  >  443 [FIN, ACK] Seq=1 Ack=1 Win=24616 Len=0 TSval=88609299 TSecr=379176216"
"35","0.000037","1.1.212.72","1.2.105.82","TCP","70","57874  >  443 [ACK] Seq=1 Ack=401 Win=65535 Len=0 TSval=88609310 TSecr=379176338"
"36","0.000038","1.1.28.97","1.2.151.179","TCP","70","38008  >  443 [ACK] Seq=1 Ack=1 Win=65535 Len=0 TSval=88609316 TSecr=379174304"
"37","0.000042","1.2.21.116","1.1.207.113","TCP","1518","80  >  6708 [ACK] Seq=1 Ack=1 Win=7240 Len=1448 TSval=379176586 TSecr=86631761 [TCP segment of a reassembled PDU]"
"38","0.000043","1.2.105.194","1.1.101.212","TCP","70","443  >  28284 [FIN, ACK] Seq=1 Ack=1 Win=23168 Len=0 TSval=379176595 TSecr=88426736"
"39","0.000043","1.2.21.116","1.1.207.113","HTTP","167","HTTP/1.1 200 OK  (text/html)"
"40","0.000043","1.2.95.196","1.1.236.92","SSLv3","470","Application Data"
"41","0.000044","1.2.131.143","1.1.55.39","TCP","70","443  >  15432 [ACK] Seq=1 Ack=1387 Win=31856 Len=0 TSval=379176600 TSecr=88609137"
"42","0.000043","1.1.63.46","1.2.70.196","SSLv3","1439","Application Data"
"43","0.000044","1.1.1.58","1.2.177.3","TCP","70","46528  >  443 [FIN, ACK] Seq=1 Ack=1 Win=24616 Len=0 TSval=88609359 TSecr=379174155"
"44","0.000044","1.1.72.185","1.2.215.25","TCP","70","56275  >  80 [FIN, ACK] Seq=1 Ack=1 Win=8688 Len=0 TSval=88609360 TSecr=379174404"
"45","0.000045","1.1.202.2","1.2.5.223","TCP","70","2716  >  443 [ACK] Seq=1 Ack=1 Win=65535 Len=0 TSval=88609375 TSecr=379175268"
"46","0.000045","1.1.82.81","1.2.239.73","TCP","70","60419  >  443 [FIN, ACK] Seq=1 Ack=2 Win=65535 Len=0 TSval=88609375 TSecr=379176379"
"47","0.000047","1.2.215.38","1.1.239.66","SSLv3","470","Application Data"
"48","0.000048","1.1.11.111","1.2.11.203","TCP","70","4225  >  443 [ACK] Seq=1 Ack=1 Win=31856 Len=0 TSval=88609398 TSecr=379174603"
"49","0.000049","1.1.186.113","1.2.163.46","TCP","70","7146  >  443 [FIN, ACK] Seq=1 Ack=2 Win=65535 Len=0 TSval=88609405 TSecr=379176400"
"50","0.000050","1.1.192.23","1.2.187.105","TCP","70","5156  >  80 [FIN, ACK] Seq=1 Ack=2 Win=8688 Len=0 TSval=88609411 TSecr=379176379"
"51","0.000050","1.2.252.171","1.1.252.79","SSLv3","993","Application Data"
"52","0.000050","1.2.16.104","1.1.12.110","TCP","70","443  >  5413 [ACK] Seq=1 Ack=1 Win=23168 Len=0 TSval=379176655 TSecr=88606925"
"53","0.000051","1.1.176.207","1.2.190.54","TCP","70","49920  >  443 [FIN, ACK] Seq=1 Ack=1 Win=24616 Len=0 TSval=88609425 TSecr=379175600"
"54","0.000052","1.1.77.246","1.2.81.207","TCP","70","60039  >  443 [FIN, ACK] Seq=1 Ack=1 Win=24616 Len=0 TSval=88609427 TSecr=379174737"
"55","0.000052","1.2.47.148","1.1.43.183","TCP","70","443  >  34893 [FIN, ACK] Seq=1 Ack=1 Win=23168 Len=0 TSval=379176670 TSecr=86649706"
"56","0.000055","1.2.83.61","1.1.56.33","TCP","1518","80  >  60408 [ACK] Seq=1 Ack=1 Win=7240 Len=1448 TSval=379176693 TSecr=86811960 [TCP segment of a reassembled PDU]"
"57","0.000056","1.2.11.116","1.1.216.50","TCP","70","80  >  48179 [ACK] Seq=1 Ack=1 Win=7240 Len=0 TSval=379176702 TSecr=88606935"
"58","0.000056","1.2.116.79","1.1.236.188","TCP","70","80  >  30984 [ACK] Seq=1 Ack=1229 Win=7240 Len=0 TSval=379176703 TSecr=88609220"
"59","0.000057","1.2.83.61","1.1.56.33","HTTP","167","HTTP/1.1 200 OK  (text/html)"
"60","0.000057","1.2.192.53","1.1.223.103","TCP","70","443  >  30961 [FIN, ACK] Seq=1 Ack=1 Win=65535 Len=0 TSval=379176705 TSecr=88608205"
"61","0.000058","1.2.243.203","1.1.60.162","TCP","70","443  >  19594 [ACK] Seq=1 Ack=1 Win=65535 Len=0 TSval=379176719 TSecr=88608386"
"62","0.000059","1.1.164.19","1.2.164.111","SSLv3","1456","Application Data"
"63","0.000060","1.1.210.153","1.2.0.239","TCP","70","1458  >  80 [FIN, ACK] Seq=1 Ack=1 Win=8688 Len=0 TSval=88609490 TSecr=379174218"
"64","0.000060","1.1.250.183","1.2.222.18","TCP","70","28363  >  80 [ACK] Seq=1 Ack=1 Win=8688 Len=0 TSval=88609491 TSecr=379174892"
"65","0.000061","1.2.156.141","1.1.148.255","SSLv3","470","Application Data"
"66","0.000062","1.1.213.252","1.2.207.194","TCP","74","32892  >  80 [SYN] Seq=0 Win=5792 Len=0 MSS=1460 TSval=88609508 TSecr=0"
"67","0.000062","1.2.47.39","1.1.46.66","SSLv3","994","Application Data"
"68","0.000064","1.2.194.45","1.1.218.109","TCP","70","443  >  50919 [FIN, ACK] Seq=1 Ack=1 Win=65535 Len=0 TSval=379176762 TSecr=88607154"
"69","0.000064","1.1.162.43","1.2.49.19","TCP","70","35284  >  80 [FIN, ACK] Seq=1 Ack=1 Win=8688 Len=0 TSval=88609529 TSecr=379175741"
"70","0.000066","1.2.249.30","1.1.248.194","TCP","70","443  >  64984 [ACK] Seq=1 Ack=1 Win=28960 Len=0 TSval=379176776 TSecr=88607754"
"71","0.000066","1.2.56.31","1.1.28.242","TCP","74","80  >  37081 [SYN, ACK] Seq=0 Ack=1 Win=5792 Len=0 MSS=1460 TSval=379176782 TSecr=88608668"
"72","0.000070","1.2.105.82","1.1.212.72","TCP","70","443  >  57874 [FIN, ACK] Seq=401 Ack=1 Win=65535 Len=0 TSval=379176809 TSecr=88609310"
"73","0.000070","1.1.62.62","1.2.69.218","SSLv3","1439","Application Data"
"74","0.000071","1.1.57.212","1.2.61.254","TCP","70","17081  >  443 [ACK] Seq=1 Ack=1215 Win=24616 Len=0 TSval=88609574 TSecr=379176491"
"75","0.000071","1.1.132.44","1.2.140.133","TCP","70","37200  >  443 [ACK] Seq=1 Ack=1 Win=65535 Len=0 TSval=88609575 TSecr=379174261"
"76","0.000072","1.2.190.54","1.1.176.207","TCP","70","443  >  49920 [ACK] Seq=1 Ack=2 Win=23168 Len=0 TSval=379176830 TSecr=88609425"
"77","0.000072","1.1.184.65","1.2.184.171","SSLv3","693","Application Data"
"78","0.000073","1.1.157.223","1.2.67.218","TCP","70","18581  >  80 [FIN, ACK] Seq=1 Ack=1 Win=8688 Len=0 TSval=88609594 TSecr=379174343"
"79","0.000073","1.1.101.212","1.2.105.194","TCP","70","28284  >  443 [FIN, ACK] Seq=1 Ack=2 Win=24616 Len=0 TSval=88609595 TSecr=379176595"
"80","0.000074","1.2.238.145","1.1.238.53","TCP","70","443  >  62294 [ACK] Seq=1 Ack=624 Win=30408 Len=0 TSval=379176845 TSecr=88609294"
"81","0.000075","1.1.33.12","1.2.33.104","TCP","70","9757  >  443 [ACK] Seq=1 Ack=1 Win=30408 Len=0 TSval=88609611 TSecr=379175718"
"82","0.000076","1.2.187.105","1.1.192.23","TCP","70","80  >  5156 [ACK] Seq=2 Ack=2 Win=7240 Len=0 TSval=379176857 TSecr=88609411"
"83","0.000077","1.2.173.60","1.1.17.179","SSLv3","470","Application Data"
"84","0.000078","1.2.49.19","1.1.162.43","TCP","70","80  >  35284 [ACK] Seq=1 Ack=2 Win=7240 Len=0 TSval=379176874 TSecr=88609529"
"85","0.000078","1.1.178.83","1.2.178.175","TCP","70","46953  >  443 [ACK] Seq=1 Ack=1 Win=31856 Len=0 TSval=88609639 TSecr=379174357"
"86","0.000079","1.2.180.72","1.1.121.10","TCP","70","443  >  1328 [ACK] Seq=1 Ack=2 Win=23168 Len=0 TSval=379176885 TSecr=88609299"
"87","0.000081","1.2.94.217","1.1.94.110","TCP","70","443  >  25490 [ACK] Seq=1 Ack=1 Win=31856 Len=0 TSval=379176898 TSecr=88608355"
"88","0.000081","1.1.113.203","1.2.117.199","TCP","70","50835  >  443 [ACK] Seq=1 Ack=1 Win=24616 Len=0 TSval=88609665 TSecr=379175850"
"89","0.000082","1.1.221.182","1.2.114.122","TCP","70","52028  >  443 [FIN, ACK] Seq=1 Ack=1 Win=65535 Len=0 TSval=88609668 TSecr=379174461"
"90","0.000083","1.1.212.72","1.2.105.82","TCP","70","57874  >  443 [FIN, ACK] Seq=1 Ack=402 Win=65535 Len=0 TSval=88609676 TSecr=379176809"
"91","0.000083","1.1.28.242","1.2.56.31","TCP","70","37081  >  80 [ACK] Seq=1 Ack=1 Win=5792 Len=0 TSval=88609680 TSecr=379176782"
"92","0.000083","1.2.70.196","1.1.63.46","TCP","70","443  >  63377 [ACK] Seq=1 Ack=1370 Win=23168 Len=0 TSval=379176918 TSecr=88609350"
"93","0.000087","1.2.36.42","1.1.151.202","SSLv3","993","Application Data"
"94","0.000087","1.2.13.54","1.1.189.8","TCP","70","443  >  48630 [ACK] Seq=1 Ack=1 Win=23168 Len=0 TSval=379176950 TSecr=88608365"
"95","0.000087","1.2.196.33","1.1.219.11","TCP","70","443  >  30253 [ACK] Seq=1 Ack=1 Win=31856 Len=0 TSval=379176951 TSecr=88608967"
"96","0.000088","1.2.105.194","1.1.101.212","TCP","70","443  >  28284 [ACK] Seq=2 Ack=2 Win=23168 Len=0 TSval=379176952 TSecr=88609595"
"97","0.000089","1.2.239.73","1.1.82.81","TCP","70","443  >  60419 [ACK] Seq=2 Ack=2 Win=65535 Len=0 TSval=379176960 TSecr=88609375"
"98","0.000089","1.1.252.79","1.2.252.171","TCP","70","1381  >  443 [ACK] Seq=1 Ack=924 Win=30408 Len=0 TSval=88609725 TSecr=379176648"
"99","0.000089","1.2.204.117","1.1.92.188","TCP","74","80  >  32059 [SYN, ACK] Seq=0 Ack=1 Win=5792 Len=0 MSS=1460 TSval=379176966 TSecr=88608579"
"100","0.000089","1.2.233.251","1.1.233.159","TCP","70","443  >  61115 [FIN, ACK] Seq=1 Ack=1 Win=31856 Len=0 TSval=379176967 TSecr=86989640"
"101","0.000090","1.1.247.91","1.2.75.97","TCP","70","20507  >  443 [FIN, ACK] Seq=1 Ack=1 Win=65535 Len=0 TSval=88609732 TSecr=379174502"
"102","0.000090","1.2.105.87","1.1.248.252","TCP","70","80  >  28193 [ACK] Seq=1 Ack=1 Win=7240 Len=0 TSval=379176968 TSecr=88609023"
"103","0.000091","1.2.105.82","1.1.212.72","TCP","70","443  >  57874 [ACK] Seq=402 Ack=2 Win=65535 Len=0 TSval=379176979 TSecr=88609676"
"104","0.000092","1.2.163.46","1.1.186.113","TCP","70","443  >  7146 [ACK] Seq=2 Ack=2 Win=65535 Len=0 TSval=379176991 TSecr=88609405"
"105","0.000093","1.1.207.15","1.2.173.23","TCP","70","7636  >  80 [ACK] Seq=1 Ack=1 Win=8688 Len=0 TSval=88609757 TSecr=379174504"
"106","0.000097","1.2.174.23","1.1.21.194","TCP","70","443  >  45783 [FIN, ACK] Seq=1 Ack=1 Win=23168 Len=0 TSval=379177024 TSecr=86991520"
"107","0.000097","1.2.231.4","1.1.82.156","TCP","70","443  >  60347 [ACK] Seq=1 Ack=2 Win=31856 Len=0 TSval=379177024 TSecr=88609195"
"108","0.000098","1.2.14.53","1.1.199.110","TCP","70","80  >  48887 [ACK] Seq=1 Ack=1 Win=7240 Len=0 TSval=379177037 TSecr=88607394"
"109","0.000102","1.1.95.20","1.2.235.124","SSLv3","1456","Application Data"
"110","0.000103","1.1.16.97","1.2.20.47","TCP","70","42219  >  443 [ACK] Seq=1 Ack=1 Win=24616 Len=0 TSval=88609828 TSecr=379175859"
"111","0.000103","1.1.236.92","1.2.95.196","TCP","70","55421  >  443 [ACK] Seq=1 Ack=401 Win=65535 Len=0 TSval=88609837 TSecr=379176597"
"112","0.000103","1.2.215.25","1.1.72.185","TCP","70","80  >  56275 [ACK] Seq=1 Ack=2 Win=7240 Len=0 TSval=379177078 TSecr=88609360"
"113","0.000107","1.1.229.247","1.2.86.13","SSLv3","1439","Application Data"
"114","0.000109","1.2.81.207","1.1.77.246","TCP","70","443  >  60039 [ACK] Seq=1 Ack=2 Win=23168 Len=0 TSval=379177121 TSecr=88609427"
"115","0.000108","1.1.182.41","1.2.2.146","SSLv3","1456","Application Data"
"116","0.000111","1.2.127.124","1.1.119.187","TCP","70","443  >  47157 [FIN, ACK] Seq=1 Ack=1 Win=65535 Len=0 TSval=379177138 TSecr=88133795"
"117","0.000110","1.1.142.227","1.2.59.91","SSLv3","1475","Application Data"
"118","0.000111","1.1.18.14","1.2.162.8","TCP","70","6857  >  443 [ACK] Seq=1 Ack=1 Win=24616 Len=0 TSval=88609896 TSecr=379175938"
"119","0.000111","1.1.151.173","1.2.43.123","TCP","70","12341  >  443 [ACK] Seq=1 Ack=1 Win=65535 Len=0 TSval=88609896 TSecr=379174827"
"120","0.000111","1.1.148.255","1.2.156.141","TCP","70","11593  >  443 [ACK] Seq=1 Ack=401 Win=65535 Len=0 TSval=88609897 TSecr=379176739"
"121","0.000112","1.1.199.8","1.2.186.183","TCP","74","49023  >  80 [SYN] Seq=0 Win=5792 Len=0 MSS=1460 TSval=88609905 TSecr=0"
"122","0.000114","1.1.43.183","1.2.47.148","TCP","70","34893  >  443 [FIN, ACK] Seq=1 Ack=2 Win=24616 Len=0 TSval=88609929 TSecr=379176670"
"123","0.000114","1.2.233.208","1.1.85.212","TCP","70","443  >  25234 [ACK] Seq=1 Ack=1 Win=65535 Len=0 TSval=379177166 TSecr=88607658"
"124","0.000115","1.1.175.247","1.2.28.96","TCP","70","8489  >  443 [ACK] Seq=1 Ack=1 Win=30408 Len=0 TSval=88609933 TSecr=379176119"
"125","0.000117","1.2.69.218","1.1.62.62","TCP","70","443  >  19149 [ACK] Seq=1 Ack=1370 Win=23168 Len=0 TSval=379177186 TSecr=88609565"
"126","0.000118","1.1.92.234","1.2.233.101","SSLv3","693","Application Data"
"127","0.000122","1.1.185.195","1.2.14.44","SSLv3","1456","Application Data"
"128","0.000123","1.1.34.10","1.2.61.134","TCP","70","36424  >  80 [FIN, ACK] Seq=1 Ack=1 Win=8688 Len=0 TSval=88609990 TSecr=379175073"
"129","0.000123","1.1.67.182","1.2.68.18","TCP","70","18643  >  443 [ACK] Seq=1 Ack=1 Win=30408 Len=0 TSval=88609990 TSecr=379176157"
"130","0.000124","1.1.80.5","1.2.91.74","TCP","70","60425  >  443 [FIN, ACK] Seq=1 Ack=1 Win=65535 Len=0 TSval=88610003 TSecr=379175332"
"131","0.000126","1.2.56.49","1.1.55.213","SSLv3","994","Application Data"
"132","0.000127","1.2.13.27","1.1.113.193","TCP","70","80  >  4568 [FIN, ACK] Seq=1 Ack=1 Win=7240 Len=0 TSval=379177271 TSecr=87595427"
"133","0.000128","1.2.4.77","1.1.101.31","TCP","70","80  >  46343 [ACK] Seq=1 Ack=1 Win=7240 Len=0 TSval=379177277 TSecr=88608104"
"134","0.000128","1.1.114.121","1.2.185.226","HTTP","1298","GET http://www.google.ro/accounts/KLGRPVt?hl=en&service=mail&ilo=1&ils=s.RO&ilc=1&continue=https%3A%2F%2Faccounts.google.com%2FServiceLogin%3Fservice%3Dmail%26passive%3Dtrue%26rm%3Dfalse%26continue%3Dhttps%3A%2F%2Fmail.google.com%2Fmail%2F%26ss%3D1%26scc%3D1%26ltmpl%3Ddefault%26ltmplcache%3D2%26hl%3Den&zx=-052209438 HTTP/1.1 "
"135","0.000129","1.1.233.159","1.2.233.251","TCP","70","61115  >  443 [FIN, ACK] Seq=1 Ack=2 Win=31856 Len=0 TSval=88610035 TSecr=379176967"
"136","0.000129","1.1.93.219","1.2.209.203","TCP","70","27268  >  443 [FIN, ACK] Seq=1 Ack=2 Win=65535 Len=0 TSval=88610036 TSecr=379176263"
"137","0.000130","1.2.120.79","1.1.192.23","TCP","70","443  >  32007 [FIN, ACK] Seq=1 Ack=1 Win=23168 Len=0 TSval=379177292 TSecr=86894143"
"138","0.000130","1.1.128.90","1.2.56.67","SSLv3","1439","Application Data"
"139","0.000131","1.1.151.202","1.2.36.42","TCP","70","10462  >  443 [ACK] Seq=1 Ack=924 Win=30408 Len=0 TSval=88610054 TSecr=379176944"
"140","0.000132","1.1.97.58","1.2.207.116","HTTP","1298","GET http://www.google.ro/accounts/KLGRPVt?hl=en&service=mail&ilo=1&ils=s.RO&ilc=1&continue=https%3A%2F%2Faccounts.google.com%2FServiceLogin%3Fservice%3Dmail%26passive%3Dtrue%26rm%3Dfalse%26continue%3Dhttps%3A%2F%2Fmail.google.com%2Fmail%2F%26ss%3D1%26scc%3D1%26ltmpl%3Ddefault%26ltmplcache%3D2%26hl%3Den&zx=-052209438 HTTP/1.1 "
"141","0.000133","1.2.209.225","1.1.208.221","SSLv3","831","Application Data"
"142","0.000134","1.2.194.39","1.1.113.224","TCP","70","443  >  31456 [FIN, ACK] Seq=1 Ack=1 Win=23168 Len=0 TSval=379177322 TSecr=86992363"
"143","0.000137","1.1.192.40","1.2.204.87","SSLv3","1439","Application Data"
"144","0.000138","1.1.56.33","1.2.83.61","TCP","70","60408  >  80 [ACK] Seq=1 Ack=1546 Win=8688 Len=0 TSval=88610108 TSecr=379176704"
"145","0.000138","1.2.86.13","1.1.229.247","TCP","70","443  >  23246 [ACK] Seq=1 Ack=1370 Win=23168 Len=0 TSval=379177354 TSecr=88609861"
"146","0.000138","1.1.202.34","1.2.127.36","TCP","70","1321  >  443 [FIN, ACK] Seq=1 Ack=1 Win=31856 Len=0 TSval=88610108 TSecr=379175606"
"147","0.000138","1.1.153.158","1.2.253.142","TCP","70","20041  >  80 [FIN, ACK] Seq=1 Ack=1 Win=8688 Len=0 TSval=88610114 TSecr=379175871"
"148","0.000140","1.1.248.172","1.2.224.5","TCP","70","22725  >  443 [FIN, ACK] Seq=1 Ack=1 Win=65535 Len=0 TSval=88610132 TSecr=379175827"
"149","0.000141","1.1.92.188","1.2.204.117","TCP","70","32059  >  80 [ACK] Seq=1 Ack=1 Win=5792 Len=0 TSval=88610140 TSecr=379176966"
"150","0.000142","1.2.83.119","1.1.131.86","TCP","70","80  >  58421 [ACK] Seq=1 Ack=1 Win=7240 Len=0 TSval=379177386 TSecr=88608658"
"151","0.000143","1.1.71.224","1.2.251.215","TCP","70","21652  >  443 [FIN, ACK] Seq=1 Ack=1 Win=65535 Len=0 TSval=88610160 TSecr=379175885"
"152","0.000143","1.2.47.148","1.1.43.183","TCP","70","443  >  34893 [ACK] Seq=2 Ack=2 Win=23168 Len=0 TSval=379177398 TSecr=88609929"
"153","0.000146","1.2.79.63","1.1.254.215","TCP","70","443  >  21501 [ACK] Seq=1 Ack=1 Win=23168 Len=0 TSval=379177418 TSecr=88608303"
"154","0.000147","1.2.233.251","1.1.233.159","TCP","70","443  >  61115 [ACK] Seq=2 Ack=2 Win=31856 Len=0 TSval=379177427 TSecr=88610035"
"155","0.000150","1.2.194.68","1.1.110.121","TCP","70","443  >  31485 [ACK] Seq=1 Ack=1 Win=65535 Len=0 TSval=379177449 TSecr=88608702"
"156","0.000150","1.2.209.203","1.1.93.219","TCP","70","443  >  27268 [ACK] Seq=2 Ack=2 Win=65535 Len=0 TSval=379177454 TSecr=88610036"
"157","0.000151","1.1.251.213","1.2.228.49","SSLv3","1456","Application Data"
"158","0.000152","1.1.230.23","1.2.231.27","TCP","70","58664  >  443 [FIN, ACK] Seq=1 Ack=1 Win=31856 Len=0 TSval=88610232 TSecr=379175523"
"159","0.000153","1.1.113.201","1.2.200.135","TCP","70","52550  >  443 [ACK] Seq=1 Ack=1 Win=65535 Len=0 TSval=88610237 TSecr=379175949"
"160","0.000155","1.2.15.176","1.1.4.77","SSLv3","1095","Application Data"
"161","0.000156","1.2.62.115","1.1.150.227","TCP","70","80  >  17198 [ACK] Seq=1 Ack=1 Win=7240 Len=0 TSval=379177497 TSecr=88608333"
"162","0.000157","1.2.35.64","1.1.27.117","TCP","70","443  >  10236 [ACK] Seq=1 Ack=1 Win=65535 Len=0 TSval=379177511 TSecr=88608802"
"163","0.000157","1.1.26.38","1.2.26.130","SSLv3","1456","Application Data"
"164","0.000159","1.1.248.155","1.2.248.247","SSLv3","693","Application Data"
"165","0.000161","1.1.93.98","1.2.97.113","TCP","70","26174  >  443 [ACK] Seq=1 Ack=1 Win=24616 Len=0 TSval=88610300 TSecr=379176183"
"166","0.000162","1.1.71.37","1.2.243.141","TCP","70","1094  >  443 [FIN, ACK] Seq=1 Ack=1 Win=31856 Len=0 TSval=88610313 TSecr=379175946"
"167","0.000162","1.2.253.141","1.1.253.33","SSLv3","1475","Application Data"
"168","0.000163","1.2.124.71","1.1.204.18","TCP","70","443  >  33031 [FIN, ACK] Seq=1 Ack=1 Win=23168 Len=0 TSval=379177554 TSecr=87509378"
"169","0.000166","1.1.15.250","1.2.16.86","TCP","70","5404  >  443 [FIN, ACK] Seq=1 Ack=1 Win=31856 Len=0 TSval=88610344 TSecr=379175947"
"170","0.000165","1.2.198.125","1.1.197.121","SSLv3","1475","Application Data"
"171","0.000167","1.2.179.244","1.1.0.33","SSLv3","1095","Application Data"
"172","0.000168","1.2.188.23","1.1.176.13","TCP","70","443  >  3281 [ACK] Seq=1 Ack=1 Win=23168 Len=0 TSval=379177592 TSecr=88608516"
"173","0.000168","1.2.11.255","1.1.7.87","TCP","70","443  >  4287 [ACK] Seq=1 Ack=1 Win=23168 Len=0 TSval=379177592 TSecr=88608915"
"174","0.000168","1.2.2.146","1.1.182.41","TCP","70","443  >  1862 [ACK] Seq=1 Ack=1387 Win=31856 Len=0 TSval=379177593 TSecr=88609870"
"175","0.000168","1.2.14.44","1.1.185.195","TCP","70","443  >  48869 [ACK] Seq=1 Ack=1387 Win=31856 Len=0 TSval=379177594 TSecr=88609980"
"176","0.000171","1.2.186.183","1.1.199.8","TCP","74","80  >  49023 [SYN, ACK] Seq=0 Ack=1 Win=5792 Len=0 MSS=1460 TSval=379177621 TSecr=88609905"
"177","0.000171","1.1.240.183","1.2.75.249","SSLv3","1439","Application Data"
"178","0.000172","1.2.154.167","1.1.19.211","TCP","70","80  >  40800 [ACK] Seq=1 Ack=1 Win=7240 Len=0 TSval=379177627 TSecr=88608693"
"179","0.000172","1.2.0.137","1.1.100.69","TCP","70","80  >  1345 [FIN, ACK] Seq=1 Ack=1 Win=7240 Len=0 TSval=379177628 TSecr=87777629"
"180","0.000173","1.2.180.202","1.1.204.172","TCP","70","443  >  47495 [ACK] Seq=1 Ack=809 Win=65535 Len=0 TSval=379177633 TSecr=88609245"
"181","0.000175","1.2.188.40","1.1.179.191","TCP","70","443  >  3299 [ACK] Seq=1 Ack=624 Win=30408 Len=0 TSval=379177649 TSecr=88609228"
"182","0.000176","1.2.185.226","1.1.114.121","TCP","70","80  >  4763 [ACK] Seq=1 Ack=1229 Win=7240 Len=0 TSval=379177656 TSecr=88610027"
"183","0.000176","1.1.248.252","1.2.230.55","SSLv3","1439","Application Data"
"184","0.000178","1.2.95.196","1.1.236.92","TCP","70","443  >  55421 [FIN, ACK] Seq=401 Ack=1 Win=65535 Len=0 TSval=379177672 TSecr=88609837"
"185","0.000177","1.1.154.232","1.2.74.119","HTTP","1298","GET http://www.google.ro/accounts/KKjcLPR?hl=en&service=mail&ilo=1&ils=s.RO&ilc=1&continue=https%3A%2F%2Faccounts.google.com%2FServiceLogin%3Fservice%3Dmail%26passive%3Dtrue%26rm%3Dfalse%26continue%3Dhttps%3A%2F%2Fmail.google.com%2Fmail%2F%26ss%3D1%26scc%3D1%26ltmpl%3Ddefault%26ltmplcache%3D2%26hl%3Den&zx=-024573748 HTTP/1.1 "
"186","0.000179","1.1.113.193","1.2.13.27","TCP","70","4568  >  80 [FIN, ACK] Seq=1 Ack=2 Win=8688 Len=0 TSval=88610444 TSecr=379177271"
"187","0.000181","1.1.219.175","1.2.195.216","TCP","70","31902  >  443 [ACK] Seq=1 Ack=401 Win=65535 Len=0 TSval=88610463 TSecr=379176499"
"188","0.000182","1.1.192.191","1.2.205.100","TCP","70","32285  >  443 [ACK] Seq=1 Ack=1 Win=24616 Len=0 TSval=88610467 TSecr=379176052"
"189","0.000181","1.2.87.194","1.1.227.87","SSLv3","993","Application Data"
"190","0.000182","1.1.192.23","1.2.120.79","TCP","70","32007  >  443 [FIN, ACK] Seq=1 Ack=2 Win=24616 Len=0 TSval=88610470 TSecr=379177292"
"191","0.000182","1.2.156.141","1.1.148.255","TCP","70","443  >  11593 [FIN, ACK] Seq=401 Ack=1 Win=65535 Len=0 TSval=379177707 TSecr=88609897"
"192","0.000183","1.1.17.228","1.2.159.228","TCP","70","40103  >  80 [FIN, ACK] Seq=1 Ack=1 Win=8688 Len=0 TSval=88610480 TSecr=379174704"
"193","0.000185","1.1.207.113","1.2.21.116","TCP","70","6708  >  80 [ACK] Seq=1 Ack=1546 Win=8688 Len=0 TSval=88610493 TSecr=379176596"
"194","0.000185","1.1.74.250","1.2.209.211","TCP","70","54930  >  80 [ACK] Seq=1 Ack=1 Win=5792 Len=0 TSval=88610498 TSecr=379176522"
"195","0.000186","1.2.56.67","1.1.128.90","TCP","70","443  >  37115 [ACK] Seq=1 Ack=1370 Win=23168 Len=0 TSval=379177739 TSecr=88610045"
"196","0.000186","1.1.69.141","1.2.212.2","TCP","74","25789  >  80 [SYN] Seq=0 Win=5792 Len=0 MSS=1460 TSval=88610505 TSecr=0"
"197","0.000186","1.2.207.116","1.1.97.58","TCP","70","80  >  32813 [ACK] Seq=1 Ack=1229 Win=7240 Len=0 TSval=379177743 TSecr=88610064"
"198","0.000187","1.1.10.197","1.2.40.115","TCP","70","41259  >  80 [FIN, ACK] Seq=1 Ack=1 Win=8688 Len=0 TSval=88610508 TSecr=379174751"
"199","0.000188","1.2.177.3","1.1.1.58","TCP","70","443  >  46528 [ACK] Seq=1 Ack=2 Win=23168 Len=0 TSval=379177754 TSecr=88609359"
"200","0.000189","1.1.255.185","1.2.76.37","SSLv3","693","Application Data"
"201","0.000190","1.1.73.129","1.2.229.59","TCP","70","22038  >  443 [ACK] Seq=1 Ack=1 Win=24616 Len=0 TSval=88610529 TSecr=379176142"
"202","0.000190","1.2.248.247","1.1.248.155","TCP","70","443  >  64942 [ACK] Seq=1 Ack=624 Win=30408 Len=0 TSval=379177772 TSecr=88610284"
"203","0.000190","1.1.143.48","1.2.139.42","TCP","70","17389  >  443 [FIN, ACK] Seq=1 Ack=1 Win=24616 Len=0 TSval=88610536 TSecr=379175302"
"204","0.000190","1.2.224.5","1.1.248.172","TCP","70","443  >  22725 [ACK] Seq=1 Ack=2 Win=65535 Len=0 TSval=379177773 TSecr=88610132"
"205","0.000191","1.1.4.77","1.2.15.176","TCP","70","43115  >  443 [ACK] Seq=1 Ack=1026 Win=65535 Len=0 TSval=88610545 TSecr=379177490"
"206","0.000194","1.2.184.171","1.1.184.65","TCP","70","443  >  48505 [ACK] Seq=1 Ack=624 Win=30408 Len=0 TSval=379177802 TSecr=88609590"
"207","0.000194","1.2.251.215","1.1.71.224","TCP","70","443  >  21652 [ACK] Seq=1 Ack=2 Win=65535 Len=0 TSval=379177802 TSecr=88610160"
"208","0.000194","1.1.100.69","1.2.0.137","TCP","70","1345  >  80 [FIN, ACK] Seq=1 Ack=2 Win=8688 Len=0 TSval=88610566 TSecr=379177628"
"209","0.000198","1.2.40.236","1.1.40.144","SSLv3","993","Application Data"
"210","0.000199","1.2.120.79","1.1.192.23","TCP","70","443  >  32007 [ACK] Seq=2 Ack=2 Win=23168 Len=0 TSval=379177841 TSecr=88610470"
"211","0.000199","1.2.164.111","1.1.164.19","TCP","70","443  >  5423 [ACK] Seq=1 Ack=1387 Win=31856 Len=0 TSval=379177841 TSecr=88609474"
"212","0.000199","1.1.199.87","1.2.199.179","TCP","70","50284  >  443 [ACK] Seq=1 Ack=1 Win=31856 Len=0 TSval=88610611 TSecr=379175778"
"213","0.000200","1.2.231.27","1.1.230.23","TCP","70","443  >  58664 [ACK] Seq=1 Ack=2 Win=31856 Len=0 TSval=379177848 TSecr=88610232"
"214","0.000202","1.2.243.141","1.1.71.37","TCP","70","443  >  1094 [ACK] Seq=1 Ack=2 Win=31856 Len=0 TSval=379177864 TSecr=88610313"
"215","0.000202","1.2.0.239","1.1.210.153","TCP","70","80  >  1458 [ACK] Seq=1 Ack=2 Win=7240 Len=0 TSval=379177865 TSecr=88609490"
"216","0.000202","1.2.0.137","1.1.100.69","TCP","70","80  >  1345 [ACK] Seq=2 Ack=2 Win=7240 Len=0 TSval=379177870 TSecr=88610566"
"217","0.000202","1.1.205.6","1.2.205.98","SSLv3","693","Application Data"
"218","0.000203","1.1.204.18","1.2.124.71","TCP","70","33031  >  443 [FIN, ACK] Seq=1 Ack=2 Win=24616 Len=0 TSval=88610642 TSecr=379177554"
"219","0.000205","1.2.16.86","1.1.15.250","TCP","70","443  >  5404 [ACK] Seq=1 Ack=2 Win=31856 Len=0 TSval=379177894 TSecr=88610344"
"220","0.000206","1.2.230.55","1.1.248.252","TCP","70","443  >  60146 [ACK] Seq=1 Ack=1370 Win=23168 Len=0 TSval=379177900 TSecr=88610415"
"221","0.000207","1.2.207.253","1.1.196.137","TCP","70","443  >  52413 [ACK] Seq=1 Ack=1 Win=65535 Len=0 TSval=379177909 TSecr=88608563"
"222","0.000207","1.1.119.113","1.2.119.205","SSLv3","1456","Application Data"
"223","0.000208","1.1.236.92","1.2.95.196","TCP","70","55421  >  443 [FIN, ACK] Seq=1 Ack=402 Win=65535 Len=0 TSval=88610672 TSecr=379177672"
"224","0.000209","1.2.67.218","1.1.157.223","TCP","70","80  >  18581 [ACK] Seq=1 Ack=2 Win=7240 Len=0 TSval=379177923 TSecr=88609594"
"225","0.000209","1.1.199.8","1.2.186.183","TCP","70","49023  >  80 [ACK] Seq=1 Ack=1 Win=5792 Len=0 TSval=88610686 TSecr=379177621"
"226","0.000210","1.2.212.2","1.1.69.141","TCP","74","80  >  25789 [SYN, ACK] Seq=0 Ack=1 Win=5792 Len=0 MSS=1460 TSval=379177931 TSecr=88610505"
"227","0.000213","1.1.38.86","1.2.42.133","TCP","70","41796  >  443 [FIN, ACK] Seq=1 Ack=1 Win=24616 Len=0 TSval=88610722 TSecr=379175893"
"228","0.000214","1.2.74.119","1.1.154.232","TCP","70","80  >  20276 [ACK] Seq=1 Ack=1229 Win=7240 Len=0 TSval=379177965 TSecr=88610424"
"229","0.000214","1.2.114.122","1.1.221.182","TCP","70","443  >  52028 [ACK] Seq=1 Ack=2 Win=65535 Len=0 TSval=379177967 TSecr=88609668"
"230","0.000216","1.1.227.87","1.2.87.194","TCP","70","61563  >  443 [ACK] Seq=1 Ack=924 Win=30408 Len=0 TSval=88610745 TSecr=379177700"
"231","0.000217","1.2.200.181","1.1.113.155","SSLv3","470","Application Data"
"232","0.000217","1.2.76.37","1.1.255.185","TCP","70","443  >  64735 [ACK] Seq=1 Ack=624 Win=30408 Len=0 TSval=379177989 TSecr=88610525"
"233","0.000218","1.2.13.27","1.1.113.193","TCP","70","80  >  4568 [ACK] Seq=2 Ack=2 Win=7240 Len=0 TSval=379177994 TSecr=88610444"
"234","0.000218","1.2.75.97","1.1.247.91","TCP","70","443  >  20507 [ACK] Seq=1 Ack=2 Win=65535 Len=0 TSval=379177995 TSecr=88609732"
"235","0.000218","1.1.0.33","1.2.179.244","TCP","70","3243  >  443 [ACK] Seq=1 Ack=1026 Win=65535 Len=0 TSval=88610760 TSecr=379177584"
"236","0.000220","1.2.64.58","1.1.56.30","TCP","70","443  >  63735 [FIN, ACK] Seq=1 Ack=1 Win=65535 Len=0 TSval=379178009 TSecr=87509900"
"237","0.000221","1.2.151.179","1.1.28.97","TCP","70","443  >  38008 [FIN, ACK] Seq=1 Ack=1 Win=65535 Len=0 TSval=379178019 TSecr=88609316"
"238","0.000223","1.2.95.196","1.1.236.92","TCP","70","443  >  55421 [ACK] Seq=402 Ack=2 Win=65535 Len=0 TSval=379178033 TSecr=88610672"
"239","0.000222","1.1.176.28","1.2.8.128","SSLv3","1439","Application Data"
"240","0.000223","1.1.148.255","1.2.156.141","TCP","70","11593  >  443 [FIN, ACK] Seq=1 Ack=402 Win=65535 Len=0 TSval=88610790 TSecr=379177707"
"241","0.000223","1.1.93.135","1.2.220.86","TCP","70","57618  >  443 [ACK] Seq=1 Ack=401 Win=65535 Len=0 TSval=88610790 TSecr=379176281"
"242","0.000223","1.1.91.110","1.2.118.97","TCP","74","31516  >  80 [SYN] Seq=0 Win=5792 Len=0 MSS=1460 TSval=88610792 TSecr=0"
"243","0.000223","1.2.207.194","1.1.213.252","TCP","74","80  >  32892 [SYN, ACK] Seq=0 Ack=1 Win=5792 Len=0 MSS=1460 TSval=379178038 TSecr=88609508"
"244","0.000226","1.1.21.194","1.2.174.23","TCP","70","45783  >  443 [FIN, ACK] Seq=1 Ack=2 Win=24616 Len=0 TSval=88610819 TSecr=379177024"
"245","0.000226","1.2.124.71","1.1.204.18","TCP","70","443  >  33031 [ACK] Seq=2 Ack=2 Win=23168 Len=0 TSval=379178060 TSecr=88610642"
"246","0.000227","1.1.40.144","1.2.40.236","TCP","70","11682  >  443 [ACK] Seq=1 Ack=924 Win=30408 Len=0 TSval=88610827 TSecr=379177834"
"247","0.000228","1.2.206.184","1.1.205.186","TCP","70","443  >  52427 [FIN, ACK] Seq=1 Ack=1 Win=31856 Len=0 TSval=379178074 TSecr=87417949"
"248","0.000228","1.2.205.100","1.1.192.191","TCP","70","443  >  32285 [FIN, ACK] Seq=1 Ack=1 Win=23168 Len=0 TSval=379178076 TSecr=88610467"
"249","0.000228","1.2.110.64","1.1.210.125","TCP","70","443  >  29433 [ACK] Seq=1 Ack=1 Win=65535 Len=0 TSval=379178079 TSecr=88608573"
"250","0.000230","1.1.77.248","1.2.78.240","SSLv3","693","Application Data"
"251","0.000231","1.1.218.109","1.2.194.45","TCP","70","50919  >  443 [FIN, ACK] Seq=1 Ack=2 Win=65535 Len=0 TSval=88610857 TSecr=379176762"
"252","0.000232","1.2.61.134","1.1.34.10","TCP","70","80  >  36424 [ACK] Seq=1 Ack=2 Win=7240 Len=0 TSval=379178107 TSecr=88609990"
"253","0.000235","1.2.156.141","1.1.148.255","TCP","70","443  >  11593 [ACK] Seq=402 Ack=2 Win=65535 Len=0 TSval=379178130 TSecr=88610790"
"254","0.000235","1.2.91.74","1.1.80.5","TCP","70","443  >  60425 [ACK] Seq=1 Ack=2 Win=65535 Len=0 TSval=379178135 TSecr=88610003"
"255","0.000236","1.1.55.213","1.2.56.49","TCP","70","37116  >  443 [ACK] Seq=1 Ack=925 Win=30408 Len=0 TSval=88610903 TSecr=379177258"
"256","0.000238","1.2.119.205","1.1.119.113","TCP","70","443  >  31876 [ACK] Seq=1 Ack=1387 Win=31856 Len=0 TSval=379178158 TSecr=88610663"
"257","0.000239","1.1.209.128","1.2.109.23","TCP","70","29139  >  443 [ACK] Seq=1 Ack=1 Win=65535 Len=0 TSval=88610925 TSecr=379175867"
"258","0.000243","1.1.208.221","1.2.209.225","TCP","70","55285  >  443 [ACK] Seq=1 Ack=762 Win=31856 Len=0 TSval=88610958 TSecr=379177313"
"259","0.000242","1.2.57.248","1.1.57.156","SSLv3","831","Application Data"
"260","0.000246","1.2.127.36","1.1.202.34","TCP","70","443  >  1321 [ACK] Seq=1 Ack=2 Win=31856 Len=0 TSval=379178221 TSecr=88610108"
"261","0.000248","1.2.37.51","1.1.169.165","SSLv3","470","Application Data"
"262","0.000248","1.1.56.113","1.2.244.95","SSLv3","878","Application Data"
"263","0.000248","1.1.7.187","1.2.35.207","TCP","70","10386  >  80 [ACK] Seq=1 Ack=1546 Win=8688 Len=0 TSval=88610996 TSecr=379176468"
"264","0.000248","1.2.228.49","1.1.251.213","TCP","70","443  >  59626 [ACK] Seq=1 Ack=1387 Win=31856 Len=0 TSval=379178238 TSecr=88610213"
"265","0.000249","1.2.75.249","1.1.240.183","TCP","70","443  >  64739 [ACK] Seq=1 Ack=1370 Win=23168 Len=0 TSval=379178242 TSecr=88610372"
"266","0.000250","1.2.253.142","1.1.153.158","TCP","70","80  >  20041 [ACK] Seq=1 Ack=2 Win=7240 Len=0 TSval=379178250 TSecr=88610114"
"267","0.000251","1.1.204.68","1.2.180.20","TCP","70","1229  >  443 [FIN, ACK] Seq=1 Ack=2 Win=65535 Len=0 TSval=88611026 TSecr=379176519"
"268","0.000252","1.2.58.151","1.1.57.114","TCP","70","443  >  16561 [FIN, ACK] Seq=1 Ack=1 Win=31856 Len=0 TSval=379178270 TSecr=88609267"
"269","0.000254","1.2.148.11","1.1.171.175","SSLv3","831","Application Data"
"270","0.000254","1.2.159.228","1.1.17.228","TCP","70","80  >  40103 [ACK] Seq=1 Ack=2 Win=7240 Len=0 TSval=379178286 TSecr=88610480"
"271","0.000256","1.2.117.199","1.1.113.203","TCP","70","443  >  50835 [FIN, ACK] Seq=1 Ack=1 Win=23168 Len=0 TSval=379178298 TSecr=88609665"
"272","0.000257","1.2.40.115","1.1.10.197","TCP","70","80  >  41259 [ACK] Seq=1 Ack=2 Win=7240 Len=0 TSval=379178310 TSecr=88610508"
"273","0.000260","1.2.139.42","1.1.143.48","TCP","70","443  >  17389 [ACK] Seq=1 Ack=2 Win=23168 Len=0 TSval=379178335 TSecr=88610536"
"274","0.000260","1.1.199.8","1.2.186.183","HTTP","1298","GET http://www.google.ro/accounts/KLGRPVt?hl=en&service=mail&ilo=1&ils=s.RO&ilc=1&continue=https%3A%2F%2Faccounts.google.com%2FServiceLogin%3Fservice%3Dmail%26passive%3Dtrue%26rm%3Dfalse%26continue%3Dhttps%3A%2F%2Fmail.google.com%2Fmail%2F%26ss%3D1%26scc%3D1%26ltmpl%3Ddefault%26ltmplcache%3D2%26hl%3Den&zx=-052209438 HTTP/1.1 "
"275","0.000261","1.1.17.179","1.2.173.60","TCP","70","7674  >  443 [ACK] Seq=1 Ack=401 Win=65535 Len=0 TSval=88611094 TSecr=379176871"
"276","0.000261","1.1.113.155","1.2.200.181","TCP","70","52590  >  443 [ACK] Seq=1 Ack=401 Win=65535 Len=0 TSval=88611094 TSecr=379177986"
"277","0.000263","1.1.205.186","1.2.206.184","TCP","70","52427  >  443 [FIN, ACK] Seq=1 Ack=2 Win=31856 Len=0 TSval=88611118 TSecr=379178074"
"278","0.000264","1.2.92.130","1.1.232.21","SSLv3","831","Application Data"
"279","0.000265","1.1.56.30","1.2.64.58","TCP","70","63735  >  443 [FIN, ACK] Seq=1 Ack=2 Win=65535 Len=0 TSval=88611138 TSecr=379178009"
"280","0.000265","1.2.84.103","1.1.84.11","SSLv3","831","Application Data"
"281","0.000266","1.2.235.124","1.1.95.20","TCP","70","443  >  55366 [ACK] Seq=1 Ack=1387 Win=31856 Len=0 TSval=379178378 TSecr=88609818"
"282","0.000269","1.2.82.113","1.1.250.73","SSLv3","1284","Application Data"
"283","0.000271","1.1.136.5","1.2.60.110","TCP","70","16682  >  443 [ACK] Seq=1 Ack=1 Win=30408 Len=0 TSval=88611179 TSecr=379176133"
"284","0.000270","1.2.3.160","1.1.207.214","SSLv3","1284","Application Data"
"285","0.000271","1.2.118.97","1.1.91.110","TCP","74","80  >  31516 [SYN, ACK] Seq=0 Ack=1 Win=5792 Len=0 MSS=1460 TSval=379178416 TSecr=88610792"
"286","0.000271","1.1.119.187","1.2.127.124","TCP","70","47157  >  443 [FIN, ACK] Seq=1 Ack=2 Win=65535 Len=0 TSval=88611180 TSecr=379177138"
"287","0.000271","1.2.163.172","1.1.207.183","TCP","70","80  >  7269 [FIN, ACK] Seq=1 Ack=1 Win=7240 Len=0 TSval=379178417 TSecr=86993546"
"288","0.000271","1.2.42.133","1.1.38.86","TCP","70","443  >  41796 [ACK] Seq=1 Ack=2 Win=23168 Len=0 TSval=379178418 TSecr=88610722"
"289","0.000272","1.2.144.83","1.1.189.254","TCP","70","80  >  38163 [FIN, ACK] Seq=1 Ack=1 Win=7240 Len=0 TSval=379178431 TSecr=87779167"
"290","0.000275","1.1.118.101","1.2.2.113","SSLv3","1475","Application Data"
"291","0.000277","1.1.113.224","1.2.194.39","TCP","70","31456  >  443 [FIN, ACK] Seq=1 Ack=2 Win=24616 Len=0 TSval=88611219 TSecr=379177322"
"292","0.000277","1.1.186.156","1.2.186.248","SSLv3","693","Application Data"
"293","0.000280","1.2.58.84","1.1.171.168","TCP","1518","80  >  16141 [ACK] Seq=1 Ack=1 Win=7240 Len=1448 TSval=379178489 TSecr=85453360 [TCP segment of a reassembled PDU]"
"294","0.000281","1.2.85.38","1.1.249.11","TCP","70","443  >  23011 [FIN, ACK] Seq=1 Ack=1 Win=65535 Len=0 TSval=379178499 TSecr=88430726"
"295","0.000281","1.2.235.39","1.1.94.191","SSLv3","831","Application Data"
"296","0.000282","1.2.58.84","1.1.171.168","HTTP","167","HTTP/1.1 200 OK  (text/html)"
"297","0.000282","1.2.194.45","1.1.218.109","TCP","70","443  >  50919 [ACK] Seq=2 Ack=2 Win=65535 Len=0 TSval=379178506 TSecr=88610857"
"298","0.000282","1.2.204.87","1.1.192.40","TCP","70","443  >  53527 [ACK] Seq=1 Ack=1370 Win=23168 Len=0 TSval=379178506 TSecr=88610098"
"299","0.000281","1.1.113.193","1.2.193.144","SSLv3","1439","Application Data"
"300","0.000282","1.1.49.193","1.2.82.41","TCP","74","22249  >  80 [SYN] Seq=0 Win=5792 Len=0 MSS=1460 TSval=88611263 TSecr=0"
"301","0.000282","1.1.213.252","1.2.207.194","TCP","70","32892  >  80 [ACK] Seq=1 Ack=1 Win=5792 Len=0 TSval=88611264 TSecr=379178038"
"302","0.000282","1.1.197.121","1.2.198.125","TCP","70","50332  >  443 [ACK] Seq=1 Ack=1406 Win=28960 Len=0 TSval=88611264 TSecr=379177575"
"303","0.000282","1.1.192.12","1.2.192.104","TCP","70","50461  >  443 [ACK] Seq=1 Ack=1 Win=31856 Len=0 TSval=88611265 TSecr=379176205"
"304","0.000286","1.2.197.93","1.1.226.172","TCP","1518","80  >  30231 [ACK] Seq=1 Ack=1 Win=7240 Len=1448 TSval=379178538 TSecr=87417580 [TCP segment of a reassembled PDU]"
"305","0.000287","1.1.39.147","1.2.39.239","SSLv3","693","Application Data"
"306","0.000287","1.2.214.173","1.1.67.131","TCP","70","80  >  56165 [ACK] Seq=1 Ack=1 Win=7240 Len=0 TSval=379178548 TSecr=88608987"
"307","0.000287","1.2.197.93","1.1.226.172","HTTP","167","HTTP/1.1 200 OK  (text/html)"
"308","0.000288","1.2.178.147","1.1.178.55","SSLv3","831","Application Data"
"309","0.000288","1.2.26.130","1.1.26.38","TCP","70","443  >  45885 [ACK] Seq=1 Ack=1387 Win=31856 Len=0 TSval=379178559 TSecr=88610261"
"310","0.000289","1.2.132.202","1.1.156.237","TCP","70","443  >  35203 [FIN, ACK] Seq=1 Ack=1 Win=65535 Len=0 TSval=379178564 TSecr=87677146"
