"No.","Time","Source","Destination","Protocol","Length","Info"
"1","0.000000","1.2.222.94","1.1.242.235","SSLv3","1475","Application Data"
"2","0.000001","1.2.185.2","1.1.221.81","SSLv3","1475","Application Data"
"3","0.000002","1.2.207.187","1.1.88.78","SSLv3","1475","Application Data"
"4","0.000004","1.1.155.98","1.2.226.139","TCP","70","59203  >  443 [ACK] Seq=1 Ack=1 Win=65535 Len=0 TSval=224557328 TSecr=515122914"
"5","0.000005","1.1.139.116","1.2.99.66","TCP","70","26622  >  443 [ACK] Seq=1 Ack=1 Win=65535 Len=0 TSval=224557332 TSecr=515123266"
"6","0.000007","1.1.226.40","1.2.200.241","TCP","70","52652  >  443 [ACK] Seq=1 Ack=1 Win=65535 Len=0 TSval=224557352 TSecr=515124103"
"7","0.000008","1.1.29.54","1.2.66.149","TCP","70","64348  >  443 [ACK] Seq=1 Ack=1 Win=65535 Len=0 TSval=224557358 TSecr=515123711"
"8","0.000008","1.2.169.95","1.1.207.255","SSLv3","1475","Application Data"
"9","0.000010","1.2.112.144","1.1.249.147","SSLv3","1475","Application Data"
"10","0.000012","1.1.72.72","1.2.111.227","TCP","70","29855  >  443 [ACK] Seq=1 Ack=1 Win=65535 Len=0 TSval=224557387 TSecr=515123381"
"11","0.000014","1.1.53.187","1.2.232.48","TCP","70","60652  >  443 [ACK] Seq=1 Ack=1 Win=65535 Len=0 TSval=224557403 TSecr=515123856"
"12","0.000015","1.1.81.51","1.2.116.218","TCP","70","31124  >  443 [ACK] Seq=1 Ack=1 Win=65535 Len=0 TSval=224557419 TSecr=515123804"
"13","0.000016","1.2.153.99","1.1.190.104","SSLv3","1475","Application Data"
"14","0.000018","1.2.142.1","1.1.163.112","SSLv3","1475","Application Data"
"15","0.000020","1.1.215.6","1.2.191.99","TCP","70","48156  >  443 [ACK] Seq=1 Ack=1 Win=65535 Len=0 TSval=224557457 TSecr=515124246"
"16","0.000021","1.1.60.13","1.2.234.42","TCP","70","61159  >  443 [ACK] Seq=1 Ack=1 Win=65535 Len=0 TSval=224557466 TSecr=515123973"
"17","0.000023","1.1.124.127","1.2.35.50","TCP","70","10218  >  443 [ACK] Seq=1 Ack=1 Win=65535 Len=0 TSval=224557476 TSecr=515123352"
"18","0.000023","1.1.177.8","1.2.42.104","TCP","70","41762  >  443 [ACK] Seq=1 Ack=1 Win=65535 Len=0 TSval=224557478 TSecr=515123873"
"19","0.000023","1.1.95.175","1.2.2.14","TCP","70","47820  >  443 [ACK] Seq=1 Ack=1 Win=65535 Len=0 TSval=224557482 TSecr=515123151"
"20","0.000028","1.1.45.226","1.2.108.144","TCP","70","29023  >  443 [ACK] Seq=1 Ack=1 Win=65535 Len=0 TSval=224557520 TSecr=515124372"
"21","0.000029","1.1.82.242","1.2.119.40","TCP","70","31723  >  443 [ACK] Seq=1 Ack=1 Win=65535 Len=0 TSval=224557527 TSecr=515124277"
"22","0.000030","1.1.37.200","1.2.254.122","TCP","70","1850  >  443 [ACK] Seq=1 Ack=1 Win=65535 Len=0 TSval=224557538 TSecr=515124434"
"23","0.000031","1.1.49.28","1.2.236.106","TCP","70","61732  >  443 [ACK] Seq=1 Ack=1 Win=65535 Len=0 TSval=224557544 TSecr=515123430"
"24","0.000031","1.2.188.49","1.1.98.89","SSLv3","1475","Application Data"
"25","0.000032","1.1.122.176","1.2.38.27","TCP","70","38611  >  443 [ACK] Seq=1 Ack=1 Win=65535 Len=0 TSval=224557550 TSecr=515123161"
"26","0.000033","1.2.105.112","1.1.67.54","SSLv3","1475","Application Data"
"27","0.000034","1.2.140.170","1.1.16.62","SSLv3","1475","Application Data"
"28","0.000037","1.1.5.245","1.2.159.101","TCP","70","39968  >  443 [ACK] Seq=1 Ack=1 Win=65535 Len=0 TSval=224557589 TSecr=515124325"
"29","0.000038","1.1.75.56","1.2.198.28","TCP","70","51926  >  443 [ACK] Seq=1 Ack=1 Win=65535 Len=0 TSval=224557597 TSecr=515124444"
"30","0.000039","1.1.65.63","1.2.223.192","TCP","70","56442  >  443 [ACK] Seq=1 Ack=1 Win=65535 Len=0 TSval=224557607 TSecr=515123564"
"31","0.000039","1.1.188.222","1.2.132.81","TCP","70","13578  >  443 [ACK] Seq=1 Ack=1 Win=65535 Len=0 TSval=224557610 TSecr=515124170"
"32","0.000040","1.2.140.215","1.1.19.59","SSLv3","1475","Application Data"
"33","0.000041","1.1.129.154","1.2.88.254","TCP","70","61878  >  443 [ACK] Seq=1 Ack=1 Win=65535 Len=0 TSval=224557625 TSecr=515123372"
"34","0.000041","1.2.131.171","1.1.160.70","SSLv3","1475","Application Data"
"35","0.000047","1.1.148.34","1.2.75.20","TCP","70","2000  >  443 [ACK] Seq=1 Ack=1 Win=65535 Len=0 TSval=224557670 TSecr=515124226"
"36","0.000046","1.2.81.75","1.1.45.91","SSLv3","1475","Application Data"
"37","0.000047","1.1.221.81","1.2.185.2","TCP","70","4540  >  443 [ACK] Seq=1 Ack=1406 Win=65535 Len=0 TSval=224557671 TSecr=515124541"
"38","0.000047","1.1.249.147","1.2.112.144","TCP","70","30033  >  443 [ACK] Seq=1 Ack=1406 Win=65535 Len=0 TSval=224557674 TSecr=515124611"
"39","0.000047","1.2.118.108","1.1.82.6","SSLv3","1475","Application Data"
"40","0.000049","1.1.69.174","1.2.223.182","TCP","70","56440  >  443 [ACK] Seq=1 Ack=1 Win=65535 Len=0 TSval=224557687 TSecr=515123496"
"41","0.000048","1.2.195.103","1.1.75.244","SSLv3","1475","Application Data"
"42","0.000049","1.2.87.95","1.1.51.225","SSLv3","1475","Application Data"
"43","0.000051","1.1.88.78","1.2.207.187","TCP","70","52340  >  443 [ACK] Seq=1 Ack=1406 Win=65535 Len=0 TSval=224557701 TSecr=515124551"
"44","0.000056","1.1.207.255","1.2.169.95","TCP","70","44567  >  443 [ACK] Seq=1 Ack=1406 Win=65535 Len=0 TSval=224557745 TSecr=515124594"
"45","0.000057","1.1.49.230","1.2.86.233","TCP","70","23459  >  443 [ACK] Seq=1 Ack=1 Win=65535 Len=0 TSval=224557749 TSecr=515124037"
"46","0.000058","1.1.124.33","1.2.150.75","TCP","70","9991  >  443 [ACK] Seq=1 Ack=1 Win=65535 Len=0 TSval=224557755 TSecr=515123362"
"47","0.000063","1.2.51.118","1.1.186.208","SSLv3","1475","Application Data"
"48","0.000064","1.1.98.89","1.2.188.49","TCP","70","49389  >  443 [ACK] Seq=1 Ack=1406 Win=65535 Len=0 TSval=224557805 TSecr=515124777"
"49","0.000064","1.2.11.11","1.1.101.248","SSLv3","1475","Application Data"
"50","0.000065","1.1.171.84","1.2.245.151","TCP","70","18010  >  443 [ACK] Seq=1 Ack=1 Win=65535 Len=0 TSval=224557816 TSecr=515124068"
"51","0.000066","1.2.107.136","1.1.240.98","SSLv3","1475","Application Data"
"52","0.000069","1.1.20.205","1.2.130.90","TCP","70","15124  >  443 [ACK] Seq=1 Ack=1 Win=65535 Len=0 TSval=224557847 TSecr=515123892"
"53","0.000070","1.2.217.205","1.1.247.66","SSLv3","1475","Application Data"
"54","0.000071","1.2.75.97","1.1.145.115","SSLv3","1475","Application Data"
"55","0.000072","1.2.96.158","1.1.60.133","TCP","74","443  >  58184 [SYN, ACK] Seq=0 Ack=1 Win=5792 Len=0 MSS=1460 TSval=515125110 TSecr=224557121"
"56","0.000073","1.1.13.224","1.2.52.168","TCP","70","14691  >  443 [ACK] Seq=1 Ack=1 Win=65535 Len=0 TSval=224557879 TSecr=515124183"
"57","0.000079","1.2.173.132","1.1.112.186","SSLv3","1475","Application Data"
"58","0.000080","1.2.83.241","1.1.47.209","SSLv3","1475","Application Data"
"59","0.000081","1.1.36.118","1.2.76.7","TCP","70","64711  >  443 [ACK] Seq=1 Ack=1 Win=65535 Len=0 TSval=224557942 TSecr=515124306"
"60","0.000081","1.2.115.201","1.1.252.242","SSLv3","1475","Application Data"
"61","0.000082","1.2.142.207","1.1.23.184","SSLv3","570","Application Data"
"62","0.000083","1.1.67.75","1.2.103.5","TCP","70","27584  >  443 [ACK] Seq=1 Ack=1 Win=65535 Len=0 TSval=224557955 TSecr=515124425"
"63","0.000083","1.1.10.214","1.2.134.205","TCP","70","14224  >  443 [ACK] Seq=1 Ack=1 Win=65535 Len=0 TSval=224557959 TSecr=515123954"
"64","0.000087","1.2.125.118","1.1.239.134","SSLv3","1475","Application Data"
"65","0.000091","1.1.242.222","1.2.218.155","TCP","70","57180  >  443 [ACK] Seq=1 Ack=1 Win=65535 Len=0 TSval=224558022 TSecr=515124478"
"66","0.000091","1.1.7.190","1.2.42.59","TCP","70","41718  >  443 [ACK] Seq=1 Ack=1 Win=65535 Len=0 TSval=224558024 TSecr=515124124"
"67","0.000093","1.1.60.133","1.2.96.158","TCP","70","58184  >  443 [ACK] Seq=1 Ack=1 Win=17376 Len=0 TSval=224558036 TSecr=515125110"
"68","0.000092","1.2.41.7","1.1.182.84","SSLv3","1475","Application Data"
"69","0.000096","1.2.176.63","1.1.96.193","SSLv3","1475","Application Data"
"70","0.000099","1.1.41.165","1.2.79.210","TCP","70","59536  >  443 [ACK] Seq=1 Ack=1 Win=65535 Len=0 TSval=224558086 TSecr=515124236"
"71","0.000099","1.2.44.92","1.1.183.60","SSLv3","1475","Application Data"
"72","0.000100","1.2.45.201","1.1.8.23","SSLv3","1475","Application Data"
"73","0.000102","1.1.160.70","1.2.131.171","TCP","70","15465  >  443 [ACK] Seq=1 Ack=1406 Win=65535 Len=0 TSval=224558113 TSecr=515124861"
"74","0.000101","1.2.42.6","1.1.6.87","SSLv3","1475","Application Data"
"75","0.000103","1.2.216.125","1.1.241.125","SSLv3","1475","Application Data"
"76","0.000104","1.2.181.58","1.1.232.207","SSLv3","1475","Application Data"
"77","0.000106","1.1.240.98","1.2.107.136","TCP","70","28739  >  443 [ACK] Seq=1 Ack=1406 Win=65535 Len=0 TSval=224558144 TSecr=515125061"
"78","0.000108","1.2.194.11","1.1.79.158","SSLv3","1475","Application Data"
"79","0.000109","1.2.194.133","1.1.82.173","SSLv3","1475","Application Data"
"80","0.000111","1.2.227.137","1.1.135.182","SSLv3","1475","Application Data"
"81","0.000112","1.1.51.225","1.2.87.95","TCP","70","61466  >  443 [ACK] Seq=1 Ack=1406 Win=65535 Len=0 TSval=224558194 TSecr=515124927"
"82","0.000112","1.2.23.180","1.1.114.252","SSLv3","1475","Application Data"
"83","0.000116","1.1.47.209","1.2.83.241","TCP","70","22700  >  443 [ACK] Seq=1 Ack=1406 Win=65535 Len=0 TSval=224558222 TSecr=515125169"
"84","0.000120","1.1.252.242","1.2.115.201","TCP","70","50322  >  443 [ACK] Seq=1 Ack=1406 Win=65535 Len=0 TSval=224558258 TSecr=515125179"
"85","0.000121","1.2.216.222","1.1.242.202","SSLv3","1475","Application Data"
"86","0.000124","1.1.101.248","1.2.11.11","TCP","70","4043  >  443 [ACK] Seq=1 Ack=1406 Win=65535 Len=0 TSval=224558286 TSecr=515125041"
"87","0.000127","1.2.26.233","1.1.119.152","SSLv3","1475","Application Data"
"88","0.000129","1.1.239.134","1.2.125.118","TCP","70","33341  >  443 [ACK] Seq=1 Ack=1406 Win=65535 Len=0 TSval=224558325 TSecr=515125229"
"89","0.000128","1.2.23.233","1.1.113.216","SSLv3","1475","Application Data"
"90","0.000130","1.2.31.164","1.1.200.133","SSLv3","1475","Application Data"
"91","0.000133","1.2.85.156","1.1.135.41","SSLv3","1475","Application Data"
"92","0.000134","1.2.214.220","1.1.136.207","SSLv3","1475","Application Data"
"93","0.000135","1.2.90.141","1.1.56.24","SSLv3","1475","Application Data"
"94","0.000136","1.2.227.185","1.1.135.83","SSLv3","1475","Application Data"
"95","0.000140","1.2.241.219","1.1.150.189","SSLv3","1475","Application Data"
"96","0.000142","1.1.135.182","1.2.227.137","TCP","70","61507  >  443 [ACK] Seq=1 Ack=1406 Win=65535 Len=0 TSval=224558427 TSecr=515125417"
"97","0.000141","1.2.162.35","1.1.199.253","SSLv3","1475","Application Data"
"98","0.000142","1.2.11.127","1.1.101.20","SSLv3","1475","Application Data"
"99","0.000144","1.2.198.231","1.1.251.124","SSLv3","1475","Application Data"
"100","0.000150","1.2.82.36","1.1.155.13","SSLv3","1475","Application Data"
"101","0.000151","1.1.37.211","1.2.248.196","SSLv3","210","Client Key Exchange, Change Cipher Spec, Encrypted Handshake Message"
"102","0.000155","1.2.200.9","1.1.227.125","SSLv3","1475","Application Data"
"103","0.000156","1.2.221.95","1.1.65.97","SSLv3","1475","Application Data"
"104","0.000163","1.1.16.62","1.2.140.170","TCP","70","37224  >  443 [ACK] Seq=1 Ack=1406 Win=65535 Len=0 TSval=224558596 TSecr=515124805"
"105","0.000162","1.2.236.236","1.1.129.255","SSLv3","1475","Application Data"
"106","0.000164","1.1.200.133","1.2.31.164","TCP","70","39009  >  443 [ACK] Seq=1 Ack=1406 Win=65535 Len=0 TSval=224558605 TSecr=515125572"
"107","0.000164","1.2.207.110","1.1.227.189","SSLv3","1475","Application Data"
"108","0.000166","1.2.176.160","1.1.212.123","SSLv3","1475","Application Data"
"109","0.000167","1.2.24.63","1.1.192.26","SSLv3","1475","Application Data"
"110","0.000168","1.2.140.142","1.1.19.71","SSLv3","1475","Application Data"
"111","0.000169","1.2.168.184","1.1.120.42","SSLv3","1475","Application Data"
"112","0.000171","1.1.82.6","1.2.118.108","TCP","70","50980  >  443 [ACK] Seq=1 Ack=1406 Win=65535 Len=0 TSval=224558666 TSecr=515124908"
"113","0.000173","1.1.251.124","1.2.198.231","TCP","70","30633  >  443 [ACK] Seq=1 Ack=1406 Win=65535 Len=0 TSval=224558679 TSecr=515125680"
"114","0.000172","1.2.114.108","1.1.77.227","SSLv3","1475","Application Data"
"115","0.000175","1.1.113.216","1.2.23.233","TCP","70","45225  >  443 [ACK] Seq=1 Ack=1406 Win=65535 Len=0 TSval=224558692 TSecr=515125555"
"116","0.000174","1.2.115.53","1.1.81.63","SSLv3","1475","Application Data"
"117","0.000178","1.2.176.222","1.1.234.69","SSLv3","1475","Application Data"
"118","0.000179","1.1.112.186","1.2.173.132","TCP","70","7751  >  443 [ACK] Seq=1 Ack=1406 Win=65535 Len=0 TSval=224558729 TSecr=515125160"
"119","0.000179","1.2.89.176","1.1.129.205","SSLv3","1475","Application Data"
"120","0.000183","1.1.150.189","1.2.241.219","TCP","70","19102  >  443 [ACK] Seq=1 Ack=1406 Win=65535 Len=0 TSval=224558758 TSecr=515125648"
"121","0.000185","1.2.130.168","1.1.19.84","SSLv3","1475","Application Data"
"122","0.000186","1.1.23.184","1.2.142.207","TCP","70","16267  >  443 [ACK] Seq=1 Ack=501 Win=65535 Len=0 TSval=224558785 TSecr=515125188"
"123","0.000186","1.2.25.193","1.1.193.194","SSLv3","1475","Application Data"
"124","0.000188","1.1.190.104","1.2.153.99","TCP","70","40482  >  443 [ACK] Seq=1 Ack=1406 Win=65535 Len=0 TSval=224558797 TSecr=515124660"
"125","0.000194","1.1.136.207","1.2.214.220","TCP","70","56219  >  443 [ACK] Seq=1 Ack=1406 Win=65535 Len=0 TSval=224558845 TSecr=515125602"
"126","0.000195","1.2.194.89","1.1.82.187","SSLv3","1475","Application Data"
"127","0.000196","1.1.67.54","1.2.105.112","TCP","70","57898  >  443 [ACK] Seq=1 Ack=1406 Win=65535 Len=0 TSval=224558866 TSecr=515124795"
"128","0.000197","1.2.82.112","1.1.158.142","SSLv3","1475","Application Data"
"129","0.000198","1.2.70.255","1.1.144.206","SSLv3","1475","Application Data"
"130","0.000199","1.2.71.168","1.1.151.124","SSLv3","1475","Application Data"
"131","0.000200","1.2.83.155","1.1.132.174","SSLv3","1475","Application Data"
"132","0.000202","1.1.135.83","1.2.227.185","TCP","70","61555  >  443 [ACK] Seq=1 Ack=1406 Win=65535 Len=0 TSval=224558909 TSecr=515125622"
"133","0.000202","1.2.222.24","1.1.114.10","SSLv3","1475","Application Data"
"134","0.000204","1.1.45.91","1.2.81.75","TCP","70","59912  >  443 [ACK] Seq=1 Ack=1406 Win=65535 Len=0 TSval=224558929 TSecr=515124898"
"135","0.000204","1.2.102.220","1.1.60.152","SSLv3","1475","Application Data"
"136","0.000209","1.1.242.235","1.2.222.94","TCP","70","28466  >  443 [ACK] Seq=1 Ack=1406 Win=65535 Len=0 TSval=224558968 TSecr=515124532"
"137","0.000208","1.2.223.59","1.1.69.126","SSLv3","1475","Application Data"
"138","0.000212","1.1.75.244","1.2.195.103","TCP","70","31780  >  443 [ACK] Seq=1 Ack=1406 Win=65535 Len=0 TSval=224558994 TSecr=515124917"
"139","0.000212","1.2.91.133","1.1.51.46","SSLv3","1475","Application Data"
"140","0.000213","1.2.225.131","1.1.44.71","SSLv3","1475","Application Data"
"141","0.000214","1.2.125.48","1.1.238.78","SSLv3","1475","Application Data"
"142","0.000217","1.1.163.112","1.2.142.1","TCP","70","16064  >  443 [ACK] Seq=1 Ack=1406 Win=65535 Len=0 TSval=224559035 TSecr=515124673"
"143","0.000219","1.1.227.125","1.2.200.9","TCP","70","32966  >  443 [ACK] Seq=1 Ack=1406 Win=65535 Len=0 TSval=224559048 TSecr=515125772"
"144","0.000220","1.1.96.193","1.2.176.63","TCP","70","2297  >  443 [ACK] Seq=1 Ack=1406 Win=65535 Len=0 TSval=224559057 TSecr=515125299"
"145","0.000222","1.2.136.73","1.1.24.76","SSLv3","1475","Application Data"
"146","0.000225","1.1.19.59","1.2.140.215","TCP","70","37268  >  443 [ACK] Seq=1 Ack=1406 Win=65535 Len=0 TSval=224559098 TSecr=515124852"
"147","0.000226","1.2.47.166","1.1.10.149","SSLv3","1475","Application Data"
"148","0.000228","1.1.129.205","1.2.89.176","TCP","70","24179  >  443 [ACK] Seq=1 Ack=1406 Win=65535 Len=0 TSval=224559117 TSecr=515125962"
"149","0.000228","1.1.8.23","1.2.45.201","TCP","70","12938  >  443 [ACK] Seq=1 Ack=1406 Win=65535 Len=0 TSval=224559119 TSecr=515125332"
"150","0.000227","1.2.74.160","1.1.38.108","SSLv3","1475","Application Data"
"151","0.000229","1.2.124.29","1.1.226.55","SSLv3","1475","Application Data"
"152","0.000230","1.2.103.251","1.1.244.67","SSLv3","1475","Application Data"
"153","0.000232","1.2.232.123","1.1.141.76","SSLv3","1475","Application Data"
"154","0.000233","1.1.6.87","1.2.42.6","TCP","70","41666  >  443 [ACK] Seq=1 Ack=1406 Win=65535 Len=0 TSval=224559161 TSecr=515125341"
"155","0.000233","1.2.217.177","1.1.241.248","SSLv3","1475","Application Data"
"156","0.000236","1.1.114.252","1.2.23.180","TCP","70","45167  >  443 [ACK] Seq=1 Ack=1406 Win=65535 Len=0 TSval=224559184 TSecr=515125427"
"157","0.000237","1.1.247.66","1.2.217.205","TCP","70","29323  >  443 [ACK] Seq=1 Ack=1406 Win=65535 Len=0 TSval=224559187 TSecr=515125091"
"158","0.000237","1.1.232.207","1.2.181.58","TCP","70","1523  >  443 [ACK] Seq=1 Ack=1406 Win=65535 Len=0 TSval=224559188 TSecr=515125361"
"159","0.000241","1.1.212.123","1.2.176.160","TCP","70","46429  >  443 [ACK] Seq=1 Ack=1406 Win=65535 Len=0 TSval=224559226 TSecr=515125857"
"160","0.000241","1.2.108.79","1.1.74.4","SSLv3","1475","Application Data"
"161","0.000243","1.2.71.21","1.1.150.116","SSLv3","1475","Application Data"
"162","0.000244","1.1.155.13","1.2.82.36","TCP","70","22239  >  443 [ACK] Seq=1 Ack=1406 Win=65535 Len=0 TSval=224559246 TSecr=515125730"
"163","0.000245","1.1.114.10","1.2.222.24","TCP","70","28369  >  443 [ACK] Seq=1 Ack=1406 Win=65535 Len=0 TSval=224559252 TSecr=515126151"
"164","0.000245","1.1.119.152","1.2.26.233","TCP","70","45988  >  443 [ACK] Seq=1 Ack=1406 Win=65535 Len=0 TSval=224559257 TSecr=515125545"
"165","0.000249","1.1.144.206","1.2.70.255","TCP","70","19386  >  443 [ACK] Seq=1 Ack=1406 Win=65535 Len=0 TSval=224559287 TSecr=515126115"
"166","0.000250","1.1.182.84","1.2.41.7","TCP","70","11714  >  443 [ACK] Seq=1 Ack=1406 Win=65535 Len=0 TSval=224559296 TSecr=515125271"
"167","0.000252","1.1.227.189","1.2.207.110","TCP","70","52265  >  443 [ACK] Seq=1 Ack=1406 Win=65535 Len=0 TSval=224559306 TSecr=515125841"
"168","0.000252","1.1.10.149","1.2.47.166","TCP","70","34898  >  443 [ACK] Seq=1 Ack=1406 Win=43440 Len=0 TSval=224559314 TSecr=515126341"
"169","0.000253","1.1.135.41","1.2.85.156","TCP","70","58967  >  443 [ACK] Seq=1 Ack=1406 Win=65535 Len=0 TSval=224559321 TSecr=515125593"
"170","0.000255","1.1.186.208","1.2.51.118","TCP","70","33838  >  443 [ACK] Seq=1 Ack=1406 Win=65535 Len=0 TSval=224559332 TSecr=515125032"
"171","0.000254","1.2.79.95","1.1.159.67","SSLv3","1475","Application Data"
"172","0.000255","1.2.13.211","1.1.220.141","SSLv3","1475","Application Data"
"173","0.000256","1.2.33.56","1.1.123.178","SSLv3","1475","Application Data"
"174","0.000258","1.2.19.187","1.1.196.223","SSLv3","1475","Application Data"
"175","0.000259","1.1.242.202","1.2.216.222","TCP","70","29087  >  443 [ACK] Seq=1 Ack=1406 Win=65535 Len=0 TSval=224559367 TSecr=515125498"
"176","0.000259","1.2.81.245","1.1.154.6","SSLv3","1475","Application Data"
"177","0.000260","1.2.45.95","1.1.6.190","SSLv3","1475","Application Data"
"178","0.000262","1.1.241.248","1.2.217.177","TCP","70","56954  >  443 [ACK] Seq=1 Ack=1406 Win=65535 Len=0 TSval=224559390 TSecr=515126394"
"179","0.000264","1.1.241.125","1.2.216.125","TCP","70","28988  >  443 [ACK] Seq=1 Ack=1406 Win=65535 Len=0 TSval=224559404 TSecr=515125352"
"180","0.000264","1.2.73.101","1.1.150.10","SSLv3","1475","Application Data"
"181","0.000266","1.1.60.152","1.2.102.220","TCP","70","55191  >  443 [ACK] Seq=1 Ack=1406 Win=65535 Len=0 TSval=224559419 TSecr=515126161"
"182","0.000267","1.1.19.84","1.2.130.168","TCP","70","15205  >  443 [ACK] Seq=1 Ack=1406 Win=65535 Len=0 TSval=224559429 TSecr=515126012"
"183","0.000271","1.1.65.97","1.2.221.95","TCP","70","28184  >  443 [ACK] Seq=1 Ack=1406 Win=65535 Len=0 TSval=224559464 TSecr=515125784"
"184","0.000273","1.2.136.150","1.1.25.59","SSLv3","1475","Application Data"
"185","0.000275","1.1.193.194","1.2.25.193","TCP","70","7803  >  443 [ACK] Seq=1 Ack=1406 Win=65535 Len=0 TSval=224559492 TSecr=515126022"
"186","0.000274","1.2.23.122","1.1.115.141","SSLv3","1475","Application Data"
"187","0.000277","1.1.238.78","1.2.125.48","TCP","70","52723  >  443 [ACK] Seq=1 Ack=1406 Win=65535 Len=0 TSval=224559509 TSecr=515126247"
"188","0.000279","1.1.19.71","1.2.140.142","TCP","70","37190  >  443 [ACK] Seq=1 Ack=1406 Win=65535 Len=0 TSval=224559526 TSecr=515125876"
"189","0.000282","1.1.69.126","1.2.223.59","TCP","70","58361  >  443 [ACK] Seq=1 Ack=1406 Win=65535 Len=0 TSval=224559551 TSecr=515126199"
"190","0.000283","1.2.82.124","1.1.47.99","SSLv3","1475","Application Data"
"191","0.000287","1.1.120.42","1.2.168.184","TCP","70","8561  >  443 [ACK] Seq=1 Ack=1406 Win=65535 Len=0 TSval=224559586 TSecr=515125886"
"192","0.000286","1.2.248.180","1.1.147.121","SSLv3","1475","Application Data"
"193","0.000287","1.2.135.141","1.1.186.180","SSLv3","1475","Application Data"
"194","0.000288","1.2.140.168","1.1.13.122","SSLv3","1475","Application Data"
"195","0.000289","1.2.125.174","1.1.88.196","SSLv3","1475","Application Data"
"196","0.000291","1.2.148.28","1.1.204.152","SSLv3","1475","Application Data"
"197","0.000292","1.2.67.233","1.1.169.74","SSLv3","1475","Application Data"
"198","0.000295","1.1.51.46","1.2.91.133","TCP","70","24627  >  443 [ACK] Seq=1 Ack=1406 Win=40544 Len=0 TSval=224559651 TSecr=515126227"
"199","0.000294","1.2.43.139","1.1.178.244","SSLv3","1475","Application Data"
"200","0.000295","1.2.18.229","1.1.217.72","SSLv3","1475","Application Data"
"201","0.000300","1.2.56.75","1.1.186.145","SSLv3","1475","Application Data"
"202","0.000301","1.2.245.139","1.1.26.162","SSLv3","1475","Application Data"
"203","0.000303","1.1.24.76","1.2.136.73","TCP","70","16650  >  443 [ACK] Seq=1 Ack=1406 Win=65535 Len=0 TSval=224559715 TSecr=515126306"
"204","0.000304","1.1.82.173","1.2.194.133","TCP","70","51014  >  443 [ACK] Seq=1 Ack=1406 Win=65535 Len=0 TSval=224559726 TSecr=515125407"
"205","0.000307","1.2.43.28","1.1.177.89","SSLv3","1475","Application Data"
"206","0.000310","1.1.183.60","1.2.44.92","TCP","70","40223  >  443 [ACK] Seq=1 Ack=1406 Win=65535 Len=0 TSval=224559777 TSecr=515125322"
"207","0.000311","1.1.226.55","1.2.124.29","TCP","70","52439  >  443 [ACK] Seq=1 Ack=1406 Win=65535 Len=0 TSval=224559780 TSecr=515126360"
"208","0.000311","1.1.145.115","1.2.75.97","TCP","70","64540  >  443 [ACK] Seq=1 Ack=1406 Win=65535 Len=0 TSval=224559781 TSecr=515125100"
"209","0.000313","1.1.56.24","1.2.90.141","TCP","70","62291  >  443 [ACK] Seq=1 Ack=1406 Win=65535 Len=0 TSval=224559795 TSecr=515125612"
"210","0.000317","1.2.148.27","1.1.119.195","SSLv3","1475","Application Data"
"211","0.000319","1.1.74.4","1.2.108.79","TCP","70","56590  >  443 [ACK] Seq=1 Ack=1406 Win=65535 Len=0 TSval=224559846 TSecr=515126462"
"212","0.000319","1.1.79.158","1.2.194.11","TCP","70","50883  >  443 [ACK] Seq=1 Ack=1406 Win=65535 Len=0 TSval=224559847 TSecr=515125398"
"213","0.000319","1.1.199.253","1.2.162.35","TCP","70","42717  >  443 [ACK] Seq=1 Ack=1406 Win=65535 Len=0 TSval=224559850 TSecr=515125657"
"214","0.000321","1.2.140.240","1.1.161.73","SSLv3","1475","Application Data"
"215","0.000323","1.2.132.213","1.1.184.195","SSLv3","1475","Application Data"
"216","0.000324","1.2.24.134","1.1.110.106","SSLv3","1475","Application Data"
"217","0.000325","1.2.38.145","1.1.127.88","SSLv3","1475","Application Data"
"218","0.000327","1.1.129.255","1.2.236.236","TCP","70","23975  >  443 [ACK] Seq=1 Ack=1406 Win=65535 Len=0 TSval=224559913 TSecr=515125832"
"219","0.000328","1.1.192.26","1.2.24.63","TCP","70","45307  >  443 [ACK] Seq=1 Ack=1406 Win=65535 Len=0 TSval=224559915 TSecr=515125867"
"220","0.000327","1.2.43.252","1.1.178.1","SSLv3","1475","Application Data"
"221","0.000328","1.2.251.77","1.1.158.22","SSLv3","1475","Application Data"
"222","0.000333","1.2.173.136","1.1.193.96","SSLv3","1475","Application Data"
"223","0.000336","1.1.132.174","1.2.83.155","TCP","70","58456  >  443 [ACK] Seq=1 Ack=1406 Win=65535 Len=0 TSval=224559980 TSecr=515126134"
"224","0.000336","1.1.158.142","1.2.82.112","TCP","70","22313  >  443 [ACK] Seq=1 Ack=1406 Win=65535 Len=0 TSval=224559981 TSecr=515126105"
"225","0.000335","1.2.192.84","1.1.79.136","SSLv3","1475","Application Data"
"226","0.000339","1.2.162.125","1.1.112.102","SSLv3","1475","Application Data"
"227","0.000341","1.2.192.24","1.1.75.163","SSLv3","1475","Application Data"
"228","0.000344","1.1.151.124","1.2.71.168","TCP","70","1126  >  443 [ACK] Seq=1 Ack=1406 Win=65535 Len=0 TSval=224560043 TSecr=515126125"
"229","0.000344","1.1.150.116","1.2.71.21","TCP","70","19411  >  443 [ACK] Seq=1 Ack=1406 Win=65535 Len=0 TSval=224560044 TSecr=515126472"
"230","0.000345","1.2.131.190","1.1.20.174","SSLv3","1475","Application Data"
"231","0.000349","1.2.214.40","1.1.58.3","SSLv3","1475","Application Data"
"232","0.000351","1.1.244.67","1.2.103.251","TCP","70","27827  >  443 [ACK] Seq=1 Ack=1406 Win=65535 Len=0 TSval=224560106 TSecr=515126372"
"233","0.000351","1.1.26.162","1.2.245.139","TCP","70","64071  >  443 [ACK] Seq=1 Ack=1406 Win=65535 Len=0 TSval=224560106 TSecr=515126942"
"234","0.000353","1.2.106.74","1.1.66.148","SSLv3","1475","Application Data"
"235","0.000354","1.2.230.239","1.1.45.85","SSLv3","1475","Application Data"
"236","0.000355","1.2.51.138","1.1.13.235","SSLv3","1475","Application Data"
"237","0.000357","1.1.101.20","1.2.11.127","TCP","70","48183  >  443 [ACK] Seq=1 Ack=1406 Win=65535 Len=0 TSval=224560152 TSecr=515125667"
"238","0.000357","1.2.156.170","1.1.127.198","SSLv3","1475","Application Data"
"239","0.000360","1.1.123.178","1.2.33.56","TCP","70","39408  >  443 [ACK] Seq=1 Ack=1406 Win=65535 Len=0 TSval=224560172 TSecr=515126582"
"240","0.000359","1.2.58.128","1.1.164.254","SSLv3","1475","Application Data"
"241","0.000363","1.1.150.10","1.2.73.101","TCP","70","1568  >  443 [ACK] Seq=1 Ack=1406 Win=65535 Len=0 TSval=224560196 TSecr=515126643"
"242","0.000368","1.2.107.65","1.1.70.89","SSLv3","1475","Application Data"
"243","0.000369","1.2.113.54","1.1.248.62","SSLv3","1475","Application Data"
"244","0.000371","1.1.13.122","1.2.140.168","TCP","70","15719  >  443 [ACK] Seq=1 Ack=1406 Win=65535 Len=0 TSval=224560262 TSecr=515126837"
"245","0.000370","1.2.138.172","1.1.24.191","SSLv3","1475","Application Data"
"246","0.000373","1.2.5.67","1.1.235.48","SSLv3","1475","Application Data"
"247","0.000378","1.1.45.85","1.2.230.239","TCP","70","60345  >  443 [ACK] Seq=1 Ack=1406 Win=65535 Len=0 TSval=224560321 TSecr=515127366"
"248","0.000381","1.2.166.255","1.1.112.86","SSLv3","1475","Application Data"
"249","0.000385","1.2.115.219","1.1.79.211","SSLv3","1475","Application Data"
"250","0.000386","1.2.235.34","1.1.142.177","SSLv3","1475","Application Data"
"251","0.000388","1.2.248.196","1.1.37.211","TCP","70","443  >  21662 [ACK] Seq=1 Ack=141 Win=20272 Len=0 TSval=515127632 TSecr=224558505"
"252","0.000388","1.1.164.254","1.2.58.128","TCP","70","37697  >  443 [ACK] Seq=1 Ack=1406 Win=65535 Len=0 TSval=224560397 TSecr=515127404"
"253","0.000390","1.1.38.108","1.2.74.160","TCP","70","1885  >  443 [ACK] Seq=1 Ack=1406 Win=65535 Len=0 TSval=224560418 TSecr=515126351"
"254","0.000391","1.2.45.244","1.1.178.93","SSLv3","1475","Application Data"
"255","0.000393","1.1.196.223","1.2.19.187","TCP","70","42114  >  443 [ACK] Seq=1 Ack=1406 Win=65535 Len=0 TSval=224560437 TSecr=515126592"
"256","0.000392","1.2.56.17","1.1.161.50","SSLv3","1475","Application Data"
"257","0.000394","1.2.218.155","1.1.253.74","SSLv3","1475","Application Data"
"258","0.000398","1.1.77.227","1.2.114.108","TCP","70","30507  >  443 [ACK] Seq=1 Ack=1406 Win=65535 Len=0 TSval=224560481 TSecr=515125910"
"259","0.000397","1.2.232.21","1.1.140.254","SSLv3","1475","Application Data"
"260","0.000399","1.1.178.244","1.2.43.139","TCP","70","40013  >  443 [ACK] Seq=1 Ack=1406 Win=65535 Len=0 TSval=224560487 TSecr=515126884"
"261","0.000399","1.2.120.65","1.1.82.177","SSLv3","1475","Application Data"
"262","0.000401","1.1.25.59","1.2.136.150","TCP","70","36177  >  443 [ACK] Seq=1 Ack=1406 Win=65535 Len=0 TSval=224560499 TSecr=515126715"
"263","0.000400","1.2.166.70","1.1.105.22","SSLv3","1475","Application Data"
"264","0.000401","1.2.193.192","1.1.83.206","SSLv3","1475","Application Data"
"265","0.000407","1.1.161.73","1.2.140.240","TCP","70","37293  >  443 [ACK] Seq=1 Ack=1406 Win=65535 Len=0 TSval=224560547 TSecr=515127096"
"266","0.000407","1.1.6.190","1.2.45.95","TCP","70","40471  >  443 [ACK] Seq=1 Ack=1406 Win=65535 Len=0 TSval=224560551 TSecr=515126611"
"267","0.000408","1.1.47.99","1.2.82.124","TCP","70","22333  >  443 [ACK] Seq=1 Ack=1406 Win=65535 Len=0 TSval=224560558 TSecr=515126798"
"268","0.000408","1.1.81.63","1.2.115.53","TCP","70","30701  >  443 [ACK] Seq=1 Ack=1406 Win=65535 Len=0 TSval=224560559 TSecr=515125926"
"269","0.000414","1.1.112.102","1.2.162.125","TCP","70","42808  >  443 [ACK] Seq=1 Ack=1406 Win=65535 Len=0 TSval=224560609 TSecr=515127247"
"270","0.000415","1.1.169.74","1.2.67.233","TCP","70","18606  >  443 [ACK] Seq=1 Ack=1406 Win=65535 Len=0 TSval=224560612 TSecr=515126866"
"271","0.000414","1.2.184.199","1.1.102.247","SSLv3","1475","Application Data"
"272","0.000415","1.1.217.72","1.2.18.229","TCP","70","6046  >  443 [ACK] Seq=1 Ack=1406 Win=65535 Len=0 TSval=224560616 TSecr=515126894"
"273","0.000415","1.2.250.158","1.1.158.133","SSLv3","1475","Application Data"
"274","0.000416","1.2.163.10","1.1.197.231","SSLv3","1475","Application Data"
"275","0.000419","1.1.234.69","1.2.176.222","TCP","70","2455  >  443 [ACK] Seq=1 Ack=1406 Win=65535 Len=0 TSval=224560651 TSecr=515125952"
"276","0.000422","1.1.75.163","1.2.192.24","TCP","70","50409  >  443 [ACK] Seq=1 Ack=1406 Win=65535 Len=0 TSval=224560668 TSecr=515127256"
"277","0.000421","1.2.197.36","1.1.248.138","SSLv3","1475","Application Data"
"278","0.000424","1.2.45.11","1.1.178.42","SSLv3","1475","Application Data"
"279","0.000427","1.1.142.177","1.2.235.34","TCP","70","61405  >  443 [ACK] Seq=1 Ack=1406 Win=65535 Len=0 TSval=224560708 TSecr=515127623"
"280","0.000426","1.2.131.120","1.1.16.236","SSLv3","1475","Application Data"
"281","0.000428","1.1.82.187","1.2.194.89","TCP","70","31510  >  443 [ACK] Seq=1 Ack=1406 Win=65535 Len=0 TSval=224560715 TSecr=515126093"
"282","0.000427","1.2.104.149","1.1.241.191","SSLv3","1475","Application Data"
"283","0.000428","1.2.243.146","1.1.34.173","SSLv3","1475","Application Data"
"284","0.000429","1.2.248.24","1.1.33.253","SSLv3","1475","Application Data"
"285","0.000432","1.1.161.50","1.2.56.17","TCP","70","37070  >  443 [ACK] Seq=1 Ack=1406 Win=65535 Len=0 TSval=224560750 TSecr=515127670"
"286","0.000432","1.2.168.147","1.1.117.169","SSLv3","1475","Application Data"
"287","0.000435","1.1.58.3","1.2.214.40","TCP","70","56032  >  443 [ACK] Seq=1 Ack=1406 Win=65535 Len=0 TSval=224560772 TSecr=515127321"
"288","0.000436","1.1.44.71","1.2.225.131","TCP","70","58954  >  443 [ACK] Seq=1 Ack=1406 Win=65535 Len=0 TSval=224560780 TSecr=515126237"
"289","0.000436","1.2.37.89","1.1.126.227","SSLv3","1475","Application Data"
"290","0.000438","1.1.253.74","1.2.218.155","TCP","70","29529  >  443 [ACK] Seq=1 Ack=1406 Win=65535 Len=0 TSval=224560801 TSecr=515127680"
"291","0.000442","1.2.146.250","1.1.176.111","SSLv3","1475","Application Data"
"292","0.000443","1.1.220.141","1.2.13.211","TCP","70","4749  >  443 [ACK] Seq=1 Ack=1406 Win=65535 Len=0 TSval=224560841 TSecr=515126573"
"293","0.000444","1.1.235.48","1.2.5.67","TCP","70","2556  >  443 [ACK] Seq=1 Ack=1406 Win=65535 Len=0 TSval=224560848 TSecr=515127516"
"294","0.000445","1.1.186.180","1.2.135.141","TCP","70","33864  >  443 [ACK] Seq=1 Ack=1406 Win=65535 Len=0 TSval=224560856 TSecr=515126827"
"295","0.000444","1.2.203.29","1.1.87.35","SSLv3","1475","Application Data"
"296","0.000448","1.1.83.206","1.2.193.192","TCP","70","50829  >  443 [ACK] Seq=1 Ack=1406 Win=65535 Len=0 TSval=224560878 TSecr=515127739"
"297","0.000447","1.2.190.23","1.1.220.73","SSLv3","1475","Application Data"
"298","0.000449","1.2.181.225","1.1.239.50","SSLv3","1475","Application Data"
"299","0.000451","1.1.147.121","1.2.248.180","TCP","70","64881  >  443 [ACK] Seq=1 Ack=1406 Win=65535 Len=0 TSval=224560902 TSecr=515126817"
"300","0.000452","1.1.79.211","1.2.115.219","TCP","70","50324  >  443 [ACK] Seq=1 Ack=1406 Win=65535 Len=0 TSval=224560909 TSecr=515127613"
"301","0.000454","1.1.204.152","1.2.148.28","TCP","70","39136  >  443 [ACK] Seq=1 Ack=1406 Win=65535 Len=0 TSval=224560927 TSecr=515126856"
"302","0.000453","1.2.171.14","1.1.206.109","SSLv3","1475","Application Data"
"303","0.000455","1.2.224.222","1.1.49.129","SSLv3","1475","Application Data"
"304","0.000459","1.1.186.145","1.2.56.75","TCP","70","15620  >  443 [ACK] Seq=1 Ack=1406 Win=65535 Len=0 TSval=224560966 TSecr=515126930"
"305","0.000460","1.1.117.169","1.2.168.147","TCP","70","44363  >  443 [ACK] Seq=1 Ack=1406 Win=65535 Len=0 TSval=224560974 TSecr=515127985"
"306","0.000459","1.2.112.223","1.1.70.156","SSLv3","1475","Application Data"
"307","0.000461","1.2.205.170","1.1.230.33","SSLv3","1475","Application Data"
"308","0.000462","1.1.184.195","1.2.132.213","TCP","70","13712  >  443 [ACK] Seq=1 Ack=1406 Win=65535 Len=0 TSval=224560988 TSecr=515127115"
"309","0.000465","1.1.82.177","1.2.120.65","TCP","70","31994  >  443 [ACK] Seq=1 Ack=1406 Win=65535 Len=0 TSval=224561013 TSecr=515127720"
"310","0.000467","1.1.140.254","1.2.232.21","TCP","70","60622  >  443 [ACK] Seq=1 Ack=1406 Win=65535 Len=0 TSval=224561028 TSecr=515127710"
"311","0.000468","1.1.119.195","1.2.148.27","TCP","70","9430  >  443 [ACK] Seq=1 Ack=1406 Win=65535 Len=0 TSval=224561039 TSecr=515127068"
"312","0.000468","1.1.20.174","1.2.131.190","TCP","70","36999  >  443 [ACK] Seq=1 Ack=1406 Win=65535 Len=0 TSval=224561040 TSecr=515127295"
"313","0.000468","1.2.167.64","1.1.219.163","SSLv3","1475","Application Data"
"314","0.000469","1.1.248.62","1.2.113.54","TCP","70","51694  >  443 [ACK] Seq=1 Ack=1406 Win=65535 Len=0 TSval=224561049 TSecr=515127486"
"315","0.000470","1.1.141.76","1.2.232.123","TCP","70","60738  >  443 [ACK] Seq=1 Ack=1406 Win=65535 Len=0 TSval=224561053 TSecr=515126384"
"316","0.000470","1.1.154.6","1.2.81.245","TCP","70","22192  >  443 [ACK] Seq=1 Ack=1406 Win=65535 Len=0 TSval=224561057 TSecr=515126601"
"317","0.000472","1.1.87.35","1.2.203.29","TCP","70","33755  >  443 [ACK] Seq=1 Ack=1406 Win=65535 Len=0 TSval=224561067 TSecr=515128087"
"318","0.000475","1.2.200.28","1.1.238.71","SSLv3","1475","Application Data"
"319","0.000477","1.1.66.148","1.2.106.74","TCP","70","58119  >  443 [ACK] Seq=1 Ack=1406 Win=65535 Len=0 TSval=224561108 TSecr=515127356"
"320","0.000477","1.1.49.129","1.2.224.222","TCP","70","22939  >  443 [ACK] Seq=1 Ack=1406 Win=65535 Len=0 TSval=224561112 TSecr=515128168"
"321","0.000479","1.1.159.67","1.2.79.95","TCP","70","59417  >  443 [ACK] Seq=1 Ack=1406 Win=65535 Len=0 TSval=224561125 TSecr=515126561"
"322","0.000479","1.1.197.231","1.2.163.10","TCP","70","7107  >  443 [ACK] Seq=1 Ack=1406 Win=65535 Len=0 TSval=224561126 TSecr=515127862"
"323","0.000479","1.1.88.196","1.2.125.174","TCP","70","33382  >  443 [ACK] Seq=1 Ack=1406 Win=65535 Len=0 TSval=224561126 TSecr=515126847"
"324","0.000480","1.2.221.22","1.1.68.137","SSLv3","1475","Application Data"
"325","0.000482","1.2.41.215","1.1.4.191","SSLv3","1475","Application Data"
"326","0.000485","1.1.127.198","1.2.156.170","TCP","70","41327  >  443 [ACK] Seq=1 Ack=1406 Win=65535 Len=0 TSval=224561171 TSecr=515127385"
"327","0.000485","1.1.115.141","1.2.23.122","TCP","70","45109  >  443 [ACK] Seq=1 Ack=1406 Win=65535 Len=0 TSval=224561172 TSecr=515126724"
"328","0.000486","1.1.110.106","1.2.24.134","TCP","70","7490  >  443 [ACK] Seq=1 Ack=1406 Win=65535 Len=0 TSval=224561185 TSecr=515127126"
"329","0.000487","1.1.177.89","1.2.43.28","TCP","70","12247  >  443 [ACK] Seq=1 Ack=1406 Win=65535 Len=0 TSval=224561190 TSecr=515126987"
"330","0.000489","1.2.213.96","1.1.138.92","SSLv3","1475","Application Data"
"331","0.000491","1.2.219.17","1.1.252.219","SSLv3","1475","Application Data"
"332","0.000492","1.1.24.191","1.2.138.172","TCP","70","17246  >  443 [ACK] Seq=1 Ack=1406 Win=41992 Len=0 TSval=224561232 TSecr=515127495"
"333","0.000492","1.1.193.96","1.2.173.136","TCP","70","45634  >  443 [ACK] Seq=1 Ack=1406 Win=65535 Len=0 TSval=224561234 TSecr=515127192"
"334","0.000493","1.1.220.73","1.2.190.23","TCP","70","3805  >  443 [ACK] Seq=1 Ack=1406 Win=65535 Len=0 TSval=224561242 TSecr=515128107"
"335","0.000494","1.1.178.93","1.2.45.244","TCP","70","12976  >  443 [ACK] Seq=1 Ack=1406 Win=65535 Len=0 TSval=224561247 TSecr=515127661"
"336","0.000495","1.1.127.88","1.2.38.145","TCP","70","38738  >  443 [ACK] Seq=1 Ack=1406 Win=65535 Len=0 TSval=224561252 TSecr=515127135"
"337","0.000497","1.2.150.135","1.1.126.203","SSLv3","1475","Application Data"
"338","0.000500","1.1.34.173","1.2.243.146","TCP","70","1100  >  443 [ACK] Seq=1 Ack=1406 Win=65535 Len=0 TSval=224561291 TSecr=515127955"
"339","0.000500","1.1.70.89","1.2.107.65","TCP","70","58367  >  443 [ACK] Seq=1 Ack=1406 Win=65535 Len=0 TSval=224561295 TSecr=515127472"
"340","0.000501","1.1.126.227","1.2.37.89","TCP","70","38428  >  443 [ACK] Seq=1 Ack=1406 Win=65535 Len=0 TSval=224561305 TSecr=515128016"
"341","0.000502","1.1.178.1","1.2.43.252","TCP","70","40119  >  443 [ACK] Seq=1 Ack=1406 Win=65535 Len=0 TSval=224561313 TSecr=515127145"
"342","0.000507","1.1.4.191","1.2.41.215","TCP","70","41618  >  443 [ACK] Seq=1 Ack=1406 Win=65535 Len=0 TSval=224561348 TSecr=515128388"
"343","0.000506","1.2.131.164","1.1.16.106","SSLv3","1475","Application Data"
"344","0.000507","1.1.112.86","1.2.166.255","TCP","70","43966  >  443 [ACK] Seq=1 Ack=1406 Win=65535 Len=0 TSval=224561355 TSecr=515127580"
"345","0.000508","1.2.80.5","1.1.40.165","SSLv3","1475","Application Data"
"346","0.000509","1.1.176.111","1.2.146.250","TCP","70","11191  >  443 [ACK] Seq=1 Ack=1406 Win=65535 Len=0 TSval=224561368 TSecr=515128068"
"347","0.000511","1.1.79.136","1.2.192.84","TCP","70","30993  >  443 [ACK] Seq=1 Ack=1406 Win=34752 Len=0 TSval=224561380 TSecr=515127215"
"348","0.000510","1.2.186.81","1.1.106.163","SSLv3","1475","Application Data"
"349","0.000511","1.2.206.50","1.1.227.119","SSLv3","1475","Application Data"
"350","0.000512","1.2.59.170","1.1.22.183","SSLv3","1475","Application Data"
"351","0.000513","1.2.182.86","1.1.212.44","SSLv3","1475","Application Data"
"352","0.000515","1.1.158.133","1.2.250.158","TCP","70","65373  >  443 [ACK] Seq=1 Ack=1406 Win=65535 Len=0 TSval=224561414 TSecr=515127852"
"353","0.000517","1.2.4.207","1.1.212.141","SSLv3","1475","Application Data"
"354","0.000518","1.1.16.236","1.2.131.120","TCP","70","36918  >  443 [ACK] Seq=1 Ack=1406 Win=65535 Len=0 TSval=224561440 TSecr=515127936"
"355","0.000518","1.2.154.231","1.1.197.112","SSLv3","1475","Application Data"
"356","0.000523","1.1.248.138","1.2.197.36","TCP","70","30175  >  443 [ACK] Seq=1 Ack=1406 Win=65535 Len=0 TSval=224561476 TSecr=515127901"
"357","0.000525","1.2.110.35","1.1.72.111","SSLv3","1475","Application Data"
"358","0.000526","1.2.118.164","1.1.231.46","SSLv3","1475","Application Data"
"359","0.000530","1.1.238.71","1.2.200.28","TCP","70","52440  >  443 [ACK] Seq=1 Ack=1406 Win=65535 Len=0 TSval=224561536 TSecr=515128332"
"360","0.000538","1.2.152.130","1.1.179.38","SSLv3","1475","Application Data"
"361","0.000540","1.2.198.198","1.1.75.207","SSLv3","1475","Application Data"
"362","0.000541","1.2.0.214","1.1.91.227","SSLv3","1475","Application Data"
"363","0.000543","1.2.54.97","1.1.167.90","SSLv3","1475","Application Data"
"364","0.000544","1.2.124.74","1.1.227.213","SSLv3","1475","Application Data"
"365","0.000546","1.2.245.112","1.1.27.231","SSLv3","1475","Application Data"
"366","0.000547","1.2.75.194","1.1.40.140","SSLv3","1475","Application Data"
"367","0.000549","1.2.51.193","1.1.13.91","SSLv3","1475","Application Data"
"368","0.000551","1.1.241.191","1.2.104.149","TCP","70","27986  >  443 [ACK] Seq=1 Ack=1406 Win=65535 Len=0 TSval=224561705 TSecr=515127946"
"369","0.000551","1.2.74.167","1.1.39.191","SSLv3","1475","Application Data"
