"No.","Time","Source","Destination","Protocol","Length","Info"
"1","0.000000","1.2.102.211","1.1.210.113","SSLv3","704","Server Hello, Certificate, Server Key Exchange, Server Hello Done"
"2","0.000004","1.2.35.255","1.1.150.176","SSLv3","704","Server Hello, Certificate, Server Key Exchange, Server Hello Done"
"3","0.000018","1.2.82.130","1.1.80.23","SSLv3","704","Server Hello, Certificate, Server Key Exchange, Server Hello Done"
"4","0.000023","1.2.98.110","1.1.214.10","SSLv3","704","Server Hello, Certificate, Server Key Exchange, Server Hello Done"
"5","0.000027","1.2.22.55","1.1.161.211","SSLv3","704","Server Hello, Certificate, Server Key Exchange, Server Hello Done"
"6","0.000030","1.2.155.193","1.1.47.108","SSLv3","704","Server Hello, Certificate, Server Key Exchange, Server Hello Done"
"7","0.000034","1.2.142.16","1.1.57.187","SSLv3","704","Server Hello, Certificate, Server Key Exchange, Server Hello Done"
"8","0.000043","1.2.108.234","1.1.216.91","SSLv3","704","Server Hello, Certificate, Server Key Exchange, Server Hello Done"
"9","0.000047","1.2.88.187","1.1.175.234","SSLv3","704","Server Hello, Certificate, Server Key Exchange, Server Hello Done"
"10","0.000051","1.2.96.83","1.1.95.225","SSLv3","704","Server Hello, Certificate, Server Key Exchange, Server Hello Done"
"11","0.000055","1.2.115.45","1.1.198.186","SSLv3","704","Server Hello, Certificate, Server Key Exchange, Server Hello Done"
"12","0.000059","1.2.104.0","1.1.101.55","SSLv3","704","Server Hello, Certificate, Server Key Exchange, Server Hello Done"
"13","0.000277","1.1.32.33","1.2.32.122","TCP","70","39222  >  443 [ACK] Seq=1 Ack=1 Win=18824 Len=0 TSval=262431744 TSecr=552469862"
"14","0.000296","1.1.252.93","1.2.252.207","TCP","70","19850  >  443 [ACK] Seq=1 Ack=1 Win=18824 Len=0 TSval=262431896 TSecr=552946769"
"15","0.000404","1.1.169.119","1.2.29.241","TCP","70","44783  >  443 [ACK] Seq=1 Ack=1 Win=18824 Len=0 TSval=262432762 TSecr=551539410"
"16","0.000542","1.1.241.250","1.2.70.80","TCP","70","63242  >  443 [ACK] Seq=1 Ack=1 Win=18824 Len=0 TSval=262433859 TSecr=552365649"
"17","0.002676","1.1.171.111","1.2.31.197","TCP","70","39038  >  443 [ACK] Seq=1 Ack=1 Win=18824 Len=0 TSval=262450931 TSecr=551439233"
"18","0.003235","1.1.48.115","1.2.132.200","TCP","70","13701  >  443 [ACK] Seq=1 Ack=1 Win=18824 Len=0 TSval=262455404 TSecr=552365619"
"19","0.003682","1.1.162.28","1.2.22.114","TCP","70","42801  >  443 [ACK] Seq=1 Ack=1 Win=18824 Len=0 TSval=262458984 TSecr=552365905"
"20","0.003764","1.1.100.200","1.2.209.29","TCP","70","27083  >  443 [ACK] Seq=1 Ack=1 Win=18824 Len=0 TSval=262459640 TSecr=552844482"
"21","0.005173","1.1.43.232","1.2.153.15","TCP","70","35233  >  443 [ACK] Seq=1 Ack=1 Win=18824 Len=0 TSval=262470908 TSecr=552327850"
"22","0.005192","1.1.246.228","1.2.67.71","TCP","70","62485  >  443 [ACK] Seq=1 Ack=1 Win=18824 Len=0 TSval=262471062 TSecr=552327147"
"23","0.005438","1.1.229.179","1.2.82.9","TCP","70","22226  >  443 [ACK] Seq=1 Ack=1 Win=18824 Len=0 TSval=262473030 TSecr=552328362"
"24","0.005523","1.1.31.229","1.2.148.58","TCP","70","39156  >  443 [ACK] Seq=1 Ack=1 Win=18824 Len=0 TSval=262473712 TSecr=551260842"
"25","0.005580","1.1.243.42","1.2.71.153","TCP","70","19551  >  443 [ACK] Seq=1 Ack=1 Win=18824 Len=0 TSval=262474167 TSecr=552365522"
"26","0.005604","1.1.36.104","1.2.144.189","TCP","70","10617  >  443 [ACK] Seq=1 Ack=1 Win=18824 Len=0 TSval=262474355 TSecr=551539185"
"27","0.006087","1.1.57.187","1.2.142.16","TCP","70","16075  >  443 [ACK] Seq=1 Ack=635 Win=18824 Len=0 TSval=262478223 TSecr=552997038"
"28","0.006451","1.1.45.193","1.2.46.38","TCP","70","13032  >  443 [ACK] Seq=1 Ack=1 Win=18824 Len=0 TSval=262481137 TSecr=552946867"
"29","0.006508","1.1.146.22","1.2.38.131","TCP","70","38831  >  443 [ACK] Seq=1 Ack=1 Win=18824 Len=0 TSval=262481594 TSecr=552470413"
"30","0.006768","1.1.94.92","1.2.234.177","TCP","70","61288  >  443 [ACK] Seq=1 Ack=1 Win=18824 Len=0 TSval=262483667 TSecr=552469826"
"31","0.008466","1.1.23.42","1.2.163.127","TCP","70","45110  >  443 [ACK] Seq=1 Ack=1 Win=18824 Len=0 TSval=262497251 TSecr=551464706"
"32","0.009409","1.1.149.221","1.2.34.51","TCP","70","39709  >  443 [ACK] Seq=1 Ack=1 Win=18824 Len=0 TSval=262504795 TSecr=552366064"
"33","0.009454","1.1.84.177","1.2.225.6","TCP","70","58816  >  443 [ACK] Seq=1 Ack=1 Win=18824 Len=0 TSval=262505154 TSecr=551641342"
"34","0.009464","1.2.62.190","1.1.138.104","SSLv3","704","Server Hello, Certificate, Server Key Exchange, Server Hello Done"
"35","0.009471","1.2.64.29","1.1.139.199","SSLv3","704","Server Hello, Certificate, Server Key Exchange, Server Hello Done"
"36","0.009475","1.2.48.240","1.1.132.154","SSLv3","704","Server Hello, Certificate, Server Key Exchange, Server Hello Done"
"37","0.009479","1.2.44.108","1.1.44.9","SSLv3","704","Server Hello, Certificate, Server Key Exchange, Server Hello Done"
"38","0.009482","1.2.94.77","1.1.233.247","SSLv3","704","Server Hello, Certificate, Server Key Exchange, Server Hello Done"
"39","0.009497","1.2.133.136","1.1.133.16","SSLv3","704","Server Hello, Certificate, Server Key Exchange, Server Hello Done"
"40","0.009502","1.2.189.124","1.1.188.111","SSLv3","704","Server Hello, Certificate, Server Key Exchange, Server Hello Done"
"41","0.009506","1.2.193.184","1.1.117.99","SSLv3","704","Server Hello, Certificate, Server Key Exchange, Server Hello Done"
"42","0.009510","1.2.189.79","1.1.188.234","SSLv3","704","Server Hello, Certificate, Server Key Exchange, Server Hello Done"
"43","0.009514","1.2.179.135","1.1.179.34","SSLv3","704","Server Hello, Certificate, Server Key Exchange, Server Hello Done"
"44","0.009904","1.1.98.45","1.2.214.130","TCP","70","56148  >  443 [ACK] Seq=1 Ack=1 Win=18824 Len=0 TSval=262508756 TSecr=552845118"
"45","0.010060","1.1.167.3","1.2.19.89","TCP","70","42012  >  443 [ACK] Seq=1 Ack=1 Win=18824 Len=0 TSval=262510004 TSecr=552418072"
"46","0.011198","1.1.72.23","1.2.72.123","TCP","70","1333  >  443 [ACK] Seq=1 Ack=1 Win=18824 Len=0 TSval=262519113 TSecr=552365812"
"47","0.011504","1.1.31.57","1.2.171.142","TCP","70","38985  >  443 [ACK] Seq=1 Ack=1 Win=18824 Len=0 TSval=262521558 TSecr=552327717"
"48","0.011620","1.1.176.129","1.2.4.215","TCP","70","2455  >  443 [ACK] Seq=1 Ack=1 Win=18824 Len=0 TSval=262522489 TSecr=551539441"
"49","0.011654","1.1.228.243","1.2.81.93","TCP","70","22150  >  443 [ACK] Seq=1 Ack=1 Win=18824 Len=0 TSval=262522762 TSecr=551261019"
"50","0.011718","1.1.226.225","1.2.87.89","TCP","70","23592  >  443 [ACK] Seq=1 Ack=1 Win=18824 Len=0 TSval=262523267 TSecr=552328393"
"51","0.011786","1.1.163.193","1.2.24.23","TCP","70","7398  >  443 [ACK] Seq=1 Ack=1 Win=18824 Len=0 TSval=262523818 TSecr=552365745"
"52","0.012604","1.1.255.182","1.2.249.181","TCP","70","21940  >  443 [ACK] Seq=1 Ack=1 Win=18824 Len=0 TSval=262530362 TSecr=552521727"
"53","0.013125","1.1.153.90","1.2.45.176","TCP","70","12904  >  443 [ACK] Seq=1 Ack=1 Win=18824 Len=0 TSval=262534527 TSecr=552470474"
"54","0.014892","1.1.104.62","1.2.220.147","TCP","70","27966  >  443 [ACK] Seq=1 Ack=1 Win=18824 Len=0 TSval=262548660 TSecr=551538298"
"55","0.015832","1.1.146.176","1.2.39.25","TCP","70","11236  >  443 [ACK] Seq=1 Ack=1 Win=18824 Len=0 TSval=262556183 TSecr=551741573"
"56","0.015920","1.1.19.176","1.2.160.5","TCP","70","42178  >  443 [ACK] Seq=1 Ack=1 Win=18824 Len=0 TSval=262556883 TSecr=552469895"
"57","0.016004","1.1.71.129","1.2.253.218","TCP","70","64833  >  443 [ACK] Seq=1 Ack=1 Win=18824 Len=0 TSval=262557561 TSecr=552896556"
"58","0.016016","1.1.133.16","1.2.133.136","TCP","70","35401  >  443 [ACK] Seq=1 Ack=635 Win=18824 Len=0 TSval=262557653 TSecr=553072742"
"59","0.016025","1.2.2.154","1.1.182.68","SSLv3","704","Server Hello, Certificate, Server Key Exchange, Server Hello Done"
"60","0.016030","1.2.21.10","1.1.160.180","SSLv3","704","Server Hello, Certificate, Server Key Exchange, Server Hello Done"
"61","0.016034","1.2.170.90","1.1.30.5","SSLv3","704","Server Hello, Certificate, Server Key Exchange, Server Hello Done"
"62","0.016038","1.2.225.38","1.1.84.209","SSLv3","704","Server Hello, Certificate, Server Key Exchange, Server Hello Done"
"63","0.016042","1.2.39.151","1.1.147.65","SSLv3","704","Server Hello, Certificate, Server Key Exchange, Server Hello Done"
"64","0.016055","1.2.162.200","1.1.22.94","SSLv3","704","Server Hello, Certificate, Server Key Exchange, Server Hello Done"
"65","0.016060","1.2.200.175","1.1.124.90","SSLv3","704","Server Hello, Certificate, Server Key Exchange, Server Hello Done"
"66","0.016064","1.2.220.165","1.1.220.45","SSLv3","704","Server Hello, Certificate, Server Key Exchange, Server Hello Done"
"67","0.016068","1.2.52.150","1.1.128.64","SSLv3","704","Server Hello, Certificate, Server Key Exchange, Server Hello Done"
"68","0.016072","1.2.239.21","1.1.238.179","SSLv3","704","Server Hello, Certificate, Server Key Exchange, Server Hello Done"
"69","0.016080","1.2.203.232","1.1.203.132","SSLv3","704","Server Hello, Certificate, Server Key Exchange, Server Hello Done"
"70","0.016084","1.2.220.178","1.1.220.61","SSLv3","704","Server Hello, Certificate, Server Key Exchange, Server Hello Done"
"71","0.016088","1.2.185.109","1.1.13.24","SSLv3","704","Server Hello, Certificate, Server Key Exchange, Server Hello Done"
"72","0.016092","1.2.24.182","1.1.163.145","SSLv3","704","Server Hello, Certificate, Server Key Exchange, Server Hello Done"
"73","0.016096","1.2.241.205","1.1.240.162","SSLv3","704","Server Hello, Certificate, Server Key Exchange, Server Hello Done"
"74","0.016470","1.1.55.45","1.2.131.130","TCP","70","15427  >  443 [ACK] Seq=1 Ack=1 Win=18824 Len=0 TSval=262561290 TSecr=552470664"
"75","0.017658","1.1.189.44","1.2.9.130","TCP","70","3646  >  443 [ACK] Seq=1 Ack=1 Win=18824 Len=0 TSval=262570787 TSecr=552328039"
"76","0.017663","1.2.220.11","1.1.211.81","SSLv3","704","Server Hello, Certificate, Server Key Exchange, Server Hello Done"
"77","0.017668","1.2.19.249","1.1.19.136","SSLv3","704","Server Hello, Certificate, Server Key Exchange, Server Hello Done"
"78","0.017670","1.1.110.171","1.2.219.0","TCP","70","57274  >  443 [ACK] Seq=1 Ack=1 Win=18824 Len=0 TSval=262570884 TSecr=552366034"
"79","0.017672","1.2.195.178","1.1.119.93","SSLv3","704","Server Hello, Certificate, Server Key Exchange, Server Hello Done"
"80","0.017677","1.2.178.67","1.1.5.238","SSLv3","704","Server Hello, Certificate, Server Key Exchange, Server Hello Done"
"81","0.017680","1.2.77.26","1.1.248.196","SSLv3","704","Server Hello, Certificate, Server Key Exchange, Server Hello Done"
"82","0.017690","1.2.191.89","1.1.189.172","SSLv3","704","Server Hello, Certificate, Server Key Exchange, Server Hello Done"
"83","0.017694","1.2.3.69","1.1.182.239","SSLv3","704","Server Hello, Certificate, Server Key Exchange, Server Hello Done"
"84","0.017698","1.2.96.63","1.1.235.214","SSLv3","704","Server Hello, Certificate, Server Key Exchange, Server Hello Done"
"85","0.017803","1.1.24.198","1.2.173.27","TCP","70","7623  >  443 [ACK] Seq=1 Ack=1 Win=18824 Len=0 TSval=262571947 TSecr=551641276"
"86","0.017999","1.1.18.106","1.2.166.191","TCP","70","6008  >  443 [ACK] Seq=1 Ack=1 Win=18824 Len=0 TSval=262573518 TSecr=551364344"
"87","0.018096","1.1.153.217","1.2.154.244","TCP","70","13993  >  443 [ACK] Seq=1 Ack=1 Win=18824 Len=0 TSval=262574296 TSecr=552418030"
"88","0.018207","1.1.133.204","1.2.50.237","TCP","70","14583  >  443 [ACK] Seq=1 Ack=1 Win=18824 Len=0 TSval=262575183 TSecr=552365321"
"89","0.018912","1.1.217.36","1.2.109.122","TCP","70","56894  >  443 [ACK] Seq=1 Ack=1 Win=18824 Len=0 TSval=262580826 TSecr=552522069"
"90","0.019373","1.1.47.15","1.2.47.114","TCP","70","13467  >  443 [ACK] Seq=1 Ack=1 Win=18824 Len=0 TSval=262584513 TSecr=552470855"
"91","0.021320","1.1.220.61","1.2.106.249","TCP","70","57025  >  443 [ACK] Seq=1 Ack=1 Win=18824 Len=0 TSval=262600087 TSecr=551538741"
"92","0.022108","1.1.110.1","1.2.218.86","TCP","70","29463  >  443 [ACK] Seq=1 Ack=1 Win=18824 Len=0 TSval=262606388 TSecr=551741822"
"93","0.022237","1.1.62.66","1.2.138.165","TCP","70","17256  >  443 [ACK] Seq=1 Ack=1 Win=18824 Len=0 TSval=262607420 TSecr=552521663"
"94","0.022354","1.1.196.17","1.2.112.121","TCP","70","51580  >  443 [ACK] Seq=1 Ack=1 Win=18824 Len=0 TSval=262608357 TSecr=552946522"
"95","0.022883","1.1.221.233","1.2.222.76","TCP","70","28429  >  443 [ACK] Seq=1 Ack=1 Win=18824 Len=0 TSval=262612589 TSecr=552522488"
"96","0.022888","1.2.137.51","1.1.60.222","SSLv3","704","Server Hello, Certificate, Server Key Exchange, Server Hello Done"
"97","0.022893","1.2.57.187","1.1.56.130","SSLv3","704","Server Hello, Certificate, Server Key Exchange, Server Hello Done"
"98","0.022903","1.2.188.171","1.1.8.86","SSLv3","704","Server Hello, Certificate, Server Key Exchange, Server Hello Done"
"99","0.022906","1.2.235.145","1.1.95.23","SSLv3","704","Server Hello, Certificate, Server Key Exchange, Server Hello Done"
"100","0.022911","1.2.98.19","1.1.212.250","SSLv3","704","Server Hello, Certificate, Server Key Exchange, Server Hello Done"
"101","0.022915","1.2.246.142","1.1.66.56","SSLv3","704","Server Hello, Certificate, Server Key Exchange, Server Hello Done"
"102","0.022919","1.2.193.77","1.1.192.235","SSLv3","704","Server Hello, Certificate, Server Key Exchange, Server Hello Done"
"103","0.022927","1.2.111.98","1.1.218.254","SSLv3","704","Server Hello, Certificate, Server Key Exchange, Server Hello Done"
"104","0.022931","1.2.194.43","1.1.193.201","SSLv3","704","Server Hello, Certificate, Server Key Exchange, Server Hello Done"
"105","0.022934","1.2.184.22","1.1.11.193","SSLv3","704","Server Hello, Certificate, Server Key Exchange, Server Hello Done"
"106","0.022938","1.2.27.140","1.1.27.40","SSLv3","704","Server Hello, Certificate, Server Key Exchange, Server Hello Done"
"107","0.022942","1.2.76.109","1.1.248.23","SSLv3","704","Server Hello, Certificate, Server Key Exchange, Server Hello Done"
"108","0.022950","1.2.157.93","1.1.41.8","SSLv3","704","Server Hello, Certificate, Server Key Exchange, Server Hello Done"
"109","0.022954","1.2.94.29","1.1.239.183","SSLv3","704","Server Hello, Certificate, Server Key Exchange, Server Hello Done"
"110","0.022958","1.2.35.170","1.1.151.72","SSLv3","704","Server Hello, Certificate, Server Key Exchange, Server Hello Done"
"111","0.022962","1.2.5.104","1.1.176.245","SSLv3","704","Server Hello, Certificate, Server Key Exchange, Server Hello Done"
"112","0.022966","1.2.139.25","1.1.62.196","SSLv3","704","Server Hello, Certificate, Server Key Exchange, Server Hello Done"
"113","0.023905","1.1.182.202","1.2.3.32","TCP","70","48087  >  443 [ACK] Seq=1 Ack=1 Win=18824 Len=0 TSval=262620768 TSecr=552328455"
"114","0.024116","1.1.8.141","1.2.188.244","TCP","70","3656  >  443 [ACK] Seq=1 Ack=1 Win=18824 Len=0 TSval=262622458 TSecr=552469584"
"115","0.024254","1.1.192.185","1.2.193.18","TCP","70","31215  >  443 [ACK] Seq=1 Ack=1 Win=18824 Len=0 TSval=262623559 TSecr=551940883"
"116","0.024342","1.1.48.126","1.2.48.227","TCP","70","35243  >  443 [ACK] Seq=1 Ack=1 Win=18824 Len=0 TSval=262624262 TSecr=552365352"
"117","0.024350","1.1.34.194","1.2.151.23","TCP","70","10184  >  443 [ACK] Seq=1 Ack=1 Win=18824 Len=0 TSval=262624323 TSecr=551365541"
"118","0.024486","1.1.246.63","1.2.67.72","TCP","70","62744  >  443 [ACK] Seq=1 Ack=1 Win=18824 Len=0 TSval=262625417 TSecr=552470314"
"119","0.025308","1.1.171.153","1.2.171.251","TCP","70","39100  >  443 [ACK] Seq=1 Ack=1 Win=18824 Len=0 TSval=262631991 TSecr=552522102"
"120","0.025582","1.1.42.105","1.2.42.204","TCP","70","12163  >  443 [ACK] Seq=1 Ack=1 Win=18824 Len=0 TSval=262634182 TSecr=552522363"
"121","0.027760","1.1.137.226","1.2.138.59","TCP","70","17126  >  443 [ACK] Seq=1 Ack=1 Win=18824 Len=0 TSval=262651611 TSecr=551538932"
"122","0.028126","1.1.84.214","1.2.225.56","TCP","70","23102  >  443 [ACK] Seq=1 Ack=1 Win=18824 Len=0 TSval=262654537 TSecr=551741955"
"123","0.028499","1.1.224.39","1.2.224.139","TCP","70","22859  >  443 [ACK] Seq=1 Ack=1 Win=18824 Len=0 TSval=262657520 TSecr=552522457"
"124","0.028620","1.1.90.46","1.2.238.131","TCP","70","62256  >  443 [ACK] Seq=1 Ack=1 Win=18824 Len=0 TSval=262658488 TSecr=552946968"
"125","0.028949","1.1.186.224","1.2.187.71","TCP","70","5140  >  443 [ACK] Seq=1 Ack=1 Win=18824 Len=0 TSval=262661116 TSecr=552574127"
"126","0.029320","1.1.248.23","1.2.76.109","TCP","70","64814  >  443 [ACK] Seq=1 Ack=635 Win=18824 Len=0 TSval=262664087 TSecr=553180301"
"127","0.029329","1.2.107.189","1.1.223.89","SSLv3","704","Server Hello, Certificate, Server Key Exchange, Server Hello Done"
"128","0.029334","1.2.55.66","1.1.130.236","SSLv3","704","Server Hello, Certificate, Server Key Exchange, Server Hello Done"
"129","0.029338","1.2.121.125","1.1.205.39","SSLv3","704","Server Hello, Certificate, Server Key Exchange, Server Hello Done"
"130","0.029342","1.2.182.108","1.1.181.231","SSLv3","704","Server Hello, Certificate, Server Key Exchange, Server Hello Done"
"131","0.029346","1.2.66.178","1.1.246.92","SSLv3","704","Server Hello, Certificate, Server Key Exchange, Server Hello Done"
"132","0.029887","1.1.143.71","1.2.59.169","TCP","70","36005  >  443 [ACK] Seq=1 Ack=1 Win=18824 Len=0 TSval=262668619 TSecr=552365248"
"133","0.030401","1.1.142.50","1.2.58.136","TCP","70","37697  >  443 [ACK] Seq=1 Ack=1 Win=18824 Len=0 TSval=262672738 TSecr=552044049"
"134","0.030433","1.1.149.192","1.2.150.217","TCP","70","38115  >  443 [ACK] Seq=1 Ack=1 Win=18824 Len=0 TSval=262672994 TSecr=552470154"
"135","0.030514","1.1.28.13","1.2.169.193","TCP","70","9611  >  443 [ACK] Seq=1 Ack=1 Win=18824 Len=0 TSval=262673635 TSecr=551366266"
"136","0.030807","1.1.151.64","1.2.35.150","TCP","70","10322  >  443 [ACK] Seq=1 Ack=1 Win=18824 Len=0 TSval=262675985 TSecr=552365681"
"137","0.030910","1.1.205.190","1.2.123.147","TCP","70","53238  >  443 [ACK] Seq=1 Ack=1 Win=18824 Len=0 TSval=262676808 TSecr=552470916"
"138","0.031529","1.1.125.68","1.2.201.153","TCP","70","52820  >  443 [ACK] Seq=1 Ack=1 Win=18824 Len=0 TSval=262681759 TSecr=552745226"
"139","0.031769","1.1.110.105","1.2.218.190","TCP","70","57203  >  443 [ACK] Seq=1 Ack=1 Win=18824 Len=0 TSval=262683682 TSecr=552745121"
"140","0.034105","1.1.31.160","1.2.171.245","TCP","70","9390  >  443 [ACK] Seq=1 Ack=1 Win=18824 Len=0 TSval=262702366 TSecr=551539120"
"141","0.034472","1.1.97.33","1.2.214.85","TCP","70","26940  >  443 [ACK] Seq=1 Ack=1 Win=18824 Len=0 TSval=262705300 TSecr=551793315"
"142","0.034673","1.1.118.102","1.2.194.187","TCP","70","51076  >  443 [ACK] Seq=1 Ack=1 Win=18824 Len=0 TSval=262706913 TSecr=552622457"
"143","0.035051","1.1.248.196","1.2.77.26","TCP","70","20964  >  443 [ACK] Seq=1 Ack=635 Win=18824 Len=0 TSval=262709931 TSecr=553138206"
"144","0.035352","1.1.92.128","1.2.232.213","TCP","70","60841  >  443 [ACK] Seq=1 Ack=1 Win=18824 Len=0 TSval=262712345 TSecr=552745196"
"145","0.035589","1.1.181.231","1.2.182.108","TCP","70","1855  >  443 [ACK] Seq=1 Ack=635 Win=18824 Len=0 TSval=262714241 TSecr=553231500"
"146","0.035599","1.2.168.26","1.1.26.113","SSLv3","704","Server Hello, Certificate, Server Key Exchange, Server Hello Done"
"147","0.035604","1.2.80.93","1.1.228.7","SSLv3","704","Server Hello, Certificate, Server Key Exchange, Server Hello Done"
"148","0.035608","1.2.245.144","1.1.245.23","SSLv3","704","Server Hello, Certificate, Server Key Exchange, Server Hello Done"
"149","0.035612","1.2.95.135","1.1.93.106","SSLv3","704","Server Hello, Certificate, Server Key Exchange, Server Hello Done"
"150","0.035616","1.2.81.47","1.1.228.217","SSLv3","704","Server Hello, Certificate, Server Key Exchange, Server Hello Done"
"151","0.035630","1.2.190.88","1.1.189.243","SSLv3","704","Server Hello, Certificate, Server Key Exchange, Server Hello Done"
"152","0.035643","1.2.46.192","1.1.152.186","SSLv3","704","Server Hello, Certificate, Server Key Exchange, Server Hello Done"
"153","0.035650","1.2.25.98","1.1.173.12","SSLv3","704","Server Hello, Certificate, Server Key Exchange, Server Hello Done"
"154","0.035654","1.2.87.60","1.1.226.180","SSLv3","704","Server Hello, Certificate, Server Key Exchange, Server Hello Done"
"155","0.035658","1.2.127.160","1.1.203.60","SSLv3","704","Server Hello, Certificate, Server Key Exchange, Server Hello Done"
"156","0.035667","1.2.248.146","1.1.76.61","SSLv3","704","Server Hello, Certificate, Server Key Exchange, Server Hello Done"
"157","0.035671","1.2.217.245","1.1.223.127","SSLv3","704","Server Hello, Certificate, Server Key Exchange, Server Hello Done"
"158","0.035676","1.2.211.27","1.1.100.61","SSLv3","704","Server Hello, Certificate, Server Key Exchange, Server Hello Done"
"159","0.035679","1.2.24.135","1.1.172.49","SSLv3","704","Server Hello, Certificate, Server Key Exchange, Server Hello Done"
"160","0.035683","1.2.199.243","1.1.199.154","SSLv3","704","Server Hello, Certificate, Server Key Exchange, Server Hello Done"
"161","0.036340","1.1.84.165","1.2.224.250","TCP","70","22968  >  443 [ACK] Seq=1 Ack=1 Win=18824 Len=0 TSval=262720242 TSecr=552469719"
"162","0.036682","1.1.234.198","1.2.95.28","TCP","70","25562  >  443 [ACK] Seq=1 Ack=1 Win=18824 Len=0 TSval=262722986 TSecr=552470633"
"163","0.036788","1.1.50.24","1.2.134.109","TCP","70","14118  >  443 [ACK] Seq=1 Ack=1 Win=18824 Len=0 TSval=262723830 TSecr=552112034"
"164","0.036896","1.1.98.116","1.2.214.201","TCP","70","56195  >  443 [ACK] Seq=1 Ack=1 Win=18824 Len=0 TSval=262724693 TSecr=551366778"
"165","0.037048","1.1.85.155","1.2.225.240","TCP","70","59037  >  443 [ACK] Seq=1 Ack=1 Win=18824 Len=0 TSval=262725911 TSecr=552365874"
"166","0.037278","1.1.45.155","1.2.155.229","TCP","70","14403  >  443 [ACK] Seq=1 Ack=1 Win=18824 Len=0 TSval=262727751 TSecr=552521760"
"167","0.037894","1.1.46.135","1.2.154.239","TCP","70","40888  >  443 [ACK] Seq=1 Ack=1 Win=18824 Len=0 TSval=262732675 TSecr=552845278"
"168","0.038171","1.1.76.70","1.2.248.155","TCP","70","20808  >  443 [ACK] Seq=1 Ack=1 Win=18824 Len=0 TSval=262734893 TSecr=552845370"
"169","0.040509","1.1.237.192","1.2.90.40","TCP","70","62193  >  443 [ACK] Seq=1 Ack=1 Win=18824 Len=0 TSval=262753601 TSecr=551539312"
"170","0.041107","1.1.171.172","1.2.32.3","TCP","70","9464  >  443 [ACK] Seq=1 Ack=1 Win=18824 Len=0 TSval=262758380 TSecr=552844673"
"171","0.041404","1.1.189.172","1.2.191.89","TCP","70","48861  >  443 [ACK] Seq=1 Ack=635 Win=18824 Len=0 TSval=262760759 TSecr=553138282"
"172","0.041706","1.1.190.235","1.2.11.65","TCP","70","4095  >  443 [ACK] Seq=1 Ack=1 Win=18824 Len=0 TSval=262763176 TSecr=552745319"
"173","0.041896","1.1.161.54","1.2.22.88","TCP","70","7254  >  443 [ACK] Seq=1 Ack=1 Win=18824 Len=0 TSval=262764698 TSecr=551934407"
"174","0.041931","1.1.76.61","1.2.248.146","TCP","70","64847  >  443 [ACK] Seq=1 Ack=635 Win=18824 Len=0 TSval=262764973 TSecr=553282102"
"175","0.041940","1.2.156.70","1.1.39.241","SSLv3","704","Server Hello, Certificate, Server Key Exchange, Server Hello Done"
"176","0.041945","1.2.1.249","1.1.181.145","SSLv3","704","Server Hello, Certificate, Server Key Exchange, Server Hello Done"
"177","0.041949","1.2.235.15","1.1.94.186","SSLv3","704","Server Hello, Certificate, Server Key Exchange, Server Hello Done"
"178","0.041953","1.2.53.25","1.1.128.183","SSLv3","704","Server Hello, Certificate, Server Key Exchange, Server Hello Done"
"179","0.041957","1.2.122.230","1.1.206.144","SSLv3","704","Server Hello, Certificate, Server Key Exchange, Server Hello Done"
"180","0.041971","1.2.94.253","1.1.234.167","SSLv3","704","Server Hello, Certificate, Server Key Exchange, Server Hello Done"
"181","0.041975","1.2.39.155","1.1.147.55","SSLv3","704","Server Hello, Certificate, Server Key Exchange, Server Hello Done"
"182","0.041979","1.2.109.134","1.1.217.48","SSLv3","704","Server Hello, Certificate, Server Key Exchange, Server Hello Done"
"183","0.041983","1.2.129.72","1.1.52.243","SSLv3","704","Server Hello, Certificate, Server Key Exchange, Server Hello Done"
"184","0.041987","1.2.248.102","1.1.76.17","SSLv3","704","Server Hello, Certificate, Server Key Exchange, Server Hello Done"
"185","0.042714","1.1.228.217","1.2.81.47","TCP","70","59878  >  443 [ACK] Seq=1 Ack=635 Win=18824 Len=0 TSval=262771237 TSecr=553281691"
"186","0.042722","1.1.211.177","1.2.104.8","TCP","70","57651  >  443 [ACK] Seq=1 Ack=1 Win=18824 Len=0 TSval=262771304 TSecr=552469926"
"187","0.042958","1.1.119.211","1.2.204.41","TCP","70","32075  >  443 [ACK] Seq=1 Ack=1 Win=18824 Len=0 TSval=262773191 TSecr=552521964"
"188","0.043149","1.1.35.252","1.2.144.81","TCP","70","38164  >  443 [ACK] Seq=1 Ack=1 Win=18824 Len=0 TSval=262774720 TSecr=552161176"
"189","0.043150","1.1.93.187","1.2.234.35","TCP","70","61162  >  443 [ACK] Seq=1 Ack=1 Win=18824 Len=0 TSval=262774723 TSecr=551438866"
"190","0.043461","1.1.27.26","1.2.168.68","TCP","70","8749  >  443 [ACK] Seq=1 Ack=1 Win=18824 Len=0 TSval=262777212 TSecr=552366096"
"191","0.043801","1.1.117.103","1.2.193.220","TCP","70","50953  >  443 [ACK] Seq=1 Ack=1 Win=18824 Len=0 TSval=262779938 TSecr=552522299"
"192","0.044130","1.1.163.70","1.2.23.170","TCP","70","45155  >  443 [ACK] Seq=1 Ack=1 Win=18824 Len=0 TSval=262782566 TSecr=552896489"
"193","0.044268","1.1.166.144","1.2.161.13","TCP","70","7270  >  443 [ACK] Seq=1 Ack=1 Win=18824 Len=0 TSval=262783670 TSecr=552947162"
"194","0.046948","1.1.152.195","1.2.45.25","TCP","70","40395  >  443 [ACK] Seq=1 Ack=1 Win=18824 Len=0 TSval=262805109 TSecr=551539506"
"195","0.047157","1.1.205.205","1.2.208.0","TCP","70","47150  >  443 [ACK] Seq=1 Ack=1 Win=18824 Len=0 TSval=262806786 TSecr=552947002"
"196","0.047840","1.1.182.239","1.2.3.69","TCP","70","48115  >  443 [ACK] Seq=1 Ack=635 Win=18824 Len=0 TSval=262812248 TSecr=553138313"
"197","0.048161","1.1.212.250","1.2.213.83","TCP","70","26139  >  443 [ACK] Seq=1 Ack=1 Win=18824 Len=0 TSval=262814813 TSecr=552745482"
"198","0.048244","1.1.147.55","1.2.39.155","TCP","70","11347  >  443 [ACK] Seq=1 Ack=635 Win=18824 Len=0 TSval=262815475 TSecr=553332563"
"199","0.048252","1.2.101.6","1.1.215.233","SSLv3","704","Server Hello, Certificate, Server Key Exchange, Server Hello Done"
"200","0.048289","1.1.236.246","1.2.89.127","TCP","70","62064  >  443 [ACK] Seq=1 Ack=1 Win=18824 Len=0 TSval=262815837 TSecr=551940845"
"201","0.048984","1.1.160.80","1.2.160.202","TCP","70","6583  >  443 [ACK] Seq=1 Ack=1 Win=18824 Len=0 TSval=262821402 TSecr=552470254"
"202","0.049036","1.1.199.154","1.2.199.243","TCP","70","50359  >  443 [ACK] Seq=1 Ack=635 Win=18824 Len=0 TSval=262821816 TSecr=553282230"
"203","0.049325","1.1.125.86","1.2.201.171","TCP","70","52825  >  443 [ACK] Seq=1 Ack=1 Win=18824 Len=0 TSval=262824125 TSecr=552622593"
"204","0.049399","1.1.192.70","1.2.116.182","TCP","70","50551  >  443 [ACK] Seq=1 Ack=1 Win=18824 Len=0 TSval=262824722 TSecr=551538391"
"205","0.049438","1.1.32.230","1.2.35.151","TCP","70","11295  >  443 [ACK] Seq=1 Ack=1 Win=18824 Len=0 TSval=262825033 TSecr=552210828"
"206","0.049448","1.2.45.201","1.1.45.103","SSLv3","704","Server Hello, Certificate, Server Key Exchange, Server Hello Done"
"207","0.049458","1.2.142.142","1.1.58.57","SSLv3","704","Server Hello, Certificate, Server Key Exchange, Server Hello Done"
"208","0.049465","1.2.135.32","1.1.50.203","SSLv3","704","Server Hello, Certificate, Server Key Exchange, Server Hello Done"
"209","0.049842","1.1.78.214","1.2.251.43","TCP","70","65514  >  443 [ACK] Seq=1 Ack=1 Win=18824 Len=0 TSval=262828264 TSecr=552470060"
"210","0.050175","1.1.232.67","1.2.232.166","TCP","70","24934  >  443 [ACK] Seq=1 Ack=1 Win=18824 Len=0 TSval=262830924 TSecr=552574095"
"211","0.050418","1.1.93.16","1.2.233.101","TCP","70","25132  >  443 [ACK] Seq=1 Ack=1 Win=18824 Len=0 TSval=262832873 TSecr=552946836"
"212","0.050628","1.1.165.169","1.2.18.0","TCP","70","5829  >  443 [ACK] Seq=1 Ack=1 Win=18824 Len=0 TSval=262834550 TSecr=552947258"
"213","0.053319","1.1.11.196","1.2.184.25","TCP","70","48365  >  443 [ACK] Seq=1 Ack=1 Win=18824 Len=0 TSval=262856079 TSecr=551539599"
"214","0.053548","1.1.174.2","1.2.26.88","TCP","70","45840  >  443 [ACK] Seq=1 Ack=1 Win=18824 Len=0 TSval=262857913 TSecr=552947033"
"215","0.054205","1.1.8.86","1.2.188.171","TCP","70","3449  >  443 [ACK] Seq=1 Ack=635 Win=18824 Len=0 TSval=262863163 TSecr=553179984"
"216","0.054210","1.2.162.105","1.1.161.243","SSLv3","704","Server Hello, Certificate, Server Key Exchange, Server Hello Done"
"217","0.054215","1.2.78.41","1.1.249.158","SSLv3","704","Server Hello, Certificate, Server Key Exchange, Server Hello Done"
"218","0.054219","1.2.133.102","1.1.49.17","SSLv3","704","Server Hello, Certificate, Server Key Exchange, Server Hello Done"
"219","0.054223","1.2.45.87","1.1.153.1","SSLv3","704","Server Hello, Certificate, Server Key Exchange, Server Hello Done"
"220","0.054291","1.1.222.199","1.2.107.29","TCP","70","58324  >  443 [ACK] Seq=1 Ack=1 Win=18824 Len=0 TSval=262863852 TSecr=552844514"
"221","0.054578","1.1.223.192","1.2.108.22","TCP","70","56528  >  443 [ACK] Seq=1 Ack=1 Win=18824 Len=0 TSval=262866148 TSecr=552112066"
"222","0.055149","1.1.178.160","1.2.6.246","TCP","70","47022  >  443 [ACK] Seq=1 Ack=1 Win=18824 Len=0 TSval=262870716 TSecr=552470284"
"223","0.055312","1.1.181.145","1.2.1.249","TCP","70","1722  >  443 [ACK] Seq=1 Ack=635 Win=18824 Len=0 TSval=262872019 TSecr=553332326"
"224","0.055668","1.1.247.213","1.2.68.240","TCP","70","19202  >  443 [ACK] Seq=1 Ack=1 Win=18824 Len=0 TSval=262874868 TSecr=552622768"
"225","0.055797","1.1.57.126","1.2.57.224","TCP","70","16040  >  443 [ACK] Seq=1 Ack=1 Win=18824 Len=0 TSval=262875905 TSecr=551539055"
"226","0.055848","1.1.105.199","1.2.222.28","TCP","70","58074  >  443 [ACK] Seq=1 Ack=1 Win=18824 Len=0 TSval=262876313 TSecr=552261446"
"227","0.056150","1.1.254.119","1.2.74.205","TCP","70","20370  >  443 [ACK] Seq=1 Ack=1 Win=18824 Len=0 TSval=262878729 TSecr=552470536"
"228","0.056470","1.1.182.185","1.2.3.15","TCP","70","1998  >  443 [ACK] Seq=1 Ack=1 Win=18824 Len=0 TSval=262881284 TSecr=552622831"
"229","0.056902","1.1.175.234","1.2.88.187","TCP","70","62382  >  443 [ACK] Seq=1 Ack=635 Win=18824 Len=0 TSval=262884739 TSecr=552997137"
"230","0.059961","1.1.9.55","1.2.189.140","TCP","70","3678  >  443 [ACK] Seq=1 Ack=1 Win=18824 Len=0 TSval=262909210 TSecr=552947096"
"231","0.060411","1.1.95.23","1.2.235.145","TCP","70","55437  >  443 [ACK] Seq=1 Ack=635 Win=18824 Len=0 TSval=262912814 TSecr=553180015"
"232","0.060443","1.1.215.233","1.2.101.6","TCP","70","55221  >  443 [ACK] Seq=1 Ack=635 Win=18824 Len=0 TSval=262913070 TSecr=553382783"
"233","0.060755","1.1.18.208","1.2.19.54","TCP","70","44001  >  443 [ACK] Seq=1 Ack=1 Win=18824 Len=0 TSval=262915570 TSecr=552844706"
"234","0.060944","1.1.42.59","1.2.158.156","TCP","70","12122  >  443 [ACK] Seq=1 Ack=1 Win=18824 Len=0 TSval=262917077 TSecr=552161701"
"235","0.061252","1.1.246.18","1.2.66.104","TCP","70","18215  >  443 [ACK] Seq=1 Ack=1 Win=18824 Len=0 TSval=262919542 TSecr=551539697"
"236","0.061338","1.1.6.191","1.2.179.20","TCP","70","3036  >  443 [ACK] Seq=1 Ack=1 Win=18824 Len=0 TSval=262920227 TSecr=552522237"
"237","0.061347","1.1.234.167","1.2.94.253","TCP","70","61355  >  443 [ACK] Seq=1 Ack=635 Win=18824 Len=0 TSval=262920303 TSecr=553332530"
"238","0.061794","1.1.149.236","1.2.34.66","TCP","70","9984  >  443 [ACK] Seq=1 Ack=1 Win=18824 Len=0 TSval=262923878 TSecr=552261547"
"239","0.061801","1.1.11.97","1.2.184.120","TCP","70","48778  >  443 [ACK] Seq=1 Ack=1 Win=18824 Len=0 TSval=262923937 TSecr=552622930"
"240","0.061820","1.1.122.195","1.2.207.25","TCP","70","32794  >  443 [ACK] Seq=1 Ack=1 Win=18824 Len=0 TSval=262924083 TSecr=551539217"
"241","0.061945","1.1.128.64","1.2.52.150","TCP","70","34142  >  443 [ACK] Seq=1 Ack=635 Win=18824 Len=0 TSval=262925089 TSecr=553125304"
"242","0.062250","1.1.116.18","1.2.192.103","TCP","70","31028  >  443 [ACK] Seq=1 Ack=1 Win=18824 Len=0 TSval=262927530 TSecr=552470793"
"243","0.062483","1.1.97.84","1.2.97.184","TCP","70","26211  >  443 [ACK] Seq=1 Ack=1 Win=18824 Len=0 TSval=262929390 TSecr=552745055"
"244","0.063236","1.1.22.94","1.2.162.200","TCP","70","7083  >  443 [ACK] Seq=1 Ack=635 Win=18824 Len=0 TSval=262935418 TSecr=553125207"
"245","0.066202","1.1.101.55","1.2.104.0","TCP","70","56437  >  443 [ACK] Seq=1 Ack=635 Win=18824 Len=0 TSval=262959145 TSecr=552997232"
"246","0.066656","1.1.50.203","1.2.135.32","TCP","70","14297  >  443 [ACK] Seq=1 Ack=635 Win=18824 Len=0 TSval=262962773 TSecr=553392484"
"247","0.066668","1.2.142.196","1.1.57.74","SSLv3","704","Server Hello, Certificate, Server Key Exchange, Server Hello Done"
"248","0.066673","1.2.46.81","1.1.153.237","SSLv3","704","Server Hello, Certificate, Server Key Exchange, Server Hello Done"
"249","0.066677","1.2.116.131","1.1.192.45","SSLv3","704","Server Hello, Certificate, Server Key Exchange, Server Hello Done"
"250","0.066681","1.2.253.52","1.1.70.72","SSLv3","704","Server Hello, Certificate, Server Key Exchange, Server Hello Done"
"251","0.066718","1.1.11.193","1.2.184.22","TCP","70","48338  >  443 [ACK] Seq=1 Ack=635 Win=18824 Len=0 TSval=262963267 TSecr=553180239"
"252","0.066891","1.1.189.231","1.2.190.64","TCP","70","3832  >  443 [ACK] Seq=1 Ack=1 Win=18824 Len=0 TSval=262964656 TSecr=552844738"
"253","0.067184","1.1.131.196","1.2.56.26","TCP","70","37077  >  443 [ACK] Seq=1 Ack=1 Win=18824 Len=0 TSval=262966998 TSecr=552161763"
"254","0.067432","1.1.255.208","1.2.76.38","TCP","70","20715  >  443 [ACK] Seq=1 Ack=1 Win=18824 Len=0 TSval=262968979 TSecr=552522427"
"255","0.067496","1.1.128.20","1.2.52.106","TCP","70","34081  >  443 [ACK] Seq=1 Ack=1 Win=18824 Len=0 TSval=262969491 TSecr=551741858"
"256","0.067731","1.1.8.231","1.2.189.76","TCP","70","49780  >  443 [ACK] Seq=1 Ack=1 Win=18824 Len=0 TSval=262971375 TSecr=551539823"
"257","0.067840","1.1.157.238","1.2.42.82","TCP","70","41737  >  443 [ACK] Seq=1 Ack=1 Win=18824 Len=0 TSval=262972248 TSecr=552996700"
"258","0.068094","1.1.159.168","1.2.152.1","TCP","70","12479  >  443 [ACK] Seq=1 Ack=1 Win=18824 Len=0 TSval=262974280 TSecr=552326644"
"259","0.068169","1.1.218.254","1.2.111.98","TCP","70","51237  >  443 [ACK] Seq=1 Ack=635 Win=18824 Len=0 TSval=262974879 TSecr=553180178"
"260","0.068421","1.1.161.142","1.2.21.228","TCP","70","42652  >  443 [ACK] Seq=1 Ack=1 Win=18824 Len=0 TSval=262976896 TSecr=552622499"
"261","0.068659","1.1.82.52","1.2.230.151","TCP","70","22413  >  443 [ACK] Seq=1 Ack=1 Win=18824 Len=0 TSval=262978799 TSecr=552844991"
"262","0.069485","1.1.211.81","1.2.220.11","TCP","70","57598  >  443 [ACK] Seq=1 Ack=635 Win=18824 Len=0 TSval=262985410 TSecr=553138068"
"263","0.069490","1.2.15.196","1.1.187.110","SSLv3","704","Server Hello, Certificate, Server Key Exchange, Server Hello Done"
"264","0.072575","1.1.238.179","1.2.239.21","TCP","70","62403  >  443 [ACK] Seq=1 Ack=635 Win=18824 Len=0 TSval=263010122 TSecr=553125336"
"265","0.073007","1.1.239.183","1.2.94.29","TCP","70","55679  >  443 [ACK] Seq=1 Ack=635 Win=18824 Len=0 TSval=263013584 TSecr=553180397"
"266","0.073043","1.1.12.183","1.2.185.12","TCP","70","48569  >  443 [ACK] Seq=1 Ack=1 Win=18824 Len=0 TSval=263013869 TSecr=552844798"
"267","0.073416","1.1.31.252","1.2.32.110","TCP","70","39209  >  443 [ACK] Seq=1 Ack=1 Win=18824 Len=0 TSval=263016852 TSecr=552844768"
"268","0.073424","1.1.175.195","1.2.28.25","TCP","70","8407  >  443 [ACK] Seq=1 Ack=1 Win=18824 Len=0 TSval=263016919 TSecr=552210922"
"269","0.073730","1.1.250.167","1.2.251.1","TCP","70","21524  >  443 [ACK] Seq=1 Ack=1 Win=18824 Len=0 TSval=263019363 TSecr=551741891"
"270","0.073860","1.1.57.74","1.2.142.196","TCP","70","36664  >  443 [ACK] Seq=1 Ack=635 Win=18824 Len=0 TSval=263020405 TSecr=553530110"
"271","0.073876","1.2.21.101","1.1.167.127","SSLv3","704","Server Hello, Certificate, Server Key Exchange, Server Hello Done"
"272","0.073881","1.2.122.25","1.1.205.177","SSLv3","704","Server Hello, Certificate, Server Key Exchange, Server Hello Done"
"273","0.073885","1.2.63.43","1.1.62.197","SSLv3","704","Server Hello, Certificate, Server Key Exchange, Server Hello Done"
"274","0.073889","1.2.30.150","1.1.170.46","SSLv3","704","Server Hello, Certificate, Server Key Exchange, Server Hello Done"
"275","0.073893","1.2.175.188","1.1.26.141","SSLv3","704","Server Hello, Certificate, Server Key Exchange, Server Hello Done"
"276","0.073901","1.2.30.110","1.1.30.0","SSLv3","704","Server Hello, Certificate, Server Key Exchange, Server Hello Done"
"277","0.073905","1.2.143.163","1.1.59.78","SSLv3","704","Server Hello, Certificate, Server Key Exchange, Server Hello Done"
"278","0.073909","1.2.159.97","1.1.43.12","SSLv3","704","Server Hello, Certificate, Server Key Exchange, Server Hello Done"
"279","0.073913","1.2.82.102","1.1.229.254","SSLv3","704","Server Hello, Certificate, Server Key Exchange, Server Hello Done"
"280","0.073917","1.2.37.81","1.1.144.251","SSLv3","704","Server Hello, Certificate, Server Key Exchange, Server Hello Done"
"281","0.073925","1.2.3.6","1.1.2.164","SSLv3","704","Server Hello, Certificate, Server Key Exchange, Server Hello Done"
"282","0.073929","1.2.55.41","1.1.54.194","SSLv3","704","Server Hello, Certificate, Server Key Exchange, Server Hello Done"
"283","0.073933","1.2.21.10","1.1.166.123","SSLv3","704","Server Hello, Certificate, Server Key Exchange, Server Hello Done"
"284","0.073937","1.2.29.14","1.1.28.154","SSLv3","704","Server Hello, Certificate, Server Key Exchange, Server Hello Done"
"285","0.073941","1.2.176.240","1.1.4.155","SSLv3","704","Server Hello, Certificate, Server Key Exchange, Server Hello Done"
"286","0.073949","1.2.78.34","1.1.249.4","SSLv3","704","Server Hello, Certificate, Server Key Exchange, Server Hello Done"
"287","0.073953","1.2.232.220","1.1.232.131","SSLv3","704","Server Hello, Certificate, Server Key Exchange, Server Hello Done"
"288","0.073957","1.2.142.11","1.1.57.182","SSLv3","704","Server Hello, Certificate, Server Key Exchange, Server Hello Done"
"289","0.073961","1.2.5.29","1.1.176.199","SSLv3","704","Server Hello, Certificate, Server Key Exchange, Server Hello Done"
"290","0.073965","1.2.226.203","1.1.86.104","SSLv3","704","Server Hello, Certificate, Server Key Exchange, Server Hello Done"
"291","0.073973","1.2.62.171","1.1.138.85","SSLv3","704","Server Hello, Certificate, Server Key Exchange, Server Hello Done"
"292","0.073977","1.2.59.104","1.1.143.18","SSLv3","704","Server Hello, Certificate, Server Key Exchange, Server Hello Done"
"293","0.073981","1.2.239.173","1.1.238.81","SSLv3","704","Server Hello, Certificate, Server Key Exchange, Server Hello Done"
"294","0.073985","1.2.4.242","1.1.176.142","SSLv3","704","Server Hello, Certificate, Server Key Exchange, Server Hello Done"
"295","0.073989","1.2.36.13","1.1.151.183","SSLv3","704","Server Hello, Certificate, Server Key Exchange, Server Hello Done"
"296","0.073997","1.2.56.187","1.1.140.101","SSLv3","704","Server Hello, Certificate, Server Key Exchange, Server Hello Done"
"297","0.074001","1.2.209.112","1.1.101.27","SSLv3","704","Server Hello, Certificate, Server Key Exchange, Server Hello Done"
"298","0.074005","1.2.242.74","1.1.69.245","SSLv3","704","Server Hello, Certificate, Server Key Exchange, Server Hello Done"
"299","0.074009","1.2.74.125","1.1.254.27","SSLv3","704","Server Hello, Certificate, Server Key Exchange, Server Hello Done"
"300","0.074013","1.2.136.72","1.1.58.74","SSLv3","704","Server Hello, Certificate, Server Key Exchange, Server Hello Done"
"301","0.074016","1.1.198.186","1.2.115.45","TCP","70","50181  >  443 [ACK] Seq=1 Ack=635 Win=18824 Len=0 TSval=263021653 TSecr=552997201"
"302","0.074021","1.2.116.33","1.1.115.170","SSLv3","704","Server Hello, Certificate, Server Key Exchange, Server Hello Done"
"303","0.074026","1.2.202.247","1.1.202.144","SSLv3","704","Server Hello, Certificate, Server Key Exchange, Server Hello Done"
"304","0.074030","1.2.49.141","1.1.133.55","SSLv3","704","Server Hello, Certificate, Server Key Exchange, Server Hello Done"
